,phrases,frequency
6890,the product is ombudsman,1
6891,the product it account,1
6892,the product it not,2
6893,the product just sent,1
6894,the product light blue,1
6895,the product lousi came,1
6896,the product miss soon,1
6897,the product more thirti,1
6898,the product my money,1
6899,the product not adapt,1
6900,the product not arriv,4
6901,the product not come,2
6902,the product not correspond,2
6903,the product not deliv,3
6904,the product not enter,1
6905,the product not even,1
6906,the product not targaryen,1
6907,the product not the,3
6908,the product not transport,1
6909,the product not worth,1
6910,the product not yet,3
6911,the product noth the,1
6912,the product offer it,1
6913,the product one hundr,1
6914,the product origin the,1
6915,the product past role,1
6916,the product photo the,2
6917,the product post strike,1
6918,the product purchas ask,1
6919,the product purchas is,1
6920,the product purchas the,1
6921,the product reach way,1
6922,the product receiv base,1
6923,the product receiv howev,1
6924,the product reimburs the,1
6925,the product seem be,2
6926,the product send wa,1
6927,the product serv model,1
6928,the product so far,2
6929,the product sold the,1
6930,the product someon els,2
6931,the product stark targaryen,1
6932,the product still arriv,1
6933,the product thank the,1
6934,the product the code,1
6935,the product the distribut,1
6936,the product the pan,1
6937,the product the revers,1
6938,the product the same,1
6939,the product the seller,1
6940,the product the site,1
6941,the product the store,1
6942,the product they inform,1
6943,the product thi time,1
6944,the product time still,1
6945,the product unfortun janitor,1
6946,the product veri expens,1
6947,the product veri small,1
6948,the product visual do,1
6949,the product visual the,1
6950,the product wa an,1
6951,the product wa deliv,1
6952,the product wa miss,1
6953,the product wa outrag,1
6954,the product wa present,1
6955,the product wa sold,1
6956,the product wait back,1
6957,the product want repay,1
6958,the product want return,2
6959,the product well the,1
6960,the product went the,1
6961,the product were two,1
6962,the product you noth,1
6963,the progress came broken,1
6964,the proper care care,1
6965,the provis an evalu,1
6966,the purchas act hope,1
6967,the purchas am satisfi,1
6968,the purchas be revers,1
6969,the purchas cancel not,1
6970,the purchas could bought,1
6971,the purchas gt key,1
6972,the purchas made canist,1
6973,the purchas need be,1
6974,the purchas payment discov,1
6975,the purchas payment insid,1
6976,the purchas perform give,1
6977,the purchas product made,1
6978,the purchas purchas cancel,1
6979,the purchas the site,1
6980,the purchas until today,1
6981,the purchas want the,1
6982,the purpl fantasi quilt,1
6983,the qualiti label watch,1
6984,the qualiti store one,1
6985,the qualiti the product,2
6986,the qualiti well lower,1
6987,the quantiti bad total,1
6988,the queen size bed,1
6989,the read the address,1
6990,the rear camera scratch,1
6991,the reason such delay,1
6992,the reason the delay,1
6993,the receipt the product,1
6994,the recipi howev the,1
6995,the recommend film gel,1
6996,the refer my request,1
6997,the refer request now,1
6998,the reimburs the differ,1
6999,the releas evolut want,1
7000,the remain two chair,1
7001,the remaind the purchas,1
7002,the repeat product anoth,1
7003,the request accept wa,1
7004,the request await guidanc,3
7005,the request await return,1
7006,the request be withdrawn,1
7007,the request bill separ,1
7008,the request cancel did,1
7009,the request in hurri,1
7010,the request is two,1
7011,the request item send,1
7012,the request my purchas,1
7013,the request nonexist sac,1
7014,the request receiv order,1
7015,the request the money,1
7016,the request the nf,1
7017,the request the product,1
7018,the request the site,1
7019,the request they creat,1
7020,the request to to,1
7021,the request wa incomplet,1
7022,the request want the,1
7023,the request will happen,1
7024,the request year the,1
7025,the respons from canist,1
7026,the respons store ngm,1
7027,the respons your want,1
7028,the rest await provis,1
7029,the rest the request,1
7030,the rest the tire,1
7031,the return canist not,1
7032,the return credit voucher,1
7033,the return imposs is,1
7034,the return it deliveri,1
7035,the return my money,1
7036,the return restitut my,1
7037,the return send the,1
7038,the return so far,1
7039,the return still await,1
7040,the return the money,1
7041,the return the product,4
7042,the revers the card,1
7043,the revers the high,1
7044,the right perfum my,1
7045,the right soon eras,1
7046,the rose region brush,1
7047,the sac phone answer,1
7048,the sale badli made,1
7049,the sale the eve,1
7050,the sale the exchang,1
7051,the sale to pay,1
7052,the same came amend,1
7053,the same chair anoth,1
7054,the same crap want,1
7055,the same longer work,1
7056,the same product replenish,1
7057,the same receiv one,1
7058,the same the purchas,1
7059,the same time ask,1
7060,the same turn and,1
7061,the samsung brand much,1
7062,the screen are wait,1
7063,the screen gave work,1
7064,the screen the product,1
7065,the screen wa alreadi,1
7066,the screen wa smaller,1
7067,the se the mail,1
7068,the seal glu the,1
7069,the second day use,1
7070,the second feedback the,1
7071,the second item len,1
7072,the second of the,1
7073,the second purchas the,1
7074,the sede option prefer,1
7075,the seller inform request,1
7076,the seller it send,1
7077,the seller non deliveri,1
7078,the seller not give,1
7079,the seller not take,1
7080,the seller so far,1
7081,the seller until hj,1
7082,the seller wait make,1
7083,the seller wait six,1
7084,the seller would like,1
7085,the seller you problem,1
7086,the sender canist com,1
7087,the separ the product,1
7088,the servic have lot,1
7089,the servic the deliveri,1
7090,the seven product bought,1
7091,the sheet alreadi paid,1
7092,the ship box pack,1
7093,the ship code not,1
7094,the shirt induc think,1
7095,the shower deliv came,1
7096,the showtim second purchas,1
7097,the side the citi,2
7098,the singl blue marin,1
7099,the site addit not,1
7100,the site announc you,1
7101,the site ask deliv,1
7102,the site canist com,1
7103,the site canist think,2
7104,the site demand money,1
7105,the site differ the,1
7106,the site diverg product,1
7107,the site doe not,1
7108,the site five the,1
7109,the site ha alreadi,1
7110,the site ha go,1
7111,the site imag one,1
7112,the site in the,1
7113,the site inform receiv,1
7114,the site inform the,1
7115,the site it alreadi,1
7116,the site ll give,1
7117,the site lock the,1
7118,the site miss the,1
7119,the site need help,1
7120,the site nine eight,1
7121,the site no respons,1
7122,the site not give,1
7123,the site say product,1
7124,the site the canist,1
7125,the site the item,1
7126,the site the oper,2
7127,the site the product,1
7128,the site the store,1
7129,the site time the,1
7130,the site tri fill,1
7131,the site valu thi,1
7132,the site wa deliv,1
7133,the site wait the,1
7134,the site well disappoint,1
7135,the situat understand the,1
7136,the sixteenth the last,1
7137,the size not suitabl,1
7138,the size the product,1
7139,the size the shirt,1
7140,the size were sold,1
7141,the skirt not straight,1
7142,the skirt the cradl,1
7143,the small box prove,1
7144,the snake the time,1
7145,the solid state ivan,1
7146,the solut will give,1
7147,the sound is good,1
7148,the sound low and,1
7149,the southern region live,1
7150,the specifi the site,1
7151,the speed reduc button,2
7152,the stark not respons,1
7153,the stark websit not,2
7154,the stark websit realli,1
7155,the statu state deliv,1
7156,the statu where wa,1
7157,the stethoscop not arriv,1
7158,the sticker card came,1
7159,the stipul deadlin did,1
7160,the stipul deadlin use,1
7161,the store as doorway,1
7162,the store contact hit,1
7163,the store continu without,1
7164,the store detail still,1
7165,the store did put,1
7166,the store did receiv,1
7167,the store expect qualiti,1
7168,the store fault someth,1
7169,the store given did,1
7170,the store hope they,1
7171,the store in troubl,1
7172,the store is neg,1
7173,the store it the,1
7174,the store joke right,1
7175,the store make the,1
7176,the store never problem,1
7177,the store not say,1
7178,the store not suitabl,1
7179,the store noth complain,1
7180,the store question receiv,1
7181,the store receiv return,1
7182,the store refus exchang,1
7183,the store relat the,2
7184,the store return me,1
7185,the store take but,1
7186,the store the product,1
7187,the store to thi,1
7188,the store to use,1
7189,the store with the,1
7190,the store with you,1
7191,the store you just,1
7192,the street not pass,1
7193,the strike delay occur,1
7194,the strike truck driver,1
7195,the structur alreadi crack,1
7196,the sub nica never,1
7197,the supplier respons what,1
7198,the supplier week no,1
7199,the support the lord,1
7200,the support the top,1
7201,the system ineffici doe,1
7202,the tabl the chair,1
7203,the tablecloth without anoth,1
7204,the tast open thought,1
7205,the tea all pour,1
7206,the tea infus german,1
7207,the techno gadget mega,1
7208,the test product not,1
7209,the third receiv two,1
7210,the thirti two card,1
7211,the three product far,1
7212,the three purchas item,1
7213,the three sent one,1
7214,the three smart televis,1
7215,the time bought yet,1
7216,the time not deliv,1
7217,the time purchas bought,1
7218,the time purchas clear,1
7219,the time purchas sixteen,1
7220,the time purchas written,1
7221,the time the consign,1
7222,the time the product,1
7223,the time took of,1
7224,the tire will return,1
7225,the top bad slip,1
7226,the top seem good,1
7227,the total valu the,1
7228,the tower realli want,1
7229,the track car tractor,1
7230,the track ha alreadi,2
7231,the track inform appear,1
7232,the track say ve,1
7233,the transact made their,1
7234,the twenti five otherwis,1
7235,the twenti fourth the,1
7236,the twenti one the,1
7237,the twenti three four,1
7238,the twenti two are,1
7239,the twenti unit wait,1
7240,the two afraid not,1
7241,the two book purchas,1
7242,the two bought not,1
7243,the two button the,1
7244,the two day mention,1
7245,the two far did,1
7246,the two horribl product,1
7247,the two hundr twenti,1
7248,the two item disappoint,1
7249,the two luminari simpli,1
7250,the two made the,1
7251,the two miss unit,1
7252,the two safe gave,1
7253,the undef clock bought,1
7254,the undertak the compani,1
7255,the valid win in,1
7256,the valu alreadi paid,1
7257,the valu had calcul,1
7258,the valu one spray,1
7259,the valu proven two,1
7260,the valu spent go,1
7261,the valu the account,1
7262,the valu the card,1
7263,the valu the cartridg,1
7264,the valu the product,3
7265,the valu the purchas,1
7266,the vase do not,1
7267,the voic appear one,1
7268,the voic are two,2
7269,the voic arriv one,1
7270,the voic came differ,2
7271,the voic came the,1
7272,the voic found strang,1
7273,the voic list the,1
7274,the voic my card,1
7275,the voic onli issu,1
7276,the voic os two,1
7277,the voic relat the,1
7278,the voic say had,1
7279,the voic the amount,1
7280,the voic the manual,1
7281,the voic the note,1
7282,the voic they are,1
7283,the voltag one hundr,1
7284,the voltag the product,1
7285,the volum ha blanket,1
7286,the vote seal leas,1
7287,the wa deliv me,1
7288,the watch bad qualiti,1
7289,the water ha alreadi,1
7290,the way the seller,1
7291,the way to put,1
7292,the websit the canist,1
7293,the weekend alway bought,1
7294,the white plastic cover,1
7295,the whole broken piec,1
7296,the whole screen scratch,1
7297,the whole wood structur,1
7298,the worst qualiti those,1
7299,the worst they had,1
7300,the worst thing that,1
7301,the writer the voic,1
7302,the wrong amount miss,1
7303,the wrong color ask,1
7304,the wrong color bought,1
7305,the wrong color howev,1
7306,the wrong place receiv,1
7307,the wrong place the,1
7308,the wrong product submit,1
7309,the wrong roman numer,1
7310,the zenfon five selfi,1
7311,theft the voic are,1
7312,their client thi carrier,1
7313,their problem marathon hung,1
7314,them deliv did complaint,1
7315,them it effect did,1
7316,them realli need the,1
7317,them six two thousand,1
7318,them the payment the,1
7319,them wa unforeseen post,1
7320,then have to run,1
7321,then light again ve,1
7322,then put correct time,1
7323,then report they not,1
7324,then the product send,1
7325,then wait the refund,1
7326,then warn that no,1
7327,there alway diverg deliveri,1
7328,there an unforeseen deliveri,1
7329,there anoth wa be,1
7330,there anticip without warn,1
7331,there delay carrier if,1
7332,there fifteen day the,1
7333,there inform there wa,1
7334,there is no updat,1
7335,there make exchang tonight,1
7336,there may laps the,1
7337,there no one give,1
7338,there no way can,1
7339,there no way replac,1
7340,there problem distribut now,1
7341,there return against the,1
7342,there unforeseen deliveri in,1
7343,there wa onli one,1
7344,thermal blunt model strap,1
7345,thermal bottl towel kit,1
7346,thermal bottl yet arriv,1
7347,thermal brace abdomin shape,1
7348,thermal cup the decor,1
7349,these burn so littl,1
7350,these sold product confirm,1
7351,these thing either me,1
7352,they answer email want,1
7353,they are hope posit,1
7354,they creat not come,1
7355,they deliv alreadi week,1
7356,they deliv no satisfact,1
7357,they deliv one do,1
7358,they deliv product not,1
7359,they deliv product wa,1
7360,they deliv simpl wait,1
7361,they do not exchang,1
7362,they do sell hygien,1
7363,they gave anoth one,1
7364,they gave anoth tri,1
7365,they gave as the,1
7366,they gave deliveri forecast,1
7367,they gave onli voic,1
7368,they go do they,1
7369,they had wa one,1
7370,they inform would forti,1
7371,they left send to,1
7372,they logist problem they,1
7373,they not deliv my,1
7374,they not give satisfact,1
7375,they not in stock,1
7376,they not maintain direct,1
7377,they not warn want,1
7378,they or in stock,1
7379,they protein creat onli,1
7380,they put that receiv,1
7381,they recharg request return,1
7382,they return money resent,1
7383,they said my address,1
7384,they said onli the,1
7385,they say product deliv,1
7386,they send the worst,1
7387,they send the wrong,1
7388,they sent in wrong,1
7389,they sent is well,1
7390,they sent just palett,1
7391,they sent product ching,1
7392,they sent receiv name,1
7393,they sent that wa,1
7394,they sent the casino,1
7395,they sent the round,1
7396,they sent two parallel,1
7397,they sent two separ,1
7398,they show onli one,1
7399,they so paid who,1
7400,they solv problem soon,1
7401,they solv the situat,1
7402,they tell that will,1
7403,they told that canist,1
7404,they want do solv,1
7405,they went and the,1
7406,they worthi peopl accord,1
7407,they would cancel deliveri,1
7408,they would send it,1
7409,thi anxiou doll we,1
7410,thi attitud make new,1
7411,thi besid everyth the,1
7412,thi carrier no respect,1
7413,thi come ye product,1
7414,thi compani not indic,1
7415,thi day five seventeen,1
7416,thi day frame not,1
7417,thi day product not,1
7418,thi dubiou product await,1
7419,thi feat not yet,1
7420,thi footag that they,1
7421,thi glass frame of,1
7422,thi item remind of,1
7423,thi kind problem dissatisfi,1
7424,thi lack respect the,1
7425,thi last purchas make,1
7426,thi link came custom,1
7427,thi meet person need,1
7428,thi morn call central,1
7429,thi not happen embarrass,1
7430,thi not yet arriv,1
7431,thi one month delay,1
7432,thi partner do know,1
7433,thi partner to design,1
7434,thi possibl veri seriou,1
7435,thi problem stark are,1
7436,thi problem trust the,1
7437,thi product is lower,1
7438,thi product launch voic,1
7439,thi purchas bought onc,1
7440,thi purchas until today,1
7441,thi reason do recommend,1
7442,thi reason want money,1
7443,thi revenu the valu,1
7444,thi site thi time,1
7445,thi site well attend,1
7446,thi situat pleas give,1
7447,thi store bought tabl,1
7448,thi store canist pleas,1
7449,thi store charg for,1
7450,thi store stark would,1
7451,thi store tri make,1
7452,thi store zero qualif,1
7453,thi supplier ha post,1
7454,thi targaryen partner the,1
7455,thi time did get,1
7456,thi time did receiv,2
7457,thi time disappoint need,1
7458,thi time made wrong,1
7459,thi time product came,1
7460,thi time product not,1
7461,thi time receiv differ,1
7462,thi time receiv merchandis,1
7463,thi time unfortun did,1
7464,thi type product sinc,1
7465,thi vz came screw,1
7466,thi would give headach,1
7467,thick horribl materi passim,1
7468,thick realiti consum larg,1
7469,thicker rough fabric alreadi,1
7470,thin beauti mislead advertis,1
7471,thin fabric noth do,1
7472,thin narrow am veri,1
7473,thin not wipe unfortun,1
7474,thin quilt ye are,1
7475,thin simpl dishwash can,1
7476,thin thick horribl materi,1
7477,thin veri simpl do,1
7478,thing either me wa,1
7479,thing it will not,1
7480,thing receiv anoth alreadi,1
7481,thing sent anoth still,1
7482,thing that did work,1
7483,thing the voic appear,1
7484,thing there anoth wa,1
7485,thing they gave anoth,1
7486,thing thi site well,1
7487,think be insur mere,2
7488,think bed came mattress,1
7489,think choos the partner,1
7490,think deliveri time too,1
7491,think is least necessari,1
7492,think is singl size,1
7493,think it worth buy,1
7494,think it would arriv,1
7495,think paint kit origin,1
7496,think should explain better,1
7497,think should send product,1
7498,think should send the,1
7499,think to befor return,1
7500,think would get three,1
7501,think would like photo,1
7502,thinner fragil cuba sever,1
7503,third parti sell fals,1
7504,third receiv two packag,1
7505,third targaryen compani reliabl,1
7506,third time complain noth,1
7507,thirteen eight state it,1
7508,thirteen thirti three forti,1
7509,thirteen thousand one hundr,1
7510,thirti box nine nineti,1
7511,thirti day deliv small,1
7512,thirti day deliveri noth,1
7513,thirti day noth the,1
7514,thirti day tel seven,1
7515,thirti day wait the,1
7516,thirti eight compani is,1
7517,thirti eight hundr four,1
7518,thirti eight thousand seven,1
7519,thirti eight wide fourteen,1
7520,thirti four far not,1
7521,thirti four skate receiv,1
7522,thirti four surrend hj,1
7523,thirti four two thousand,1
7524,thirti nine thousand three,1
7525,thirti now neither note,1
7526,thirti one it came,1
7527,thirti one million nine,1
7528,thirti one thirti two,1
7529,thirti packag came damag,1
7530,thirti ranger and receiv,1
7531,thirti seven nineti five,1
7532,thirti seven so far,1
7533,thirti sistema noth need,1
7534,thirti three forti two,1
7535,thirti three nineti today,1
7536,thirti three zero sight,1
7537,thirti two card they,1
7538,thirti two deliv cabl,1
7539,thirti two height forti,1
7540,thirti two million two,1
7541,thirti two should do,1
7542,thirti two thousand eighteen,1
7543,thirtyxthirti kit in the,1
7544,those march twenti five,1
7545,those receiv one broken,1
7546,thought deliveri would made,1
7547,thought mail lost order,1
7548,thought wa buy america,1
7549,thought wa first photo,1
7550,thought would deliv the,1
7551,thought would get same,1
7552,thought would see two,1
7553,thought wrong but mistak,1
7554,thousand convert marathon and,1
7555,thousand eight hundr eight,1
7556,thousand eighteen be deliv,1
7557,thousand eighteen did receiv,1
7558,thousand eighteen far noth,1
7559,thousand eighteen have receiv,1
7560,thousand eighteen hope explain,1
7561,thousand eighteen in deliveri,1
7562,thousand eighteen made purchas,1
7563,thousand eighteen my tabl,1
7564,thousand eighteen not yet,1
7565,thousand eighteen now noth,1
7566,thousand eighteen num happen,1
7567,thousand eighteen paid valu,1
7568,thousand eighteen receiv one,1
7569,thousand eighteen request compel,1
7570,thousand eighteen sent sever,1
7571,thousand eighteen sixteen two,1
7572,thousand eighteen so far,5
7573,thousand eighteen than month,1
7574,thousand eighteen the credit,1
7575,thousand eighteen the inicio,1
7576,thousand eighteen today are,1
7577,thousand eighteen today day,1
7578,thousand eighteen until present,1
7579,thousand eighteen want reimburs,1
7580,thousand fifteen printer valu,1
7581,thousand fifteen second gener,1
7582,thousand fifti despit the,1
7583,thousand five hundr forti,1
7584,thousand five hundr seven,1
7585,thousand five hundr sixti,1
7586,thousand forti seven four,1
7587,thousand four hundr fifti,1
7588,thousand nine hundr fifti,2
7589,thousand one hundr fifteen,1
7590,thousand one hundr thirti,1
7591,thousand one hundr twenti,2
7592,thousand one siren alarm,1
7593,thousand seven hundr and,1
7594,thousand seven hundr forti,1
7595,thousand seven is add,1
7596,thousand six hundr nineti,1
7597,thousand six hundr twenti,1
7598,thousand three hundr eighti,1
7599,thousand three hundr forti,1
7600,thousand three hundr seventi,1
7601,thousand three hundr sixti,1
7602,thousand three hundr ten,1
7603,thousand three hundr two,1
7604,thousand two hundr four,1
7605,thousand two hundr twelv,1
7606,thread differ one bsp,2
7607,three am wait the,1
7608,three applianc onli arriv,1
7609,three arc temper glass,1
7610,three are alreadi eight,1
7611,three bottl await compani,1
7612,three bottl the skirt,1
7613,three bottl wine came,1
7614,three bought paid not,1
7615,three box receiv two,1
7616,three box without the,1
7617,three bug came one,1
7618,three bug card onli,1
7619,three busi day ha,1
7620,three cancel reason alreadi,1
7621,three chair miss part,1
7622,three day ago tri,1
7623,three day delay deliveri,1
7624,three day home without,1
7625,three deliveri receiv product,1
7626,three doll are clearli,1
7627,three fifteen five eleven,1
7628,three filament roll sent,1
7629,three five hundr million,2
7630,three forti two twenti,1
7631,three four gh gave,1
7632,three four send is,1
7633,three four sinc did,1
7634,three four today noth,1
7635,three four wa difficulti,1
7636,three glass want receiv,1
7637,three had go the,1
7638,three hope reli the,1
7639,three hundr eighti eight,1
7640,three hundr forti five,1
7641,three hundr revolut base,1
7642,three hundr seventi four,1
7643,three hundr seventi seven,1
7644,three hundr seventi three,1
7645,three hundr sixti six,1
7646,three hundr sixti stainless,1
7647,three hundr two the,1
7648,three hundr zero chan,1
7649,three item bought one,1
7650,three led ceas two,1
7651,three luminari acquir pleas,1
7652,three magnesium simul one,1
7653,three major solicit return,1
7654,three moto four glass,1
7655,three nineti today thirti,1
7656,three one ancient driver,1
7657,three one without lithium,1
7658,three origin hp cartridg,1
7659,three paid expens freight,1
7660,three pendant came one,1
7661,three piec describ voic,1
7662,three piec kit copper,1
7663,three piec sent two,1
7664,three pipett they sent,1
7665,three product day the,1
7666,three product far one,1
7667,three product have come,1
7668,three product store onli,1
7669,three ptaduto purchas deliveri,1
7670,three purchas item were,1
7671,three receiv lego batman,1
7672,three scale delay deliveri,1
7673,three sent one unit,1
7674,three singl musket no,1
7675,three smart televis have,1
7676,three tablet deliv box,1
7677,three tax note have,1
7678,three thousand eight hundr,1
7679,three total lack disregard,1
7680,three two thousand eighteen,1
7681,three unit it came,1
7682,three unit mean in,1
7683,three unit product the,1
7684,three unit receiv one,1
7685,three unit via extend,1
7686,three unit wa deliv,1
7687,three until today did,1
7688,three until twenti fourth,1
7689,three wallpap roll receiv,1
7690,three week request simpli,1
7691,three white number fifti,1
7692,three white sheet been,1
7693,three year old child,1
7694,three zero sight understood,1
7695,three zero sixteen version,1
7696,threextwo eighti curtain sent,1
7697,threw sanitari water is,1
7698,throne my surpris came,1
7699,through email know receiv,1
7700,through messag with wait,1
7701,through the site canist,1
7702,throughout deadlin neither note,1
7703,ticket panda the mail,1
7704,time alreadi bought two,1
7705,time alreadi expir the,1
7706,time alreadi extens biggest,1
7707,time alreadi long still,1
7708,time anoth product came,1
7709,time arriv did come,1
7710,time ask the cancel,1
7711,time bought did receiv,1
7712,time bought same product,1
7713,time bought yet have,1
7714,time burn the charger,1
7715,time buy canist store,1
7716,time buy need my,1
7717,time buy same product,1
7718,time buy the site,1
7719,time buy thi store,1
7720,time canist stop fulfil,1
7721,time carri noth happen,1
7722,time complain noth done,1
7723,time cook extrem thin,1
7724,time deadlin veri long,1
7725,time deliveri no longer,1
7726,time did come within,1
7727,time did get product,1
7728,time did have return,1
7729,time did receiv neg,1
7730,time did receiv piti,1
7731,time did receiv product,1
7732,time did receiv purchas,1
7733,time did receiv the,1
7734,time disappoint need urgent,1
7735,time do get product,1
7736,time do know they,1
7737,time doe provid satisfactori,1
7738,time doe read the,1
7739,time even call the,1
7740,time everyon deliv time,1
7741,time excel the product,1
7742,time extrapol noth want,1
7743,time fell the mattress,1
7744,time gasolin that paid,1
7745,time get anoth roll,1
7746,time get money back,1
7747,time had problem deliveri,1
7748,time it deliv coffe,1
7749,time look the post,1
7750,time made wrong choos,1
7751,time make purchas first,1
7752,time manner meet situat,1
7753,time minut the clock,1
7754,time more ten year,1
7755,time most time doe,1
7756,time not deliv cover,1
7757,time not receiv order,1
7758,time not receiv product,1
7759,time onli receiv messag,1
7760,time per deliveri part,1
7761,time product came miss,1
7762,time product not yet,1
7763,time product took long,1
7764,time purchas ask one,1
7765,time purchas bought gray,1
7766,time purchas cancel store,1
7767,time purchas clear it,1
7768,time purchas not made,1
7769,time purchas occur not,1
7770,time purchas sixteen eight,1
7771,time purchas written it,1
7772,time receiv differ what,1
7773,time receiv merchandis would,1
7774,time receiv product purchas,1
7775,time receiv product yet,1
