,phrases,frequency
5120,sent within deadlin howev,1
5121,sent without packag draw,1
5122,sent wrong becaus ask,1
5123,sent wrong product now,1
5124,sent wrong product sent,1
5125,separ deliveri the item,1
5126,separ deliveri when open,1
5127,separ filter one the,1
5128,separ the product compani,1
5129,separ the store question,1
5130,separ would like know,1
5131,seri two ye seri,1
5132,seriou problem deliveri the,1
5133,seriou transport without voic,1
5134,serv model two thousand,1
5135,serv my cell phone,1
5136,serv nine thousand five,1
5137,serv noth me request,1
5138,serv vehicl parti two,1
5139,servant came poorli pack,1
5140,servic canist com store,1
5141,servic deliveri even return,1
5142,servic do have sac,1
5143,servic far did solv,1
5144,servic front respons the,1
5145,servic have lot headach,1
5146,servic never site the,1
5147,servic purchas the internet,1
5148,servic the canist the,1
5149,servic the deliveri the,1
5150,set although appear the,1
5151,set came white did,1
5152,set half the averag,1
5153,set len ol king,1
5154,set my littl parti,1
5155,set sent the packag,1
5156,settl infus the compani,1
5157,setup chines not work,1
5158,seven are want cancel,1
5159,seven billion five hundr,1
5160,seven came zero seven,1
5161,seven control receiv kdlforti,1
5162,seven day accord the,1
5163,seven day one the,1
5164,seven day the combin,1
5165,seven deliveri forecast seven,1
5166,seven deliveri forecast the,1
5167,seven deliveri forecast twenti,1
5168,seven eight light togeth,1
5169,seven eight targaryen deliveri,1
5170,seven eighteen did receiv,1
5171,seven four dual core,1
5172,seven four seven two,1
5173,seven ha yet arriv,1
5174,seven hundr and seventi,1
5175,seven hundr forti one,1
5176,seven hundr sixti one,1
5177,seven is add have,1
5178,seven million eight hundr,1
5179,seven neither nf the,1
5180,seven nineti five request,1
5181,seven no posit the,1
5182,seven onli today wa,1
5183,seven product bought receiv,1
5184,seven sent two hundr,1
5185,seven seven neither nf,1
5186,seven so far have,1
5187,seven the moment exchang,1
5188,seven thirti now neither,1
5189,seven thousand four hundr,1
5190,seven thousand nine hundr,1
5191,seven thousand six hundr,1
5192,seven thousand three hundr,1
5193,seven today seven seven,1
5194,seven today twenti eight,1
5195,seven two thousand eighteen,2
5196,seven until date not,1
5197,seven vacuum cleaner wa,1
5198,seven wish return the,1
5199,seventeen eight not yet,1
5200,seventeen eighteen far had,1
5201,seventeen eighteen wa contact,1
5202,seventeen four eighteen wa,1
5203,seventeen two thousand eighteen,1
5204,seventeenth still not receiv,1
5205,seventi five read want,1
5206,seventi five sad need,1
5207,seventi four hundr announc,1
5208,seventi four year old,1
5209,seventi million four hundr,1
5210,seventi nine zero receiv,1
5211,seventi one hundr nineti,1
5212,seventi one nineti eight,1
5213,seventi one thousand one,1
5214,seventi one thousand two,1
5215,seventi one valu thirti,1
5216,seventi seven thousand six,1
5217,seventi three hope reli,1
5218,sever delay the product,1
5219,sever email msg complaint,1
5220,sever email no one,1
5221,sever end choos one,1
5222,sever time even call,1
5223,sever time get money,1
5224,sever time talk you,1
5225,sever time use could,1
5226,sever ve ever done,1
5227,sever wonder mark variou,1
5228,sew dark line light,1
5229,sew kit receiv one,1
5230,shall favor check the,1
5231,shall when call it,1
5232,shame buy product not,1
5233,shame compani sell book,1
5234,shame is bring mani,1
5235,shame paid did receiv,1
5236,shame partner these sold,1
5237,shame request prepar ship,1
5238,shampoo receiv that compos,1
5239,shape hb model shape,1
5240,shape it reach thermal,1
5241,sharp match the present,1
5242,sharpen crap deceit better,1
5243,shave corner torn all,1
5244,she smell air ball,1
5245,sheet alreadi paid noth,1
5246,sheet been miss without,1
5247,sheet bought stop receiv,1
5248,sheet disappoint one time,1
5249,sheet if were quilt,1
5250,sheet not match merchandis,1
5251,sheet thicker rough fabric,1
5252,shelv deliv the tabl,1
5253,shift receiv the hair,1
5254,ship box pack the,1
5255,ship code not get,1
5256,ship four twenti three,1
5257,ship got respons say,1
5258,ship inform the second,1
5259,ship post offic take,1
5260,ship thought would get,1
5261,shipment yet have levi,1
5262,shirt eightxon digit digit,1
5263,shirt induc think is,1
5264,shop can talk anyon,1
5265,shop chargeback wait the,1
5266,shop distribut to see,1
5267,shop not meet deadlin,1
5268,shop sell do deliv,1
5269,shop servic the canist,1
5270,short duti have or,1
5271,should confirm they or,1
5272,should explain better is,1
5273,should found wa total,1
5274,should more transpar on,1
5275,should not sell two,1
5276,should proceed receiv other,1
5277,should put the descript,1
5278,should receiv merchandis learn,1
5279,should receiv two product,1
5280,should send product compani,1
5281,should send product soon,1
5282,should send the custom,1
5283,should six inf nutrit,1
5284,should use the post,1
5285,show address incorrect howev,1
5286,show onli one post,1
5287,show speak wa forc,1
5288,show the photo extrem,1
5289,show the track ha,1
5290,shower bought model flexibl,1
5291,shower deliv anoth brand,1
5292,shower deliv came without,1
5293,shower mine came without,1
5294,shower not same product,1
5295,shower paid one hundr,1
5296,shown figur me would,1
5297,shown phone not curricular,1
5298,shown purchas come tester,1
5299,shown site differ receiv,1
5300,showtim second purchas realiz,1
5301,shred releas the fiber,1
5302,side bottl it fake,1
5303,side the citi live,1
5304,side the citi paid,1
5305,side the phone horribl,1
5306,sight understood due the,1
5307,sign also come empti,1
5308,sign deliveri imagin would,1
5309,signal canist site appear,1
5310,signal the product origin,1
5311,silk color came correct,1
5312,silva the techno gadget,1
5313,silver have alreadi made,1
5314,silver silk color came,1
5315,silver they sent the,1
5316,similar packag came wrong,1
5317,similar product inganosa propaganda,1
5318,similar product it wa,1
5319,similar that ad howev,1
5320,simpar box three tablet,1
5321,simpar forti mg not,1
5322,simpl box not the,1
5323,simpl deliveri sp bh,1
5324,simpl dishwash can dead,1
5325,simpl do know seem,1
5326,simpl the doubl they,1
5327,simpl voic send product,1
5328,simpl wait the deliveri,1
5329,simpli cancel purchas even,1
5330,simpli cancel the request,1
5331,simpli deliv product can,1
5332,simpli glove total tear,1
5333,simpli like taxa came,1
5334,simpli not answer made,1
5335,simpli not deliv even,1
5336,simpli not deliv product,2
5337,simpli not deliv so,1
5338,simpli not work ani,1
5339,simpli send the custom,1
5340,simpli undermin daughter late,1
5341,simul one sixti tablet,1
5342,sinc bought wa tri,1
5343,sinc confirm payment is,1
5344,sinc day deliveri never,1
5345,sinc day receiv so,1
5346,sinc deliv screw fix,1
5347,sinc did fit tank,1
5348,sinc did receiv product,1
5349,sinc eleventh to arriv,1
5350,sinc it dispatch receiv,1
5351,sinc live main avenu,1
5352,sinc product been defect,1
5353,sinc product deliv broken,1
5354,sinc receiv the product,1
5355,sinc scholarship measur not,1
5356,sinc seventeen four eighteen,1
5357,sinc six eighteen have,1
5358,sinc the packag veri,1
5359,sinc the product not,1
5360,singl bed one hundr,1
5361,singl blue marin mattress,1
5362,singl cover product miss,1
5363,singl eleg one queen,1
5364,singl freight each ie,1
5365,singl musket no queen,1
5366,singl pack preacher ten,1
5367,singl size the product,1
5368,siren alarm center one,1
5369,sistema noth need cancel,1
5370,sit research singl bed,1
5371,site addit not compat,1
5372,site address sent the,1
5373,site appear be beauti,1
5374,site appear given the,1
5375,site ask deliv anoth,1
5376,site buy watch end,1
5377,site canist com not,1
5378,site canist com targaryen,1
5379,site canist think be,2
5380,site contact doe respond,1
5381,site demand money back,1
5382,site differ receiv what,1
5383,site differ the product,1
5384,site diverg product purchas,1
5385,site doe not fit,1
5386,site five the same,1
5387,site friend receiv twenti,1
5388,site give connect error,1
5389,site ha alreadi made,1
5390,site ha go the,1
5391,site imag one hundr,1
5392,site in the contact,1
5393,site inform the occurr,1
5394,site is state it,1
5395,site it alreadi happen,1
5396,site ll give back,1
5397,site lock the exact,1
5398,site look great want,1
5399,site mani year ve,1
5400,site miss the address,1
5401,site need help chang,1
5402,site nine eight still,1
5403,site not deliv sell,1
5404,site not give candl,1
5405,site not give the,1
5406,site not leav alway,1
5407,site product way when,1
5408,site realiz purchas wrong,1
5409,site say product deliv,1
5410,site say wa deliv,1
5411,site swore be abl,1
5412,site telephon mail unfortun,1
5413,site the canist happen,1
5414,site the cell phone,1
5415,site the item exchang,1
5416,site the oper it,2
5417,site the post offic,1
5418,site the product deliv,1
5419,site the product seem,1
5420,site the showtim second,1
5421,site the store return,1
5422,site thi time disappoint,1
5423,site time the site,1
5424,site to cancel the,1
5425,site tri fill the,1
5426,site valu thi footag,1
5427,site wa deliv await,1
5428,site wa deliv thi,1
5429,site wait the refer,1
5430,site want be reimburs,1
5431,site well disappoint whenev,1
5432,situat be the product,1
5433,situat be trigger lawyer,1
5434,situat not return my,1
5435,situat pleas give some,1
5436,situat understand the deliveri,1
5437,situat wait an answer,1
5438,situat would like regist,1
5439,six came total wrong,1
5440,six cartridg receiv four,1
5441,six cup miss four,1
5442,six day later send,1
5443,six dri shampoo receiv,1
5444,six each receiv twelv,1
5445,six eight on seventeen,1
5446,six eight two thousand,1
5447,six eighteen have not,1
5448,six eighteen so far,2
5449,six fifteen two thousand,1
5450,six got anoth total,1
5451,six ha yet arriv,1
5452,six hundr eighti howev,1
5453,six hundr forti three,1
5454,six hundr nineti four,1
5455,six hundr seventi million,1
5456,six hundr sixti four,1
5457,six hundr sixti six,1
5458,six hundr sixti two,2
5459,six hundr thirti three,1
5460,six hundr twenti purchas,1
5461,six hundr zero read,1
5462,six ident piec the,1
5463,six inf nutrit give,1
5464,six item came five,1
5465,six ivori organ box,2
5466,six kit post offic,1
5467,six malaysia organ box,1
5468,six me wa disappoint,1
5469,six memori onli receiv,1
5470,six million three hundr,1
5471,six month use the,1
5472,six nineti one acquir,1
5473,six onli receiv tran,1
5474,six order six problem,1
5475,six outlet gave one,1
5476,six place thirti eight,1
5477,six printer accus the,1
5478,six product onli receiv,1
5479,six rug onli receiv,1
5480,six seven today seven,1
5481,six seven two thousand,1
5482,six six eighteen so,1
5483,six six ha yet,1
5484,six six return paulo,1
5485,six six two thousand,1
5486,six sixti receiv two,1
5487,six tablet not receiv,1
5488,six thousand three hundr,1
5489,six today day ten,1
5490,six twenti four two,1
5491,six twenti nine six,1
5492,six two thousand eighteen,8
5493,six would like check,1
5494,sixteen card summar naughti,1
5495,sixteen eight have receiv,1
5496,sixteen eight today twenti,1
5497,sixteen two sao paulo,1
5498,sixteen version two zero,1
5499,sixteenth the last time,1
5500,sixti cabl the cabl,1
5501,sixti cm bright blue,1
5502,sixti did work he,1
5503,sixti eight than my,1
5504,sixti five thousand two,1
5505,sixti four cartridg last,1
5506,sixti four million five,1
5507,sixti is one four,1
5508,sixti million eight hundr,1
5509,sixti nine million two,1
5510,sixti nine thousand three,1
5511,sixti one receiv previou,1
5512,sixti one zero read,1
5513,sixti receiv one one,1
5514,sixti receiv two fixtur,1
5515,sixti six got anoth,1
5516,sixti six million three,1
5517,sixti stainless steel basket,1
5518,sixti tablet receiv product,1
5519,sixti two cartridg one,1
5520,sixti two thousand nine,1
5521,size bed poor finish,1
5522,size dissatisfi not buy,1
5523,size fifti six place,1
5524,size larger the request,1
5525,size of the product,1
5526,size quantiti everyth came,1
5527,size receiv print cartridg,1
5528,size request size fifti,1
5529,size small perceiv ad,1
5530,size smaller the specifi,1
5531,size such practic they,1
5532,size the product receiv,1
5533,size the shirt induc,1
5534,size thirti four skate,1
5535,size thirti one thirti,1
5536,size were sold paid,1
5537,skate hope receiv correctli,1
5538,skate receiv size thirti,1
5539,skirt not straight equal,1
5540,skirt onli receiv one,1
5541,skirt the cradl royalti,1
5542,sleep my teeth bleed,1
5543,sleep tabl two children,1
5544,slice seam made without,1
5545,slight slope sometim eras,1
5546,slim life chrome picolin,1
5547,slim life the follow,1
5548,slope sometim eras alon,1
5549,slow doe support window,1
5550,small box prove receiv,1
5551,small defect request exchang,1
5552,small have use my,1
5553,small nine month babi,1
5554,small pan did observ,1
5555,small perceiv ad not,1
5556,small poor qualiti horribl,1
5557,small site look great,1
5558,small size regret purchas,1
5559,small spider the glass,1
5560,small suit do return,1
5561,small where screen the,1
5562,smaller defect one the,1
5563,smaller differ model arriv,1
5564,smaller quantiti bought four,1
5565,smaller the two horribl,1
5566,smaller valu did even,1
5567,smart ramo two luminari,1
5568,smart televis have the,1
5569,smart tv control request,1
5570,smart tv option useless,1
5571,smartphon miss compon box,1
5572,smell air ball did,1
5573,smell could wear the,1
5574,snake the time took,1
5575,so far could chang,1
5576,so far could get,1
5577,so far did get,1
5578,so far did give,1
5579,so far did receiv,2
5580,so far ha arriv,1
5581,so far ha given,1
5582,so far had return,1
5583,so far have been,1
5584,so far have had,2
5585,so far have news,1
5586,so far have not,3
5587,so far have obtain,1
5588,so far have receiv,7
5589,so far have return,3
5590,so far nda still,1
5591,so far not arriv,3
5592,so far noth deliv,1
5593,so far noth deliveri,1
5594,so far noth did,1
5595,so far noth do,1
5596,so far noth done,1
5597,so far noth nine,1
5598,so far noth not,1
5599,so far noth sent,1
5600,so far noth still,1
5601,so far one answer,2
5602,so far one contact,2
5603,so far respons muitissimo,1
5604,so far respons the,1
5605,so far satisfact gave,1
5606,so far ten eight,1
5607,so far the pressur,1
5608,so far voic issu,1
5609,so fill it is,1
5610,so ha come complet,1
5611,so hard came paid,1
5612,so late arriv it,1
5613,so littl just not,1
5614,so mani purchas have,1
5615,so much delay my,1
5616,so not fulfil canist,1
5617,so paid who choos,1
5618,soccer ball specifi gave,1
5619,social towel the as,1
5620,socket is quit lower,1
5621,sofa shall when call,1
5622,soft not worth penni,1
5623,sold camel twenti read,1
5624,sold deliv targaryen send,1
5625,sold fake product soon,1
5626,sold friend lose money,1
5627,sold if it were,1
5628,sold like yoga carpet,1
5629,sold my citi by,1
5630,sold product confirm discount,1
5631,sold product did have,2
5632,sold speak non exist,1
5633,sold the store not,1
5634,sold twenti zero would,1
5635,solder one metal rod,1
5636,solid state ivan oliv,1
5637,solut deliveri the item,1
5638,solut given site to,1
5639,solut the empti damag,1
5640,solut thi problem trust,1
5641,solv forti eight hour,1
5642,solv nobodi say anyth,1
5643,solv not want return,1
5644,solv problem bought motor,1
5645,solv problem can not,1
5646,solv problem chang evalu,1
5647,solv problem deliveri product,1
5648,solv problem not attend,1
5649,solv problem poor call,1
5650,solv problem satisfact what,1
5651,solv problem soon the,1
5652,solv problem the sac,1
5653,solv problem the sheet,1
5654,solv problem will say,1
5655,solv problem wonder you,1
5656,solv product problem sinc,1
5657,solv the wa deliv,1
5658,solv unpleas problem consensu,1
5659,solv urgent situat be,1
5660,solv without go proton,1
5661,some car clio two,1
5662,some concret inform canist,1
5663,some time purchas occur,1
5664,someon alreadi manipul use,1
5665,someon els not contact,1
5666,someon els terribl want,1
5667,someon that horribl paid,1
5668,someon the product not,1
5669,someon wa me receiv,1
5670,someth be done need,1
5671,someth els ask send,1
5672,someth hit in moral,1
5673,someth like wait almost,1
5674,someth that ha alreadi,1
5675,sometim alreadi open the,1
5676,sometim eras alon then,1
5677,sometim take the product,1
5678,son annoy he not,1
5679,son birthday parti the,1
5680,son everi child wa,1
5681,soni origin it not,1
5682,soni rm forti seven,1
5683,soon alway buy thi,1
5684,soon eras instruct english,1
5685,soon first format it,1
5686,soon late did receiv,1
5687,soon made request check,1
5688,soon made request observ,1
5689,soon merchandis arriv it,1
5690,soon receiv can evalu,1
5691,soon receiv product evalu,1
5692,soon the helmet present,1
5693,soon will cancel the,1
5694,soon you receiv product,1
5695,sorri paid steer to,1
5696,sound low and earli,1
5697,sourc bodi howev function,1
5698,sourc thick realiti consum,1
5699,southern region live salvador,1
5700,sp bh rememb the,1
5701,sp object deliv the,1
5702,speak anyon the sac,1
5703,speak deliveri howev wa,1
5704,speak directli with an,1
5705,speak even he receiv,1
5706,speak non exist phone,1
5707,speak peri tre five,1
5708,speak serv vehicl parti,1
5709,speak store the site,1
5710,speak the central deliv,1
5711,speak wa forc give,1
5712,specif insid round contain,1
5713,specifi gave futsal ball,1
5714,specul fragil fine materi,1
5715,spend day home no,1
5716,spend littl had alreadi,1
5717,spend time gasolin that,1
5718,spent go the mail,1
5719,spent good time carri,1
5720,spent long time stipul,1
5721,spent much time receiv,1
5722,spi clock request two,1
5723,spin mop three hundr,1
5724,splendid valv paid product,2
5725,spoil chang batteri it,1
5726,spoil printer the product,1
5727,spoke the exchang anoth,1
5728,spoken it took deliveri,1
5729,spoken the site five,1
5730,spray cap with an,1
5731,spray unit it purchas,1
5732,sr manag receiv telephon,1
5733,sr medic not stay,1
5734,ssd onli one deliv,1
5735,stack consumpt you remov,1
5736,stain bracelet no qualiti,1
5737,stain look like threw,1
5738,stain the photo the,1
5739,stainless note emit return,1
5740,stainless steel basket outlet,1
5741,stall worth price all,1
5742,stallion never receiv product,1
5743,stamp machin shirt eightxon,1
5744,stand wireless arriv fine,1
5745,standard would chang would,1
5746,star would not send,1
5747,stark alway deliv still,1
5748,stark alway great recommend,1
5749,stark are go path,1
5750,stark buy lot never,1
5751,stark client did do,1
5752,stark competitor deliv well,1
5753,stark follow in silenc,1
5754,stark no one went,1
5755,stark not respons the,1
5756,stark targaryen peso servic,1
5757,stark the respons store,1
5758,stark thi attitud make,1
5759,stark total omiss shame,1
5760,stark websit hinder process,1
5761,stark websit not print,1
5762,stark websit not updat,1
5763,stark websit realli disappoint,1
5764,stark work deliv product,1
5765,stark would remov it,1
5766,start color card wa,1
5767,start longer work one,1
5768,state deliv alway bought,1
5769,state it deliv noth,1
5770,state it is an,1
5771,state it not even,1
5772,state ivan oliv vitro,1
5773,state my product deliv,1
5774,state the track ha,1
5775,statement come justif await,1
5776,statement the reason such,1
5777,statu deliveri say ha,1
5778,statu state deliv alway,1
5779,statu where wa if,1
5780,stay almost twenti day,1
5781,stay await someth that,1
5782,stay him anyway it,1
5783,stay incomplet product would,1
5784,stay not receiv product,1
5785,stay that pessimima experi,1
5786,stay the product oblig,1
5787,stay the product stark,1
5788,stay without five take,1
5789,steel basket outlet water,1
5790,steer to get the,1
5791,step equal not the,2
5792,step the deliveri time,1
5793,step two the progress,1
5794,stethoscop store sent voic,1
5795,stew receiv the case,1
5796,sticker auto adhes background,1
5797,sticker card came without,1
5798,sticker receiv track car,1
5799,sticker the color not,1
5800,still arriv complain mail,1
5801,still avail sale have,1
5802,still await receipt the,1
5803,still await respons wa,1
5804,still came the wrong,1
5805,still charg extend warranti,1
5806,still charg the doubl,1
5807,still delay total neglect,1
5808,still deliv product without,1
5809,still did not receiv,1
5810,still discount my voic,1
5811,still expens poorli made,1
5812,still fit the vase,1
5813,still give anoth time,1
5814,still have receiv product,1
5815,still hope know wa,1
5816,still hope receiv product,1
5817,still no nativ respons,1
5818,still not get respons,1
5819,still not get touch,1
5820,still not know deceiv,1
5821,still not know the,1
5822,still not look me,1
5823,still not receiv email,1
5824,still not receiv money,1
5825,still not receiv product,4
5826,still not receiv the,1
5827,still not respond my,1
5828,still not the refund,1
5829,still not total to,1
5830,still product not arriv,1
5831,still receiv in command,1
5832,still receiv product past,1
5833,still recommend the store,1
5834,still regist on the,1
5835,still see it arriv,1
5836,still sent anoth detalh,1
5837,still smaller valu did,1
5838,still store deliveri time,1
5839,still stuck post offic,1
5840,still ten to describ,1
5841,still the deadlin deliveri,1
5842,still the disappoint not,1
5843,still the hand mail,1
5844,still the small box,1
5845,still today await order,1
5846,still wait return what,1
5847,still wait the cancel,1
5848,still wait the money,1
5849,still wait the product,2
5850,still wait the rest,1
5851,still wait the second,1
5852,still wait voic store,1
5853,stipul deadlin did come,1
5854,stipul deadlin ha receiv,1
5855,stipul deadlin use money,1
5856,stipul period neither satisfact,1
5857,stock call to return,1
5858,stock crime stark follow,1
5859,stock did revers money,1
5860,stock doe answer client,1
5861,stock extrem unpleas situat,1
5862,stock leav avail the,1
5863,stock let see will,1
5864,stock on canist websit,1
5865,stock onli warn nf,1
5866,stock should confirm they,1
5867,stock the end the,1
5868,stock three week request,1
5869,stock time purchas not,1
5870,stock when bought said,1
5871,stock would would marri,1
5872,stolen nobodi solv problem,1
5873,stolen post offic until,1
5874,stone grind manual screw,1
5875,stop conclus sent broken,1
5876,stop fulfil purchas made,1
5877,stop no refer how,1
5878,stop print even full,1
5879,stop receiv product thi,1
5880,stop receiv two disappoint,1
5881,stop the bracket not,1
5882,stop the post offic,1
5883,stop work contact sand,1
5884,stop work use solut,1
5885,store also came unus,1
5886,store alway perfect howev,1
5887,store an answer until,1
5888,store anyon alreadi made,1
5889,store are announc origin,1
5890,store as doorway commit,1
5891,store bar exercis would,1
5892,store bill mosquito net,1
5893,store bought alway deliv,1
5894,store bought tabl eas,1
5895,store bought two equal,1
5896,store buy the site,2
5897,store came one site,1
5898,store canist pleas post,1
5899,store chang the product,1
5900,store charg for freight,1
5901,store continu without product,1
5902,store decid time doe,1
5903,store deliveri be quick,1
5904,store deliveri time alreadi,1
5905,store detail still arriv,1
5906,store did put surnam,1
5907,store expect qualiti watch,1
5908,store fault someth be,1
5909,store four day inform,1
5910,store given did answer,1
5911,store hand product exchang,1
5912,store hope receiv paid,1
5913,store hope return you,1
5914,store hope they solv,1
5915,store horribl will never,1
5916,store in the carrier,1
5917,store is neg precis,1
5918,store it let wish,1
5919,store it the first,1
5920,store like canist allow,1
5921,store made request last,1
5922,store make paid deliv,1
5923,store make the exchang,2
5924,store measur bag larg,1
5925,store need see store,1
5926,store never problem hope,1
5927,store ngm respond me,1
5928,store not deliv the,1
5929,store not give exchang,1
5930,store not receiv product,2
5931,store not say anyth,1
5932,store not sell watch,1
5933,store not take action,1
5934,store noth complain the,1
5935,store offer did fulfil,1
5936,store one book brazilian,1
5937,store one nineti nine,1
5938,store onli came one,1
5939,store onli receiv one,1
5940,store open complaint noth,1
5941,store other product bought,1
5942,store pay attent the,1
5943,store post otherwis not,1
5944,store product poor qualiti,1
5945,store question receiv one,1
5946,store question through email,1
5947,store receiv return the,1
5948,store recommend the product,1
5949,store refer the deliveri,1
5950,store reject request am,1
5951,store relat the avail,2
5952,store return me posit,1
5953,store said had merchandis,1
5954,store said would deliv,1
5955,store sell product doe,1
5956,store sell veri expens,1
5957,store send postal code,1
5958,store sent fals damag,1
5959,store sent piec the,1
5960,store sent product return,1
5961,store sent voic the,1
5962,store sever time even,1
5963,store simpli not deliv,1
5964,store sinc product deliv,1
5965,store so far have,1
5966,store so mani purchas,1
5967,store solv problem will,1
5968,store stallion never receiv,1
5969,store stark would remov,1
5970,store still the disappoint,1
5971,store such situat wait,1
5972,store take but go,1
5973,store take mt make,1
5974,store the date quot,1
5975,store the mail say,1
5976,store the product came,2
5977,store the product not,1
5978,store the respons from,1
5979,store the site need,1
5980,store thi feat not,1
5981,store thi time product,1
5982,store to thi revenu,1
5983,store to use anoth,1
5984,store tri make purchas,1
5985,store with the canist,1
5986,store with you want,1
5987,store you just want,1
5988,store you not fulfil,1
5989,store zero qualif do,1
5990,straight equal the photo,1
5991,strang addit the licens,1
5992,strang not like product,1
5993,streamlin deliveri want money,1
5994,street negreiro lovato thirti,1
