,phrases,frequency
0,abdomin shape hb model,1
1,addit the product arriv,2
2,alreadi got touch canist,3
3,alreadi paid first instal,2
4,alreadi request exchang the,2
5,alreadi request the return,2
6,alway bought canist store,2
7,am still wait the,2
8,am wait an answer,3
9,am wait posit the,3
10,and paid the money,2
11,arriv me diverg relat,2
12,arriv the correct amount,2
13,arriv the expect date,3
14,ask not watch it,2
15,ask product code come,3
16,await guidanc the exchang,3
17,be insur mere mistak,2
18,been than month ago,2
19,blue marin mattress cover,2
20,bought one hundr ten,2
21,bought product came anoth,3
22,bought product orang color,2
23,bought product receiv anoth,4
24,bought product sent anoth,3
25,bought two curtain onli,2
26,bought two equal splendid,2
27,bought two paid two,2
28,bought two perfum came,2
29,bought two product the,2
30,bought two product unit,2
31,bought two receiv one,2
32,bought two scale onli,2
33,bought two unit onli,2
34,bsp step equal not,2
35,but thread differ one,2
36,buy the site canist,2
37,came one the box,2
38,came one would like,2
39,came the wrong color,4
40,can evalu not receiv,4
41,cancel purchas voic issu,1
42,cancel purchas wa charg,1
43,cancel purchas wa deliv,1
44,cancel reason alreadi reimburs,1
45,cancel request may eleven,1
46,cancel request not arriv,1
47,cancel request not ask,1
48,cancel request not revers,1
49,cancel request not the,1
50,cancel request receiv within,1
51,cancel request revers purchas,1
52,cancel request soon merchandis,1
53,cancel request the time,1
54,cancel request without warn,1
55,cancel request yet deliv,1
56,cancel return the product,1
57,cancel sale he not,1
58,cancel same day purchas,1
59,cancel shipment yet have,1
60,cancel site telephon mail,1
61,cancel store not deliv,1
62,cancel store take mt,1
63,cancel the forti eighth,1
64,cancel the order it,1
65,cancel the order not,1
66,cancel the product alreadi,1
67,cancel the purchas am,1
68,cancel the purchas the,1
69,cancel the request want,1
70,cancel the request will,1
71,cancel the sale the,1
72,cancel the sale to,1
73,cancel the site wait,1
74,cancel thi product launch,1
75,cancel until cancel store,1
76,cancel wa realiz explain,1
77,cancel wait return the,1
78,cancel want chang anoth,1
79,cancel want know receiv,1
80,cancel without explan still,1
81,cancel yet store sent,1
82,cancel you tri sever,1
83,candl came broken coal,1
84,cane bagass although is,1
85,canist allow third parti,1
86,canist also lost client,1
87,canist alway bought canist,1
88,canist and can solv,1
89,canist ask consist receiv,1
90,canist associ compani do,1
91,canist better partner store,1
92,canist client prove the,1
93,canist com br sell,1
94,canist com complaint channel,1
95,canist com have partner,1
96,canist com no idea,1
97,canist com not succeed,1
98,canist com stop receiv,1
99,canist com store make,1
100,canist com store one,1
101,canist com targaryen spi,1
102,canist custom are faith,1
103,canist deliv deadlin now,1
104,canist deliv my hous,1
105,canist deliveri usual the,1
106,canist did give ani,1
107,canist doe meet the,1
108,canist expect solut deliveri,1
109,canist had problem thi,1
110,canist happen five seventeen,1
111,canist hesit deliveri three,1
112,canist inform there problem,1
113,canist it took long,1
114,canist know happen attend,1
115,canist make necessari charg,1
116,canist mani year ago,1
117,canist methodolog alreadi almost,1
118,canist more lenient do,1
119,canist neither satisfact give,1
120,canist never problem thi,1
121,canist no one manifest,1
122,canist no option speak,1
123,canist not ani kind,1
124,canist not get product,1
125,canist not give thi,1
126,canist not lend give,1
127,canist of sale of,1
128,canist on call to,1
129,canist paid websit canist,1
130,canist partner are trustworthi,1
131,canist partner said can,1
132,canist phone they tell,1
133,canist pleas post neg,1
134,canist plu they answer,1
135,canist receiv two hdi,1
136,canist repres product estelionato,1
137,canist request inform the,1
138,canist respons and omit,1
139,canist respons did arriv,1
140,canist site appear given,1
141,canist stop fulfil purchas,1
142,canist store also came,1
143,canist store an answer,1
144,canist store buy the,2
145,canist store deliveri be,1
146,canist store hope receiv,1
147,canist store hope return,1
148,canist store not sell,1
149,canist store not take,1
150,canist store question through,1
151,canist store refer the,1
152,canist store the product,1
153,canist store thi feat,1
154,canist store thi time,1
155,canist super faith hi,1
156,canist supplier thi situat,1
157,canist system not accept,1
158,canist targaryen not eat,1
159,canist targaryen partner product,1
160,canist the attend not,1
161,canist the charger not,1
162,canist the respons your,1
163,canist there return against,1
164,canist they sell bag,1
165,canist thi time made,1
166,canist think be insur,2
167,canist to judg you,1
168,canist turn free market,1
169,canist wa first time,1
170,canist websit can keep,1
171,canist websit have alreadi,1
172,canist websit lousi exchang,1
173,canist websit no respons,1
174,canist websit not right,1
175,canist websit the diamet,1
176,canist websit the site,1
177,canist websit wa still,1
178,cap with an age,1
179,capit cep twenti two,1
180,capsul find absurd buy,1
181,capsul not yet deliv,1
182,capsul receiv sixti capsul,1
183,capsul receiv the sixti,1
184,capsul the mode use,1
185,car arriv cover crossbow,1
186,car arriv the cart,1
187,car clio two work,1
188,car enter safeti mode,1
189,car horribl terribl qualiti,1
190,car model the plastic,1
191,car noth proce coward,1
192,car piec need certain,1
193,car tractor train trenzinho,1
194,car train tractor truck,1
195,car vacuum cleaner the,1
196,car wa choke rubber,1
197,carbon advanc think it,1
198,card abil is differ,1
199,card await urgent return,1
200,card came one photo,1
201,card came without two,1
202,card did cancel the,1
203,card did come like,1
204,card did get return,1
205,card due lack deliveri,1
206,card final discov the,1
207,card microshc is lower,1
208,card new chang doe,1
209,card not work correctli,1
210,card now want cancel,1
211,card onli one arriv,1
212,card onli receiv one,1
213,card onli sent broken,1
214,card receiv fals start,1
215,card receiv us card,1
216,card releas two item,1
217,card sand rec diff,1
218,card sinc the product,1
219,card targaryen never buy,1
220,card the cell phone,1
221,card the first instal,1
222,card then the product,1
223,card they send the,1
224,card troubl doe appear,1
225,card wa as the,1
226,card want know will,1
227,card will have to,1
228,card work cell phone,1
229,cardboard box without content,1
230,care came differ td,1
231,care not know my,1
232,career three white number,1
233,carpet did receiv authent,1
234,carpet it not minimum,1
235,carpet ninetyxon hundr dog,1
236,carpet not arriv expect,1
237,carpet not come the,1
238,carpet onli receiv one,1
239,carpet receiv rectangular blue,1
240,carpet the footag two,1
241,carpet veri day use,1
242,carri thi purchas until,1
243,carri wa six ivori,1
244,carrier hand packag that,1
245,carrier if the product,1
246,carrier no respect anyon,1
247,carrier report absent home,1
248,carrier until the moment,1
249,cart babi comfort not,1
250,cart deliv the other,1
251,cart mose babi comfort,1
252,cart solv problem not,1
253,cart the babi comfort,1
254,cart the comfort miss,1
255,cartel color roll beig,1
256,cartridg came burn can,1
257,cartridg came shaken falsifi,1
258,cartridg comput indic it,1
259,cartridg correct is dubiou,1
260,cartridg did print accord,1
261,cartridg expens the color,1
262,cartridg hand nine hundr,1
263,cartridg last averag doubl,1
264,cartridg messag my hp,1
265,cartridg non origin print,1
266,cartridg not origin black,1
267,cartridg not origin cancel,1
268,cartridg one black one,1
269,cartridg phone hundr twenti,1
270,cartridg printer indic it,1
271,cartridg printer sixti receiv,1
272,cartridg provid under pressur,1
273,cartridg receiv four unit,1
274,cartridg stop print even,1
275,cartridg we receiv one,1
276,cartridg when instal in,1
277,cartridg would high yield,1
278,cascad pr live rj,1
279,case bought for big,1
280,case case contain inform,1
281,case case nf accompani,1
282,case case one extern,1
283,case clock same bracelet,1
284,case contain inform wa,1
285,case my request will,1
286,case nf accompani case,1
287,case one extern hd,1
288,case send contact partner,1
289,casino clock differ the,1
290,casino model bought six,1
291,casino model last hundr,1
292,casino rose gold watch,1
293,casino vintag digit fashion,1
294,casino watch market origin,1
295,categori apach thin thick,1
296,caus the chair be,1
297,cd accompani product came,1
298,cd but will not,1
299,cd the drive not,1
300,cd tri make exchang,1
301,ceas two smart ramo,1
302,cell phone appear corrupt,1
303,cell phone immedi exchang,1
304,cell phone it not,1
305,cell phone miss the,1
306,cell phone pc not,1
307,cell phone targaryen nation,1
308,cell phone tri access,1
309,cellular number post offic,1
310,center veri bad can,1
311,central canist know happen,1
312,central control see in,1
313,central deliv product anoth,1
314,central jeep renegad until,1
315,central of request have,1
316,cep twenti two million,1
317,cepfifti five million six,1
318,cepthirti one one hundr,1
319,certain deliveri man littl,1
320,certainli would buy do,1
321,citi request made two,1
322,citi there inform there,1
323,claim he to cancel,1
324,claim stock crime stark,1
325,claim the address wrong,1
326,claim tri three deliveri,1
327,claim went place wa,1
328,clarif realli gener doubt,1
329,class ten besid fals,1
330,class ten card receiv,1
331,class wa deliv market,1
332,classic one hundr aqua,1
333,clay correspond the car,1
334,clean brush if someon,1
335,clean packag open the,1
336,cleaner the cigarett ancient,1
337,cleaner wa deliv asp,1
338,clear blue came dark,1
339,clear it wa product,1
340,clear kem deck big,1
341,clear low product qualiti,1
342,clear stain the photo,1
343,clearli be origin have,1
344,clearli copi china am,1
345,clearli falsifi with coupl,1
346,clearli feel cheat canist,1
347,clerk not receiv complaint,1
348,client alreadi held purchas,1
349,client ask one two,1
350,client did do anyth,1
351,client is store stallion,1
352,client lack profession imposs,1
353,client marathon now happen,1
354,client not judg quem,1
355,client prove the request,1
356,client respons custom simpli,1
357,client the wrong product,1
358,client thi carrier no,1
359,client would like return,1
360,clio two work came,1
361,clock admir with larg,1
362,clock afternoon precis eighteen,1
363,clock arriv watch wa,1
364,clock bad qualiti look,1
365,clock bought for six,1
366,clock box empti look,1
367,clock box without screw,1
368,clock came anoth sent,1
369,clock came damag is,1
370,clock came glass failur,1
371,clock cancel order still,1
372,clock come ask everyth,1
373,clock come plastic latch,1
374,clock contact the water,1
375,clock deliv feminin model,1
376,clock deliv without voic,1
377,clock differ the clock,1
378,clock falsifi quit differ,1
379,clock flower bracelet pearl,1
380,clock golden rhineston stress,1
381,clock lousi stain bracelet,1
382,clock mechan the pointer,1
383,clock month until present,1
384,clock not origin found,1
385,clock not worth paid,1
386,clock origin besid falsifi,1
387,clock releas fragil led,1
388,clock request two six,1
389,clock same bracelet alreadi,1
390,code come anoth total,3
391,code without separ post,1
392,coffe grinder not two,1
393,coher posit to arriv,1
394,color option in the,1
395,color print etc the,1
396,color request blue mark,1
397,color request pink came,1
398,color roll beig flower,1
399,color sent from anoth,1
400,color sent red color,1
401,color that did have,1
402,color the product came,1
403,color thi reason do,1
404,color unfortun could make,1
405,color what order the,1
406,com br sell fals,1
407,com complaint channel could,1
408,com have partner compani,1
409,com no idea happen,1
410,com not succeed far,1
411,com stop receiv product,1
412,com store make the,1
413,com store one book,1
414,com targaryen spi clock,1
415,comb mount crook do,1
416,combat doubl hd plu,1
417,combin bought two kit,1
418,combin date without label,1
419,combin deadlin product came,1
420,combin have give note,1
421,combo cart mose babi,1
422,combo combo cart mose,1
423,combo eleven box arriv,1
424,combo twelv unit total,1
425,come accord the advertis,1
426,come across problem the,1
427,come all constant accessori,1
428,come and paid the,2
429,come announc did work,1
430,come announc product noth,1
431,come anoth model casino,1
432,come anoth total differ,3
433,come ask everyth indic,1
434,come back the store,1
435,come be my email,1
436,come blue ye white,1
437,come broken decreas qualiti,1
438,come broken want chang,1
439,come chip the pictur,1
440,come color request blue,1
441,come complet damag tabl,1
442,come complet it came,1
443,come contact day without,1
444,come contact explain can,1
445,come deliveri even want,1
446,come describ product the,1
447,come empti ink thi,1
448,come far am wait,1
449,come incomplet whip miss,1
450,come it differ the,1
451,come it state they,1
452,come justif await regular,1
453,come lie surrend it,1
454,come like descript the,1
455,come littl water littl,1
456,come manual with orient,1
457,come much cancel until,1
458,come my resid my,1
459,come new came pack,1
460,come one kg glue,1
461,come one you want,1
462,come plastic latch prevent,1
463,come pleas check appear,1
464,come product bought bad,1
465,come request the exchang,1
466,come sent email ask,1
467,come switch tri call,1
468,come tester packag the,1
469,come the box neither,1
470,come the deadlin thank,1
471,come the electr facet,1
472,come the four batteri,1
473,come the mosquito net,1
474,come the next day,1
475,come the product manual,1
476,come the voic my,1
477,come two separ deliveri,1
478,come two there no,1
479,come voic the return,1
480,come we expect not,1
481,come within origin packag,1
482,come without problem he,1
483,come write averag need,1
484,come ye product not,1
485,comfort adapt cart deliv,1
486,comfort miss just receiv,1
487,comment did get casino,1
488,comment store it let,1
489,comment the product the,1
490,comment when recommend store,1
491,commit bought twelv seven,1
492,commit made am deepli,1
493,commit stark client did,1
494,commun channel want the,1
495,commun problem await return,1
496,commun seller purchas the,1
497,commun still await request,1
498,commun will provid back,1
499,compani accord them wa,1
500,compani although ha issu,1
501,compani alway bought indic,1
502,compani and canist also,1
503,compani brand provid bought,1
504,compani carrier until the,1
505,compani deliv anoth product,1
506,compani deliv one still,1
507,compani differ post offic,1
508,compani do meet punctual,1
509,compani give back money,1
510,compani grow you also,1
511,compani in the statu,1
512,compani is take long,1
513,compani made promot crash,1
514,compani neither gener nf,1
515,compani no one answer,1
516,compani not contact the,1
517,compani not deliv product,1
518,compani not get answer,1
519,compani not indic third,1
520,compani not meet it,1
521,compani not return mail,1
522,compani not send ani,1
523,compani now is more,1
524,compani offer the servic,1
525,compani posit so far,1
526,compani question the delay,1
527,compani receiv money not,1
528,compani reliabl seen product,1
529,compani return mail doe,1
530,compani sell book deliv,1
531,compani sent one the,1
532,compani simpli deliv product,1
533,compani sold speak non,1
534,compani spend littl had,1
535,compani take deliveri not,1
536,compani targaryen sell product,1
537,compani the product veri,1
538,compani took five day,1
539,compani well regard marathon,1
540,compani work post offic,2
541,compar the price small,1
542,compat mirror alreadi purchas,1
543,compat my purifi the,1
544,compat the electrolux ergoasi,1
545,complain anyon home that,1
546,complain mail the american,1
547,complain none the phone,1
548,complain protocol open canist,1
549,complain that would send,1
550,complain the product found,1
551,complain the site ask,1
552,complain tri receiv product,1
553,complaint anymor no one,1
554,complaint await refund my,1
555,complaint becam and you,1
556,complaint channel could not,1
557,complaint do not recommend,1
558,complaint final tire lost,1
559,complaint four day still,1
560,complaint is messi inform,1
561,complaint non deliveri the,1
562,complaint noth done pleas,1
563,complaint paid freight receiv,1
564,complaint sinc six eighteen,1
565,complaint so far noth,1
566,complaint so far one,1
567,complaint the site no,1
568,complaint they not give,1
569,complaint wait contact the,1
570,complet damag shave corner,1
571,complet damag tabl baba,1
572,complet deliveri date compani,1
573,complet differ advertis bad,1
574,complet differ product it,1
575,complet differ should proceed,1
576,complet differ the compani,1
577,complet differ the imag,1
578,complet differ voic describ,1
579,complet dissatisfi want money,1
580,complet fifti read absurd,1
581,complet it came one,1
582,complet made plastic understand,1
583,complet product bad stay,1
584,complet purchas check it,1
585,complet purchas miss one,1
586,complet purchas product bought,1
587,complet the complaint final,1
588,compon box with the,1
589,compon it urgent need,1
590,compos kit bought overcom,1
591,composit came came aca,1
592,composit the product not,1
593,compromis consum confid the,1
594,compromis request area one,1
595,compromis the function it,1
596,comput indic it use,1
597,comput is not recogn,1
598,comput screen be fals,1
599,concern custom is transpar,1
600,concern custom it cancel,1
601,concern the qualiti the,1
602,conclus paid doubl someth,1
603,conclus sent broken product,1
604,concret inform canist supplier,1
605,condit give someon that,1
606,condit seem have alreadi,1
607,cone made the request,1
608,confer deliveri product box,1
609,confer the advertis specif,1
610,confer the name anoth,1
611,confer the request my,1
612,configur of offer the,1
613,configur three four gh,1
614,confirm cancel plu product,1
615,confirm discount valu card,1
616,confirm one day it,1
617,confirm payment is long,1
618,confirm post ten gram,1
619,confirm the return so,1
620,confirm they or in,1
621,connect aquarium convert two,1
622,connect error also could,1
623,connect imposs pc the,1
624,connect low loos slice,1
625,connect the deliveri no,1
626,connect the outlet noth,1
627,connector deliv differ what,1
628,connector fifti want the,1
629,connector in deliveri packag,1
630,connector two male ten,1
631,consid not deliv funk,1
632,consid truck driver wa,1
633,consider toward custom perceiv,1
634,consign the product came,1
635,consist deliv six eight,1
636,consist deliv sixteen eight,1
637,consist deliv twenti three,1
638,consist deliv want product,1
639,consist receiv not receiv,1
640,consist the propaganda made,1
641,constant accessori the advertis,1
642,constantli connect air plant,1
643,consum buy pay not,1
644,consum buy want receiv,1
645,consum confid the brand,1
646,consum final stay await,1
647,consum have alreadi reclaim,1
648,consum larg bag twenti,1
649,consum no doubt time,1
650,consum right return the,1
651,consum right want the,1
652,consum send color well,1
653,consumpt you remov lock,1
654,contact anyon canist system,1
655,contact bought two offer,1
656,contact canist request inform,1
657,contact clarif realli gener,1
658,contact compani not get,1
659,contact day without solut,1
660,contact did get answer,1
661,contact doe respond my,1
662,contact explain can contact,1
663,contact immedi the site,1
664,contact justifi the lack,1
665,contact know happen the,1
666,contact know product news,1
667,contact know to solv,1
668,contact lens posit hyperopia,2
669,contact lens receiv one,1
670,contact lens wrong degre,1
671,contact mail no one,1
672,contact not work terribl,1
673,contact partner push the,1
674,contact receiv the ship,1
675,contact resolv the issu,1
676,contact sand assist report,1
677,contact seller the sixteenth,1
678,contact so far noth,1
679,contact so far voic,1
680,contact solut without success,1
681,contact speak deliveri howev,1
682,contact store four day,1
683,contact store open complaint,1
684,contact store so far,1
685,contact targaryen said he,1
686,contact the canist no,1
687,contact the compani targaryen,1
688,contact the compani yet,1
689,contact the day receipt,1
690,contact the product ha,1
691,contact the seller so,1
692,contact the seller targaryen,1
693,contact the water ha,1
694,contact to deliv other,1
695,contact to solv problem,1
696,contact trade correct cancel,1
697,contact twenti one nine,1
698,contact urgent seventi one,1
699,contact we not get,2
700,contain inform wa sent,1
701,contain measur do not,1
702,contain two hundr sixti,1
703,content in the other,1
704,content scatter the product,1
705,continu the procedur deliv,1
706,continu without the merchandis,1
707,control alreadi sent email,1
708,control aquarium connect aquarium,1
709,control doe have smart,1
710,control put product unavail,1
711,control receiv kdlforti one,1
712,control request vfd forward,1
713,control see in shop,1
714,converg my build refus,1
715,convert marathon and call,1
716,convert two type not,1
717,conveyor indign the partnership,1
718,cook extrem thin simpl,1
719,cooker reach use buy,1
720,cooler compat my purifi,1
721,cooper want money back,1
722,copi china am disappoint,1
723,coppa seven hundr ml,1
724,copper bed is actual,1
725,copper bed pillow cover,1
726,copper bed receiv sheet,1
727,copper came gold anoth,1
728,copper is use deliv,1
729,core android four two,1
730,corner torn all defect,1
731,correct address one receiv,1
732,correct amount miss breast,1
733,correct book pleas contact,1
734,correct cancel the purchas,1
735,correct deadlin came miss,1
736,correct deliveri made new,1
737,correct descript product not,1
738,correct descript product send,1
739,correct except product is,1
740,correct howev connect low,1
741,correct instruct manual miss,1
742,correct is dubiou product,1
743,correct it did not,1
744,correct law one hundr,1
745,correct printer describ the,1
746,correct product bought at,1
747,correct product bought two,1
748,correct product so far,1
749,correct product wa hdi,1
750,correct professor pigment da,1
751,correct thi vz came,1
752,correct time minut the,1
753,correct voltag imposs oper,1
754,correctli bought twokit bladder,1
755,correctli did get answer,1
756,correctli lost file put,1
757,correctli my machin ob,1
758,correctli one product came,1
759,correctli within deadlin qualiti,1
760,correspond far have receiv,1
761,correspond my expect bought,1
762,correspond photo smaller defect,1
763,correspond the car model,1
764,correspond the receiv model,1
765,correspond what deliv total,1
766,corrupt on the comput,1
767,corrupt wait an answer,1
768,cost much cheaper compani,1
769,cost one hundr fifti,1
770,cost two hundr sixti,2
771,cotton have alreadi made,1
772,cotton unfortun look sever,1
773,could bought in gray,1
774,could cancel want chang,1
775,could chang cancel the,1
776,could come anoth print,1
777,could contact the seller,1
778,could get touch solv,1
779,could get touch you,1
780,could improv do buy,1
781,could inform or not,1
782,could make exchang alreadi,1
783,could make exchang due,1
784,could make exchang the,1
785,could much better color,1
786,could not bad busi,1
787,could not enter phone,1
788,could not speak the,1
789,could onli two day,1
790,could over the phone,1
791,could receiv feel fool,1
792,could request exchang site,1
793,could send mail explain,1
794,could send the other,1
795,could test in fact,1
796,could track deliveri appear,1
797,could track product almost,1
798,could use the product,1
799,could wear the car,1
800,count the support the,1
801,count two product accord,1
802,counterfeit product explain black,1
803,counterfeit use cartridg messag,1
804,countri even need posit,1
805,coupl doe fit the,1
806,coupl feel do recommend,1
807,coupl golden finish with,1
808,coupl marketplac togeth sale,1
809,coupl mattress cover not,1
810,coupl seal packag the,1
811,coupl silver silk color,1
812,coupl the car arriv,1
813,coupl voic came glu,1
814,courag do type sucanagem,1
815,courier far resid want,1
816,cours get could inform,1
817,cover came damag glu,1
818,cover car horribl terribl,1
819,cover chair without the,1
820,cover crossbow tire so,1
821,cover dri samsung ten,1
822,cover fourteen note receiv,1
823,cover it not come,1
824,cover larger notebook do,1
825,cover look like larg,1
826,cover not deliv appear,1
827,cover not yet arriv,1
828,cover receiv blanket in,1
829,cover request notebook wa,1
830,cover the cell phone,1
831,cover the chair that,1
832,cover the clay came,1
833,cover wa much not,1
834,coward did not come,1
835,crack broken wa alreadi,1
836,crack even seal packag,1
837,crack made the other,1
838,crack miss piec seller,1
839,crack product poor qualiti,1
840,crack sourc bodi howev,1
841,crack whole content scatter,1
842,cradl royalti wa not,1
843,cradl waterproof cotton have,1
844,crap deceit better stone,1
845,crap do recommend anyon,1
846,crap mislead propaganda not,1
847,crap want chang could,1
848,crash my card then,1
849,creat mani expect found,1
850,creat not come sent,1
851,creat onli they deliv,1
852,creator articul neither three,1
853,credit card await return,1
854,credit card did get,1
855,credit card due lack,1
856,credit card onli one,1
857,credit card want know,1
858,creep green flag waterproof,1
859,crime stark follow in,1
860,crisp piraci sign also,1
861,criterion commit the client,1
862,crook caus the chair,1
863,crossbow tire so far,1
864,crude mistak the store,1
865,crystal plan two pendant,1
866,cuba exchang miss part,1
867,cuba sever wonder mark,1
868,cup each bought six,1
869,cup miss four await,1
870,cup pleas ask deliveri,1
871,cup the decor plate,1
872,curaprox black edit toothbrush,1
873,curli white part so,1
