,phrases,frequency
2619,product came fade one,1
2620,product came fake step,1
2621,product came faulti break,1
2622,product came incomplet miss,1
2623,product came malfunct tri,1
2624,product came miss greater,1
2625,product came miss one,1
2626,product came not bought,1
2627,product came number the,1
2628,product came origin box,1
2629,product came poor condit,1
2630,product came rape am,1
2631,product came spoil bad,1
2632,product came the differ,1
2633,product came the free,1
2634,product came the label,1
2635,product came the ship,1
2636,product came the stipul,1
2637,product came the vote,1
2638,product came the wrong,3
2639,product came total differ,1
2640,product came total wrong,1
2641,product came toy box,1
2642,product came wa what,1
2643,product came wrap an,1
2644,product came wrong anoth,2
2645,product came wrong backer,1
2646,product came wrong broken,1
2647,product came wrong did,1
2648,product came wrong have,1
2649,product came wrong noth,1
2650,product came wrong voltag,1
2651,product came wrong with,1
2652,product can not cancel,1
2653,product cancel deliveri the,1
2654,product cancel the request,1
2655,product canist websit not,1
2656,product case clock same,1
2657,product charg my credit,1
2658,product check product total,1
2659,product chemic fertil the,1
2660,product ching ling place,1
2661,product chose ask wa,1
2662,product clearli be origin,1
2663,product close win expir,1
2664,product code come anoth,3
2665,product color sent from,1
2666,product come blue ye,1
2667,product come broken want,1
2668,product come complet it,1
2669,product come poor condit,1
2670,product come the deadlin,1
2671,product come without problem,1
2672,product compani differ post,1
2673,product compani not contact,1
2674,product configur of offer,1
2675,product confirm discount valu,1
2676,product consist deliv six,1
2677,product consist deliv sixteen,1
2678,product contact canist request,1
2679,product contain two hundr,1
2680,product correctli did get,1
2681,product cost two hundr,1
2682,product could cancel want,1
2683,product could make exchang,1
2684,product could send mail,1
2685,product cover dri samsung,1
2686,product crack whole content,1
2687,product crisp piraci sign,1
2688,product crook evil well,1
2689,product day is today,1
2690,product day the request,1
2691,product deadlin almost thirti,1
2692,product default inform than,1
2693,product defect want fix,1
2694,product delay deliveri far,1
2695,product deliv accord the,1
2696,product deliv actual bought,1
2697,product deliv alleg incomplet,1
2698,product deliv anoth color,1
2699,product deliv anyway did,1
2700,product deliv at first,1
2701,product deliv broken did,1
2702,product deliv broken not,1
2703,product deliv cascad pr,1
2704,product deliv could contact,1
2705,product deliv differ the,1
2706,product deliv half miss,1
2707,product deliv howev is,1
2708,product deliv howev updat,1
2709,product deliv it not,1
2710,product deliv late worst,1
2711,product deliv lower ask,1
2712,product deliv no given,1
2713,product deliv not product,1
2714,product deliv not receiv,1
2715,product deliv note issu,1
2716,product deliv one thought,1
2717,product deliv onli one,1
2718,product deliv poorli qualiti,1
2719,product deliv return recipi,1
2720,product deliv the address,1
2721,product deliv the color,1
2722,product deliv the post,1
2723,product deliv without in,1
2724,product deliv worth forti,1
2725,product deliv wrong bought,1
2726,product deliv wrong did,1
2727,product deliv yesterday the,1
2728,product deliveri forecast thirteen,1
2729,product deliveri the request,3
2730,product deliveri time two,1
2731,product deliveri within deadlin,1
2732,product der withdrawn the,1
2733,product describ black arriv,1
2734,product descript not match,1
2735,product did accept exchang,1
2736,product did get return,1
2737,product did have stock,2
2738,product did have took,1
2739,product did not ani,1
2740,product did not respond,1
2741,product did not satisfi,1
2742,product did return messag,1
2743,product differ advertis much,1
2744,product differ color handl,1
2745,product differ store the,1
2746,product differ the photo,1
2747,product disappoint sent wrong,1
2748,product disproportion poor qualiti,1
2749,product do deliv at,1
2750,product do understand sinc,1
2751,product do usual problem,1
2752,product doe accept return,1
2753,product doe have sell,1
2754,product doe have stock,1
2755,product doe understand anyth,1
2756,product doe work no,1
2757,product doe work without,1
2758,product done almost the,1
2759,product eight six today,1
2760,product equal came correctli,1
2761,product especi bath tower,1
2762,product estelionato passag made,1
2763,product even alreadi enter,1
2764,product even disguis total,1
2765,product even it deliv,2
2766,product even money back,1
2767,product exchang lower amount,1
2768,product expens peopl the,1
2769,product explain black cartridg,1
2770,product falsifi did come,1
2771,product far have receiv,1
2772,product far one answer,1
2773,product far or voic,1
2774,product fear be without,1
2775,product felt cheat it,1
2776,product fifteen day expect,1
2777,product finish not good,1
2778,product first time purchas,1
2779,product for reason can,1
2780,product found differ what,1
2781,product four order item,1
2782,product four thirti two,1
2783,product four twenti nine,1
2784,product freight noth come,1
2785,product fulfil promis bottl,1
2786,product gave onli one,1
2787,product gave problem the,1
2788,product get avail readi,1
2789,product go the deliveri,1
2790,product goe to the,1
2791,product good it an,1
2792,product good sold if,1
2793,product good the deliveri,1
2794,product gray receiv beig,1
2795,product ha come lie,1
2796,product ha deliv not,2
2797,product ha noth do,1
2798,product ha yet arriv,2
2799,product ha yet deliv,1
2800,product had answer it,1
2801,product had buy and,1
2802,product had deliv not,1
2803,product had made the,1
2804,product hand what had,1
2805,product have alway bought,1
2806,product have come two,1
2807,product have go post,1
2808,product have noth say,1
2809,product have pay wait,1
2810,product he certainli would,1
2811,product held eleven seven,1
2812,product horribl bought the,1
2813,product howev one deliv,1
2814,product imag color print,1
2815,product imag present the,1
2816,product in stark competitor,1
2817,product in stock call,1
2818,product in the courier,1
2819,product incompat print deskjet,1
2820,product incomplet miss birth,1
2821,product induc incorrect purchas,1
2822,product inform not given,1
2823,product inform parallel replica,1
2824,product iran not the,1
2825,product is alreadi way,1
2826,product is bad qualiti,1
2827,product is birthday gift,1
2828,product is close should,1
2829,product is defect not,2
2830,product is five day,1
2831,product is jump nail,1
2832,product is lower the,1
2833,product is ombudsman complaint,1
2834,product is replica the,1
2835,product is still discount,1
2836,product it alreadi pass,1
2837,product it ask ad,1
2838,product it bought two,1
2839,product it came coupl,1
2840,product it not deliv,1
2841,product it not yet,1
2842,product it paid alreadi,1
2843,product it wa to,1
2844,product just arriv howev,1
2845,product just sent an,1
2846,product kit three magnesium,1
2847,product lack respect the,1
2848,product last time look,1
2849,product launch voic gave,1
2850,product least miss or,1
2851,product light blue color,1
2852,product light relat the,1
2853,product like bisch did,1
2854,product limoncello italian premium,1
2855,product littl qualiti site,1
2856,product look like wa,1
2857,product lousi came rip,1
2858,product made an old,1
2859,product made complaint they,1
2860,product made credit card,1
2861,product made purchas two,1
2862,product match expect veri,1
2863,product mattress protector cradl,1
2864,product maximum deliveri date,1
2865,product may nine differ,1
2866,product mention mail receiv,1
2867,product metro seal receiv,1
2868,product mine arriv would,1
2869,product mine listen the,1
2870,product minor thirtyxthirti kit,1
2871,product miss forc cabl,1
2872,product miss part send,2
2873,product miss piec request,1
2874,product miss soon possibl,1
2875,product miss they gave,1
2876,product miss unit still,1
2877,product miss white upset,1
2878,product moment alway buy,1
2879,product money back canist,1
2880,product more thirti day,1
2881,product movement lx one,1
2882,product much expect came,1
2883,product my address is,1
2884,product my money back,2
2885,product my son birthday,1
2886,product my son everi,1
2887,product na atemdeu specul,1
2888,product name anoth person,1
2889,product need improv lot,1
2890,product need they said,1
2891,product neither post offic,1
2892,product never call ignit,1
2893,product never receiv thi,1
2894,product nf within product,1
2895,product nizzio amor advanc,1
2896,product no inform send,1
2897,product no seal the,1
2898,product not adapt my,1
2899,product not an answer,1
2900,product not appar work,1
2901,product not arriv can,1
2902,product not arriv had,1
2903,product not arriv is,1
2904,product not arriv mail,1
2905,product not arriv my,1
2906,product not arriv need,1
2907,product not arriv the,1
2908,product not arriv wait,1
2909,product not arriv yet,4
2910,product not come accord,1
2911,product not come and,2
2912,product not come far,3
2913,product not come full,1
2914,product not come model,1
2915,product not come new,1
2916,product not come purchas,2
2917,product not come voic,1
2918,product not come we,1
2919,product not comment store,1
2920,product not contact trade,1
2921,product not correspond expect,1
2922,product not correspond my,1
2923,product not correspond the,3
2924,product not deliv although,1
2925,product not deliv am,1
2926,product not deliv compani,1
2927,product not deliv far,2
2928,product not deliv first,1
2929,product not deliv is,1
2930,product not deliv nineteen,1
2931,product not deliv request,1
2932,product not deliv the,1
2933,product not deliv want,2
2934,product not deliv which,1
2935,product not deliv within,1
2936,product not deliv without,1
2937,product not deliv would,1
2938,product not deliv yet,1
2939,product not evalu yet,1
2940,product not even go,1
2941,product not even report,1
2942,product not expect it,1
2943,product not give correct,1
2944,product not give to,1
2945,product not iron gym,1
2946,product not know to,1
2947,product not more one,1
2948,product not origin that,1
2949,product not pay read,1
2950,product not posit the,1
2951,product not receiv deadlin,1
2952,product not receiv ridicul,1
2953,product not receiv will,1
2954,product not recommend it,1
2955,product not recommend store,1
2956,product not return the,1
2957,product not same shown,1
2958,product not same the,2
2959,product not send connect,1
2960,product not ship within,1
2961,product not targaryen purchas,1
2962,product not the best,1
2963,product not the pattern,1
2964,product not the photo,1
2965,product not they protein,1
2966,product not thought wa,1
2967,product not transport is,1
2968,product not weight three,1
2969,product not work all,1
2970,product not work applianc,1
2971,product not work not,1
2972,product not work time,1
2973,product not work without,1
2974,product not worth it,1
2975,product not worth price,1
2976,product not yet arriv,8
2977,product not yet deliv,11
2978,product not yet reach,1
2979,product not yet tri,1
2980,product noth do photo,1
2981,product noth good wa,1
2982,product noth my request,1
2983,product noth the deliveri,1
2984,product now canist no,1
2985,product now report the,1
2986,product of voltag not,1
2987,product offer it partner,1
2988,product offer the advertis,1
2989,product on site is,1
2990,product one arriv anoth,1
2991,product one give an,1
2992,product one hundr eighti,1
2993,product one hundr paraguay,1
2994,product one hundr twenti,1
2995,product one the end,1
2996,product onli deliv one,1
2997,product onli receiv two,1
2998,product orang color came,1
2999,product orang color sent,1
3000,product order got anoth,1
3001,product origin china bad,1
3002,product origin pirat whose,1
3003,product origin qualiti certainti,1
3004,product origin the ear,1
3005,product outrag depend thi,1
3006,product pack violat had,1
3007,product packag without seal,1
3008,product paid fifti two,1
3009,product paid not get,1
3010,product paid ship thought,1
3011,product paid view wa,1
3012,product past estim time,1
3013,product past role am,1
3014,product pattern sold my,1
3015,product payment approv one,1
3016,product photo not same,1
3017,product photo receiv well,1
3018,product photo the site,2
3019,product place bought bought,1
3020,product pleas want solut,1
3021,product plu card will,1
3022,product poor qualiti do,1
3023,product poor qualiti doe,1
3024,product poor qualiti is,1
3025,product poor qualiti noth,1
3026,product poorli qualiti should,1
3027,product post offic not,1
3028,product post offic say,1
3029,product post strike the,1
3030,product predict deliveri june,1
3031,product present clear low,1
3032,product present problem power,1
3033,product problem sinc product,1
3034,product product finish not,1
3035,product product stolen post,1
3036,product purchas ask measur,1
3037,product purchas begin month,1
3038,product purchas cart the,1
3039,product purchas is worth,1
3040,product purchas me request,1
3041,product purchas paid not,1
3042,product purchas the canist,2
3043,product purchas the site,1
3044,product purchas wa deliv,1
3045,product qualiti fit the,1
3046,product qualiti not wait,1
3047,product quantiti two two,2
3048,product quit expect photo,1
3049,product rate wa readi,1
3050,product reach deadlin intact,1
3051,product reach right time,1
3052,product reach way demonstr,1
3053,product receiv anoth complet,1
3054,product receiv anoth product,1
3055,product receiv anoth total,2
3056,product receiv base label,1
3057,product receiv besid not,1
3058,product receiv came differ,1
3059,product receiv differ lower,1
3060,product receiv differ the,2
3061,product receiv even request,1
3062,product receiv money back,1
3063,product receiv my address,1
3064,product receiv one hundr,1
3065,product receiv one mail,1
3066,product receiv one wait,1
3067,product receiv one want,1
3068,product receiv pirat go,1
3069,product receiv plastic curtain,1
3070,product receiv risk product,1
3071,product receiv seal packag,1
3072,product receiv the amount,1
3073,product receiv three white,1
3074,product recommend seller noth,1
3075,product refer seven five,1
3076,product reimburs the amount,1
3077,product repaid cancel cancel,1
3078,product replac nobodi return,1
3079,product request cancel wa,1
3080,product request plu the,1
3081,product request return the,1
3082,product return product want,1
3083,product return the question,1
3084,product return the refer,1
3085,product return the seller,1
3086,product return the sender,1
3087,product return the valu,1
3088,product ridicul small size,1
3089,product same receiv came,1
3090,product say it felpudo,1
3091,product say one sixti,1
3092,product say wa deliv,1
3093,product scandal maria kit,1
3094,product schedul thirti four,1
3095,product second ll get,1
3096,product seem be big,1
3097,product seem be lost,1
3098,product send incorrect gener,1
3099,product send wa behind,1
3100,product sent anoth complet,1
3101,product sent anoth product,2
3102,product sent guidanc owe,1
3103,product sent not product,1
3104,product sent one gave,1
3105,product sent out origin,1
3106,product sent plastic that,1
3107,product sent that advertis,1
3108,product sent the advertis,1
3109,product sent the product,2
3110,product sent total differ,1
3111,product serv model two,1
3112,product ship got respons,1
3113,product should receiv two,1
3114,product shown site differ,1
3115,product sinc confirm payment,1
3116,product sinc deliv screw,1
3117,product sinc eleventh to,1
3118,product sinc it dispatch,1
3119,product six cup miss,1
3120,product six eight on,1
3121,product six seven two,1
3122,product small defect request,1
3123,product small where screen,1
3124,product smaller quantiti bought,1
3125,product so far ha,2
3126,product so far have,5
3127,product so far noth,1
3128,product so far one,1
3129,product so late arriv,1
3130,product sold camel twenti,1
3131,product sold the store,1
3132,product solv the wa,1
3133,product soon alway buy,1
3134,product soon first format,1
3135,product speak serv vehicl,1
3136,product stark targaryen peso,1
3137,product state the track,1
3138,product statu deliveri say,1
3139,product still not know,1
3140,product still not respond,1
3141,product still not the,1
3142,product stock leav avail,1
3143,product stock let see,1
3144,product stock the end,1
3145,product stock would would,1
3146,product stolen post offic,1
3147,product stop step deep,1
3148,product store came one,1
3149,product store offer did,1
3150,product store onli receiv,1
3151,product such bad qualiti,1
3152,product taken nineti day,1
3153,product technic sheet not,1
3154,product term to fulfil,1
3155,product than photo wa,1
3156,product thank the attent,1
3157,product that wa deliv,1
3158,product the amount paid,1
3159,product the broken control,1
3160,product the call center,1
3161,product the cart solv,1
3162,product the code authent,1
3163,product the combin bought,1
3164,product the compani although,1
3165,product the compani give,1
3166,product the deadlin day,1
3167,product the deadlin inform,1
3168,product the deadlin the,2
3169,product the distribut center,1
3170,product the film besid,1
3171,product the ha arriv,1
3172,product the hors not,1
3173,product the main not,1
3174,product the order one,1
3175,product the pan leak,1
3176,product the payment revers,1
3177,product the qualiti terribl,1
3178,product the request the,1
3179,product the return the,1
3180,product the revers the,1
3181,product the same came,1
3182,product the same longer,1
3183,product the site time,1
3184,product the size not,1
3185,product the stark websit,1
3186,product the store detail,1
3187,product the store did,1
3188,product the store receiv,1
3189,product the top seem,1
3190,product the track say,1
3191,product the valu alreadi,1
3192,product then report they,1
3193,product they gave anoth,1
3194,product they inform would,1
3195,product they sent the,1
3196,product thi possibl veri,1
3197,product thi time did,1
3198,product thi time receiv,1
3199,product thin fabric noth,1
3200,product think is least,1
3201,product those receiv one,1
3202,product three day ago,1
3203,product three day delay,1
3204,product time still expect,1
3205,product to arriv six,1
3206,product to deliv eight,2
3207,product to return money,1
3208,product today did get,1
3209,product today post offic,1
3210,product took approxim fifti,1
3211,product took long arriv,1
3212,product took long time,1
3213,product total differ one,1
3214,product tower veri thin,1
3215,product tri cancel site,1
3216,product tri chang unsuccess,1
3217,product twelv seven deliveri,1
3218,product twenti eight piec,1
3219,product twenti one day,1
3220,product two paid want,1
3221,product unavail custom buy,1
3222,product unfortun janitor receiv,1
3223,product unfortun never to,1
3224,product unfortun work not,1
3225,product unit in packag,1
3226,product unit onli receiv,1
3227,product unit purchas pleas,1
3228,product unit receiv one,1
3229,product unit statement come,1
3230,product unit three moto,1
3231,product urgent use is,1
3232,product urgent want posit,1
3233,product use mark load,1
3234,product veri fragil hour,1
3235,product veri low qualiti,1
3236,product veri small nine,1
3237,product visual do buy,1
3238,product visual the email,1
3239,product voic issu behalf,1
3240,product wa an old,1
3241,product wa anoth problem,1
3242,product wa birthday present,1
3243,product wa deliv the,2
3244,product wa deliv yet,1
3245,product wa email phone,1
3246,product wa hdi switch,1
3247,product wa inform they,1
3248,product wa miss did,1
3249,product wa present avail,1
3250,product wa sent one,1
3251,product wa sold me,1
3252,product wait back guidanc,1
3253,product wait said would,1
3254,product wait the supplier,1
3255,product want color differ,1
3256,product want exchang return,1
3257,product want purchas revers,1
3258,product want repay urgent,1
3259,product want return receiv,1
3260,product way when sent,1
3261,product week accept the,1
3262,product well imag grass,1
3263,product well the immedi,1
3264,product went post offic,1
3265,product went the post,1
3266,product went they put,1
3267,product were two attempt,1
3268,product what receiv counterfeit,1
3269,product when open box,1
3270,product when use realiz,1
3271,product will not risk,1
3272,product with incorrect color,1
3273,product withdrawn post offic,1
3274,product within it not,1
3275,product without even consult,1
3276,product without featur what,1
3277,product without make the,1
3278,product without mark not,1
3279,product without stock onli,1
3280,product work could not,1
3281,product work send item,1
3282,product work some car,1
3283,product wors store not,1
3284,product would come the,1
3285,product would like an,1
3286,product would like cancel,1
3287,product would like know,1
3288,product would like return,1
3289,product wrong color thi,1
3290,product wrong could use,1
3291,product wrong product nf,1
3292,product wrong voic product,1
3293,product ye china want,1
3294,product yet consid truck,1
3295,product yet deadlin pass,1
3296,product yet deadlin until,1
3297,product yet is even,1
3298,product yet it not,1
3299,product yet not evalu,1
3300,product yet not even,1
3301,product yet receiv deliveri,1
3302,product yet request deadlin,1
3303,product yet say if,1
3304,product yet two month,1
3305,product you gave anoth,1
3306,profession the way the,1
3307,profession to put she,1
3308,professor pigment da eiga,1
3309,progress arriv violat besid,1
3310,progress kit onli gave,1
3311,progress the product visual,1
3312,progress zap dissatisfi first,1
3313,promis bottl doe not,1
3314,promis deliveri eight two,1
3315,promis term noncompli ha,1
3316,promot crash my card,1
3317,propaganda bought product they,1
3318,propaganda decid forward the,1
3319,propaganda in descript say,1
3320,propaganda is worth fifti,1
3321,proper packag damag product,1
3322,properli came without the,1
3323,properli the screen wa,1
3324,protect mail the deliveri,1
3325,protect so ha come,1
3326,protector cradl waterproof cotton,1
3327,protein creat onli they,1
3328,protocol low qualiti product,1
3329,protocol open canist on,1
3330,proton describ one hundr,1
3331,prove receiv one the,1
3332,prove the request receiv,1
3333,prove told it the,1
3334,proven two instal the,1
3335,provid bought henri card,1
3336,provid deliveri the rest,1
3337,provid satisfactori consum servic,1
3338,provid under pressur huge,1
3339,provis an evalu the,1
3340,provis otherwis will take,1
3341,ptaduto purchas deliveri delay,1
3342,puff chromebook deliveri incomplet,1
3343,puff not deliv tri,1
3344,puff pet receiv driver,1
3345,punctual commit made am,1
3346,purchas act hope wa,1
3347,purchas act went track,1
3348,purchas adjust thermal brace,1
3349,purchas along the cover,1
3350,purchas alreadi come the,1
3351,purchas am satisfi the,1
3352,purchas amount two receiv,1
3353,purchas and inform onli,1
3354,purchas arriv lid broken,1
3355,purchas ask one ha,1
3356,purchas at time deliveri,1
3357,purchas be revers the,1
3358,purchas begin month almost,1
3359,purchas believ is perhap,1
3360,purchas bought gray receiv,1
3361,purchas bought onc had,1
3362,purchas cachepot receiv bingo,1
3363,purchas cancel buy stainless,1
3364,purchas cancel five time,1
3365,purchas cancel issuanc voic,1
3366,purchas cancel not get,1
3367,purchas cancel not remov,1
3368,purchas cancel store not,1
3369,purchas cancel without request,1
3370,purchas cancel you tri,1
3371,purchas canist it took,1
3372,purchas carri wa six,1
3373,purchas cart the comfort,1
3374,purchas check it doubl,1
3375,purchas child carbon advanc,1
3376,purchas chose product imag,1
3377,purchas clear it wa,1
3378,purchas come incomplet whip,1
3379,purchas come tester packag,1
3380,purchas could bought in,1
3381,purchas day pillow broom,1
3382,purchas deliv my resid,1
3383,purchas deliveri delay outsid,1
3384,purchas demand urgent solut,1
3385,purchas dryer the two,1
3386,purchas even tri give,1
3387,purchas extend lack mail,1
3388,purchas first product deliv,1
3389,purchas four len box,1
3390,purchas four product receiv,1
3391,purchas four twenti nine,1
3392,purchas gt mm day,1
3393,purchas have alreadi done,1
3394,purchas have yet posit,1
3395,purchas hot wheel it,1
3396,purchas imposs cancel even,1
3397,purchas indic the arctic,1
3398,purchas inform compromis request,1
3399,purchas is worth note,1
3400,purchas item came one,1
3401,purchas item were nf,1
3402,purchas know they mislead,1
3403,purchas made canist store,1
3404,purchas made four eight,1
3405,purchas made januari deliv,1
3406,purchas made me thi,1
3407,purchas made seventeenth still,1
3408,purchas made the canist,1
3409,purchas made the payment,1
3410,purchas made you bought,1
3411,purchas make asham despit,1
3412,purchas me request made,1
3413,purchas me the model,1
3414,purchas mine doe come,1
3415,purchas miss one one,1
3416,purchas more month so,1
3417,purchas need be cancel,1
3418,purchas neg situat would,1
3419,purchas next card administr,1
3420,purchas not complet yet,1
3421,purchas not get return,1
3422,purchas not made the,1
3423,purchas not receiv want,1
3424,purchas not track object,1
3425,purchas object not deliv,1
3426,purchas occur not receiv,1
3427,purchas of skate hope,1
3428,purchas one day deliveri,1
3429,purchas one month so,1
3430,purchas paid freight product,1
3431,purchas paid freight to,1
3432,purchas paid not deliv,1
3433,purchas paid two unit,1
3434,purchas payment deadlin and,1
3435,purchas payment discov not,1
3436,purchas payment insid the,1
3437,purchas payment two unit,1
3438,purchas perform give the,1
3439,purchas pillow memori affect,1
3440,purchas pleas check what,1
