,phrases,frequency,English
2854,posit the product not deliv,1,
2855,posit the sale the exchang,1,
2856,posit the store relat the,2,
2857,posit the store the product,1,
2858,posit the store to thi,1,
2859,posit the supplier week no,1,
2860,posit to arriv my product,1,
2861,posit until present moment did,1,
2862,possibl cancel the product alreadi,1,
2863,possibl chang there no way,1,
2864,possibl evalu product product stolen,1,
2865,possibl veri seriou transport without,1,
2866,post neg comment when recommend,1,
2867,post number is the revers,1,
2868,post offic anoth citi product,1,
2869,post offic claim tri three,1,
2870,post offic claim went place,1,
2871,post offic deliv who receiv,1,
2872,post offic did like inform,1,
2873,post offic distant agenc home,1,
2874,post offic due the compani,1,
2875,post offic envelop address me,1,
2876,post offic et phone call,1,
2877,post offic everyth bought canist,1,
2878,post offic final had get,1,
2879,post offic great neglect their,1,
2880,post offic had sent the,1,
2881,post offic in the box,1,
2882,post offic know the store,1,
2883,post offic never fulfil the,1,
2884,post offic not deliv mayb,1,
2885,post offic not deliv product,1,
2886,post offic not yet arriv,1,
2887,post offic now deliv two,1,
2888,post offic onli two item,1,
2889,post offic receiv make deliveri,1,
2890,post offic remov the product,1,
2891,post offic report there an,1,
2892,post offic return upset should,1,
2893,post offic say wa deliv,1,
2894,post offic see had happen,1,
2895,post offic store make paid,1,
2896,post offic supplier not contact,1,
2897,post offic take long usual,1,
2898,post offic talk us terribl,1,
2899,post offic the product not,1,
2900,post offic they said onli,1,
2901,post offic they told that,1,
2902,post offic turn go to,1,
2903,post offic until the present,1,
2904,post offic who reimburs with,1,
2905,post offic would not deliv,1,
2906,post product far or voic,1,
2907,post show address incorrect howev,1,
2908,post strike the countri occur,1,
2909,post ten gram envelop not,1,
2910,post the code that appear,1,
2911,postag the product done almost,1,
2912,postal code that can return,1,
2913,postal complain anyon home that,1,
2914,pot end get damag rout,1,
2915,pot onli deliv one far,1,
2916,powder arriv the base not,1,
2917,powder paid two request made,1,
2918,power suppli cabl the same,1,
2919,practic they worthi peopl accord,1,
2920,preacher ten unit came wrap,1,
2921,preacher total twenti unit ll,1,
2922,precis eighteen five the day,1,
2923,precis mislead propaganda decid forward,1,
2924,predict deliveri june eighteen there,1,
2925,predict six six return paulo,1,
2926,prefer pay twenti on freight,1,
2927,prefer wait the provis an,1,
2928,premium coppa seven hundr ml,1,
2929,premium samsung stand wireless arriv,1,
2930,prepar ship four twenti three,1,
2931,present avail to day noth,1,
2932,present clear low product qualiti,1,
2933,present correct descript product not,1,
2934,present date did receiv feel,1,
2935,present date product not deliv,1,
2936,present date receiv order three,1,
2937,present did arriv the date,1,
2938,present error messag top ink,1,
2939,present moment did receiv explan,1,
2940,present moment did receiv the,1,
2941,present photo do not recommend,1,
2942,present play trash lack profession,1,
2943,present print without qualiti without,1,
2944,present problem power suppli cabl,1,
2945,present product did have stock,1,
2946,present site want be reimburs,1,
2947,present the canist websit the,1,
2948,present the site doe not,1,
2949,present two unit in seal,1,
2950,preserv dye when receiv wa,1,
2951,press one the two button,1,
2952,press the product four twenti,1,
2953,pressur cooker reach use buy,1,
2954,pressur dog place top it,1,
2955,pressur huge loss time the,1,
2956,prestito product is birthday gift,1,
2957,prevent stack consumpt you remov,1,
2958,previou devic conclus paid doubl,1,
2959,previou model model hv seven,1,
2960,previou purchas hot wheel it,1,
2961,price am tri contact did,1,
2962,price announc tri get touch,1,
2963,price charg phone the phone,1,
2964,price differ almost doubl tel,1,
2965,price freight get news have,1,
2966,price not worth headach went,1,
2967,price not worth the product,1,
2968,price paid would justifi came,1,
2969,price small poor qualiti horribl,1,
2970,print accord printer technician not,1,
2971,print blur without sharp match,1,
2972,print cartridg did print accord,1,
2973,print deskjet two thousand fifti,1,
2974,print etc the fact that,1,
2975,print in draft mode use,1,
2976,print terribl detect tri make,1,
2977,print the voic found strang,1,
2978,print without qualiti without focu,1,
2979,printer accus the comput screen,1,
2980,printer aggrav that voic the,1,
2981,printer cartridg came shaken falsifi,1,
2982,printer describ the repeat product,1,
2983,printer detect one the cartridg,1,
2984,printer identifi two cartridg non,1,
2985,printer indic it empti present,1,
2986,printer origin xl size receiv,1,
2987,printer refus they recharg request,1,
2988,printer sixti receiv one one,1,
2989,printer technician not origin in,1,
2990,printer the product wa sold,1,
2991,printer tri instal cartridg provid,1,
2992,printer valu one hundr seventi,1,
2993,pro go pro miss adapt,1,
2994,pro miss adapt connector two,1,
2995,problem administr the card did,1,
2996,problem all the item not,1,
2997,problem bought motor came semi,1,
2998,problem bought paid two unit,1,
2999,problem cabl am perform the,1,
3000,problem can not chang ask,1,
3001,problem deliveri product are fill,1,
3002,problem deliveri the first time,1,
3003,problem deliveri the product went,1,
3004,problem distribut now anoth ask,1,
3005,problem get product pack violat,1,
3006,problem he said nutrit tabl,1,
3007,problem hope they solv the,1,
3008,problem in case send contact,1,
3009,problem in post offic supplier,1,
3010,problem in resid postal complain,1,
3011,problem is deliv howev deliv,1,
3012,problem is phone number get,1,
3013,problem it seem bad guy,1,
3014,problem marathon hung the phone,1,
3015,problem other cancel want know,1,
3016,problem partner respond send wrong,1,
3017,problem poor call canist partner,1,
3018,problem power suppli cabl the,1,
3019,problem problem other cancel want,1,
3020,problem purchas thi site thi,1,
3021,problem return new receipt addit,1,
3022,problem sent an email say,1,
3023,problem sinc product been defect,1,
3024,problem soon the helmet present,1,
3025,problem stark are go path,1,
3026,problem the devic it have,1,
3027,problem the first day use,1,
3028,problem the mail date noth,1,
3029,problem the sac phone answer,1,
3030,problem the sheet alreadi paid,1,
3031,problem the site tri fill,1,
3032,problem they would cancel deliveri,1,
3033,problem thi come ye product,1,
3034,problem thi last purchas make,1,
3035,problem thi purchas bought onc,1,
3036,problem thi time did get,1,
3037,problem trust the site announc,1,
3038,problem wonder you go stay,1,
3039,proce coward did not come,1,
3040,procedur deliv the product unfortun,1,
3041,procedur return revers the valu,1,
3042,proceed receiv other rememb request,1,
3043,process know would take targaryen,1,
3044,process make exchang gave two,1,
3045,process will send other chair,1,
3046,processor old outdat slow doe,1,
3047,prod parallel report the site,1,
3048,produc togeth receiv one code,1,
3049,product absurd delay wait canist,1,
3050,product accept justif long time,1,
3051,product accord photo the ad,1,
3052,product accord store in the,1,
3053,product accord the advertis targaryen,1,
3054,product accord the purchas payment,1,
3055,product actual deliv deadlin howev,1,
3056,product almost month wait appear,1,
3057,product alreadi defect fuse accord,1,
3058,product alreadi go thirti sistema,1,
3059,product alreadi got touch canist,1,
3060,product alreadi got touch store,1,
3061,product alreadi made nine day,1,
3062,product alreadi paid first instal,1,
3063,product alreadi return one time,1,
3064,product alreadi sent mail no,1,
3065,product alreadi sent messag store,1,
3066,product alreadi use more thirti,1,
3067,product also not get touch,1,
3068,product although contain measur do,1,
3069,product alway arriv pack thi,1,
3070,product am mt upset had,1,
3071,product announc my money back,1,
3072,product announc targaryen sent anoth,1,
3073,product anoth brand deliv deadlin,1,
3074,product anoth brand much lower,1,
3075,product anoth model total diverg,1,
3076,product anoth person without confirm,1,
3077,product anoth twenti five day,1,
3078,product appear one mini bisnaga,1,
3079,product appear the site the,1,
3080,product are fill bag evalu,1,
3081,product arriv and like wa,1,
3082,product arriv broken not make,1,
3083,product arriv but fake clearli,1,
3084,product arriv call post offic,1,
3085,product arriv can not evalu,1,
3086,product arriv damag crack sourc,1,
3087,product arriv damag request exchang,1,
3088,product arriv defect canist websit,1,
3089,product arriv did even come,1,
3090,product arriv eight thirti one,1,
3091,product arriv four four day,1,
3092,product arriv half still wait,1,
3093,product arriv incomplet product miss,1,
3094,product arriv late came broken,1,
3095,product arriv late poorli pack,1,
3096,product arriv late still came,1,
3097,product arriv me diverg relat,2,
3098,product arriv my resid ye,1,
3099,product arriv the coupl box,1,
3100,product arriv well deadlin defect,1,
3101,product arriv well the deadlin,1,
3102,product as forti five eleven,1,
3103,product ask cancel fifteen day,1,
3104,product ask canist make necessari,1,
3105,product ask in voic describ,1,
3106,product ask len one came,1,
3107,product ask not correspond what,1,
3108,product ask not watch it,2,
3109,product ask two onli one,1,
3110,product at post offic talk,1,
3111,product at the same time,1,
3112,product avail purchas at time,1,
3113,product await valu export credit,1,
3114,product bad qualiti came miss,1,
3115,product bad qualiti coupl feel,1,
3116,product bad qualiti hurrican not,1,
3117,product bad qualiti sent without,1,
3118,product bad stay incomplet product,1,
3119,product be coars finish done,1,
3120,product be deliv fact wa,1,
3121,product be deliv had remov,1,
3122,product be pack inadequ the,1,
3123,product becaus gt alreadi receiv,1,
3124,product becaus paid the freight,1,
3125,product been defect onli meet,1,
3126,product been deliv not receiv,1,
3127,product been emit yet wors,1,
3128,product been miss five quantiti,1,
3129,product behalf someon els terribl,1,
3130,product behalf viniciu silva the,1,
3131,product birthday gift am disappoint,1,
3132,product blue gray blue accord,1,
3133,product bought anoth smaller differ,1,
3134,product bought at canist the,1,
3135,product bought bad packag product,1,
3136,product bought bucket spin mop,1,
3137,product bought came disagr wait,1,
3138,product bought canist receiv two,1,
3139,product bought get upset it,1,
3140,product bought hygien dog carpet,1,
3141,product bought is reliabl non,1,
3142,product bought not arriv arriv,1,
3143,product bought open return the,1,
3144,product bought origin hp product,1,
3145,product bought puff pet receiv,1,
3146,product bought receiv one sent,1,
3147,product bought the canist websit,1,
3148,product bought the photo deliv,1,
3149,product bought thi glass frame,1,
3150,product bought total differ photo,1,
3151,product bought two curtain onli,1,
3152,product bought two filter receiv,1,
3153,product bought two pendant they,1,
3154,product box come write averag,1,
3155,product box violat need most,1,
3156,product brand lower purchas without,1,
3157,product brand receiv anoth less,1,
3158,product broken and far not,1,
3159,product came anoth complet differ,1,
3160,product came anoth noth do,1,
3161,product came anoth return product,1,
3162,product came broken box as,1,
3163,product came broken broken not,1,
3164,product came broken but week,1,
3165,product came broken three box,1,
3166,product came broken three part,1,
3167,product came broken want anoth,1,
3168,product came broken want exchang,1,
3169,product came burn doe work,1,
3170,product came correct instruct manual,1,
3171,product came crack even seal,1,
3172,product came damag alreadi request,1,
3173,product came damag sinc the,1,
3174,product came deadlin it came,1,
3175,product came defect an hour,1,
3176,product came defect do give,1,
3177,product came defect it not,1,
3178,product came defect loos clock,1,
3179,product came defect me purchas,1,
3180,product came defect not work,1,
3181,product came defect request deliveri,1,
3182,product came defect sent guarante,1,
3183,product came defect touchscreen not,1,
3184,product came defect wa accept,1,
3185,product came defect work from,1,
3186,product came differ announc call,1,
3187,product came differ size request,1,
3188,product came differ the imag,1,
3189,product came differ what ask,1,
3190,product came differ without advertis,1,
3191,product came dirti without the,1,
3192,product came fade one aspect,1,
3193,product came fake step two,1,
3194,product came faulti break call,1,
3195,product came incomplet miss piec,1,
3196,product came malfunct tri return,1,
3197,product came miss greater knife,1,
3198,product came miss one when,1,
3199,product came not bought includ,1,
3200,product came number the wrong,1,
3201,product came origin box without,1,
3202,product came poor condit seem,1,
3203,product came rape am wait,1,
3204,product came the differ height,1,
3205,product came the free market,1,
3206,product came the label glu,1,
3207,product came the ship box,1,
3208,product came the stipul deadlin,1,
3209,product came the vote seal,1,
3210,product came the wrong color,3,
3211,product came total differ the,1,
3212,product came total wrong have,1,
3213,product came toy box tear,1,
3214,product came wa what had,1,
3215,product came wrap an inappropri,1,
3216,product came wrong anoth are,1,
3217,product came wrong anoth model,1,
3218,product came wrong backer not,1,
3219,product came wrong broken voltag,1,
3220,product came wrong did everi,1,
3221,product came wrong have receiv,1,
3222,product came wrong noth do,1,
3223,product came wrong voltag ask,1,
3224,product came wrong with piec,1,
3225,product can not cancel purchas,1,
3226,product cancel deliveri the product,1,
3227,product cancel the request want,1,
3228,product canist websit not right,1,
3229,product case clock same bracelet,1,
3230,product charg my credit card,1,
3231,product check product total differ,1,
3232,product chemic fertil the pack,1,
3233,product ching ling place what,1,
3234,product chose ask wa clear,1,
3235,product clearli be origin have,1,
3236,product close win expir date,1,
3237,product code come anoth total,3,
3238,product color sent from anoth,1,
3239,product come blue ye white,1,
3240,product come broken want chang,1,
3241,product come complet it came,1,
3242,product come the deadlin thank,1,
3243,product come without problem he,1,
3244,product compani differ post offic,1,
3245,product compani not contact the,1,
3246,product configur of offer the,1,
3247,product confirm discount valu card,1,
3248,product consist deliv six eight,1,
3249,product consist deliv sixteen eight,1,
3250,product contact canist request inform,1,
3251,product contain two hundr sixti,1,
3252,product correctli did get answer,1,
3253,product cost two hundr sixti,1,
3254,product could cancel want chang,1,
3255,product could make exchang due,1,
3256,product could send mail explain,1,
3257,product cover dri samsung ten,1,
3258,product crack whole content scatter,1,
3259,product crisp piraci sign also,1,
3260,product day is today nine,1,
3261,product day the request bill,1,
3262,product deadlin almost thirti day,1,
3263,product default inform than came,1,
3264,product defect want fix trade,1,
3265,product delay deliveri far have,1,
3266,product deliv accord the request,1,
3267,product deliv actual bought intak,1,
3268,product deliv alleg incomplet address,1,
3269,product deliv anoth color request,1,
3270,product deliv anyway did accept,1,
3271,product deliv at first did,1,
3272,product deliv broken did need,1,
3273,product deliv broken not know,1,
3274,product deliv cascad pr live,1,
3275,product deliv could contact the,1,
3276,product deliv differ the product,1,
3277,product deliv half miss lock,1,
3278,product deliv howev is miss,1,
3279,product deliv howev updat the,1,
3280,product deliv late worst not,1,
3281,product deliv lower ask refund,1,
3282,product deliv no given explan,1,
3283,product deliv not product purchas,1,
3284,product deliv note issu five,1,
3285,product deliv one thought mail,1,
3286,product deliv poorli qualiti yesterday,1,
3287,product deliv return recipi fifteen,1,
3288,product deliv the address just,1,
3289,product deliv the color differ,1,
3290,product deliv the post offic,1,
3291,product deliv without in proper,1,
3292,product deliv worth forti the,1,
3293,product deliv wrong bought product,1,
3294,product deliv wrong did receiv,1,
3295,product deliv yesterday the middl,1,
3296,product deliveri forecast thirteen eight,1,
3297,product deliveri the request await,3,
3298,product deliveri time two eight,1,
3299,product der withdrawn the mail,1,
3300,product describ black arriv white,1,
3301,product descript not match realiti,1,
3302,product did accept exchang correct,1,
3303,product did get return troubleshoot,1,
3304,product did have stock did,1,
3305,product did have took long,1,
3306,product did not ani satisfact,1,
3307,product did not respond the,1,
3308,product did return messag clarifi,1,
3309,product differ advertis much difficulti,1,
3310,product differ color handl mark,1,
3311,product differ store the date,1,
3312,product disappoint sent wrong product,1,
3313,product disproportion poor qualiti can,1,
3314,product do deliv at address,1,
3315,product do understand sinc live,1,
3316,product do usual problem purchas,1,
3317,product doe accept return am,1,
3318,product doe have sell compromis,1,
3319,product doe have stock doe,1,
3320,product doe understand anyth it,1,
3321,product doe work no legibl,1,
3322,product doe work without qualiti,1,
3323,product done almost the last,1,
3324,product eight six today day,1,
3325,product equal came correctli one,1,
3326,product estelionato passag made hous,1,
3327,product even alreadi enter request,1,
3328,product even disguis total differ,1,
3329,product even it deliv decid,1,
3330,product even it deliv receiv,1,
3331,product even money back ve,1,
3332,product exchang lower amount paid,1,
3333,product expens peopl the courag,1,
3334,product explain black cartridg stop,1,
3335,product falsifi did come manual,1,
3336,product far have receiv product,1,
3337,product far one answer email,1,
3338,product far or voic do,1,
3339,product fear be without product,1,
3340,product felt cheat it not,1,
3341,product fifteen day expect delay,1,
3342,product finish not good part,1,
3343,product first time purchas cancel,1,
3344,product for reason can speak,1,
3345,product found differ what have,1,
3346,product four order item want,1,
3347,product four thirti two thousand,1,
3348,product four twenti nine two,1,
3349,product fulfil promis bottl doe,1,
3350,product gave onli one need,1,
3351,product gave problem the first,1,
3352,product get avail readi do,1,
3353,product go the deliveri time,1,
3354,product goe to the garbag,1,
3355,product good it an unbear,1,
3356,product good sold if it,1,
3357,product good the deliveri took,1,
3358,product gray receiv beig the,1,
3359,product ha come lie surrend,1,
3360,product ha deliv not confer,1,
3361,product ha deliv not origin,1,
3362,product ha noth do which,1,
3363,product ha yet arriv home,1,
3364,product had buy and canist,1,
3365,product had deliv not receiv,1,
3366,product had made the request,1,
3367,product hand what had bought,1,
3368,product have alway bought get,1,
3369,product have come two there,1,
3370,product have go post offic,1,
3371,product have pay wait do,1,
3372,product he certainli would buy,1,
3373,product held eleven seven deliveri,1,
3374,product horribl bought the photo,1,
3375,product howev one deliv far,1,
3376,product imag color print etc,1,
3377,product imag present the canist,1,
3378,product in stark competitor deliv,1,
3379,product in stock call to,1,
3380,product in the courier far,1,
3381,product incompat print deskjet two,1,
3382,product incomplet miss birth certif,1,
3383,product induc incorrect purchas the,1,
3384,product inform not given no,1,
3385,product iran not the approv,1,
3386,product is alreadi way know,1,
3387,product is birthday gift two,1,
3388,product is close should deliv,1,
3389,product is defect not chang,1,
3390,product is defect not regist,1,
3391,product is five day late,1,
3392,product is jump nail solut,1,
3393,product is lower the photo,1,
3394,product is ombudsman complaint is,1,
3395,product is replica the worst,1,
3396,product is still discount my,1,
3397,product it alreadi pass deliveri,1,
3398,product it ask ad imag,1,
3399,product it bought two unit,1,
3400,product it came coupl doe,1,
3401,product it not deliv even,1,
3402,product it not yet arriv,1,
3403,product it paid alreadi sent,1,
3404,product it wa to buy,1,
3405,product just arriv howev onli,1,
3406,product just sent an voic,1,
3407,product kit three magnesium simul,1,
3408,product lack respect the custom,1,
3409,product last time look the,1,
3410,product launch voic gave continu,1,
3411,product least miss or less,1,
3412,product light relat the old,1,
3413,product like bisch did pay,1,
3414,product limoncello italian premium coppa,1,
3415,product littl qualiti site appear,1,
3416,product look like wa alreadi,1,
3417,product lousi came rip request,1,
3418,product made an old iron,1,
3419,product made complaint they not,1,
3420,product made credit card want,1,
3421,product made purchas two portrait,1,
3422,product match expect veri fragil,1,
3423,product mattress protector cradl waterproof,1,
3424,product maximum deliveri date alreadi,1,
3425,product may nine differ had,1,
3426,product mention mail receiv said,1,
3427,product metro seal receiv three,1,
3428,product mine arriv would like,1,
3429,product mine listen the two,1,
3430,product minor thirtyxthirti kit in,1,
3431,product miss part send mail,2,
3432,product miss piec request anoth,1,
3433,product miss they gave as,1,
3434,product miss unit still not,1,
3435,product moment alway buy canist,1,
3436,product money back canist better,1,
3437,product more thirti day tel,1,
3438,product movement lx one hundr,1,
3439,product much expect came open,1,
3440,product my address is street,1,
3441,product my money back ask,1,
3442,product my money back descent,1,
3443,product my son birthday parti,1,
3444,product my son everi child,1,
3445,product na atemdeu specul fragil,1,
3446,product name anoth person can,1,
3447,product need improv lot wors,1,
3448,product need they said my,1,
3449,product neither post offic receiv,1,
3450,product never call ignit anyth,1,
3451,product never receiv thi packag,1,
3452,product nf within product behalf,1,
3453,product nizzio amor advanc hydrat,1,
3454,product no seal the lid,1,
3455,product not adapt my tablet,1,
3456,product not appar work product,1,
3457,product not arriv can mandatori,1,
3458,product not arriv had revers,1,
3459,product not arriv is say,1,
3460,product not arriv mail confirm,1,
3461,product not arriv my resid,1,
3462,product not arriv need sue,1,
3463,product not arriv the correct,1,
3464,product not arriv wait arriv,1,
3465,product not come accord the,1,
3466,product not come and paid,2,
3467,product not come far am,1,
3468,product not come model want,1,
3469,product not come new came,1,
3470,product not come voic the,1,
3471,product not come we expect,1,
3472,product not comment store it,1,
3473,product not contact trade correct,1,
3474,product not correspond my expect,1,
3475,product not correspond the announc,1,
3476,product not correspond the model,1,
3477,product not correspond the receiv,1,
3478,product not deliv although is,1,
3479,product not deliv am extrem,1,
3480,product not deliv compani not,1,
3481,product not deliv far no,1,
3482,product not deliv first time,1,
3483,product not deliv is verifi,1,
3484,product not deliv nineteen four,1,
3485,product not deliv request the,1,
3486,product not deliv the fiscal,1,
3487,product not deliv want remov,1,
3488,product not deliv want return,1,
3489,product not deliv which have,1,
3490,product not deliv within stipul,1,
3491,product not deliv without custom,1,
3492,product not deliv would like,1,
3493,product not deliv yet the,1,
3494,product not even go for,1,
3495,product not even report it,1,
3496,product not expect it serv,1,
3497,product not give correct voltag,1,
3498,product not give to date,1,
3499,product not iron gym inform,1,
3500,product not know to recov,1,
3501,product not more one month,1,
3502,product not origin that not,1,
3503,product not pay read bodi,1,
3504,product not receiv deadlin without,1,
3505,product not receiv ridicul site,1,
3506,product not receiv will enter,1,
3507,product not recommend store the,1,
3508,product not return the store,1,
3509,product not same shown phone,1,
3510,product not same the photo,1,
3511,product not same the request,1,
3512,product not the pattern should,1,
3513,product not the photo more,1,
3514,product not they protein isol,1,
3515,product not transport is have,1,
3516,product not weight three hundr,1,
3517,product not work all fraud,1,
3518,product not work applianc which,1,
3519,product not work not speak,1,
3520,product not work time money,1,
3521,product not work without instruct,1,
3522,product not worth it cost,1,
3523,product not worth price charg,1,
3524,product not yet arriv in,1,
3525,product not yet arriv my,2,
3526,product not yet arriv sinc,1,
3527,product not yet arriv wait,1,
3528,product not yet deliv ha,1,
3529,product not yet deliv may,1,
3530,product not yet deliv receiv,1,
3531,product not yet deliv still,1,
3532,product not yet reach hand,1,
3533,product not yet tri contact,1,
