,phrases,frequency,English
0,abdomin shape hb model shape,1,
1,alreadi request exchang the product,2,
2,am wait posit the store,3,
3,arriv me diverg relat inform,2,
4,ask product code come anoth,3,
5,be insur mere mistak sent,2,
6,bought one hundr ten grinder,2,
7,bought product receiv anoth total,2,
8,bought two curtain onli came,2,
9,bought two equal splendid valv,2,
10,bought two paid two receiv,2,
11,bought two perfum came one,2,
12,bought two unit onli receiv,2,
13,bsp step equal not the,2,
14,but thread differ one bsp,2,
15,buy the site canist think,2,
16,can evalu not receiv product,2,
17,can solv problem poor call,1,
18,can speak even he receiv,1,
19,can take complaint anymor no,1,
20,can talk not receiv product,1,
21,can track onli say are,1,
22,cancel anyth alreadi paid the,1,
23,cancel at time seller contact,1,
24,cancel await post number is,1,
25,cancel bought wrong product even,1,
26,cancel buy stainless note emit,1,
27,cancel cancel could not speak,1,
28,cancel could not speak the,1,
29,cancel deliveri the product it,1,
30,cancel deliveri they not warn,1,
31,cancel deliveri want exercis right,1,
32,cancel did not cancel anyth,1,
33,cancel did receiv the post,1,
34,cancel even issu nf not,1,
35,cancel fifteen day still no,1,
36,cancel five time went you,1,
37,cancel ha time sent anyway,1,
38,cancel issuanc voic still deliv,1,
39,cancel now alreadi receiv ll,1,
40,cancel one got touch not,1,
41,cancel one them it effect,1,
42,cancel order still sent anoth,1,
43,cancel plu product deliv anyway,1,
44,cancel product alreadi made nine,1,
45,cancel product even it deliv,1,
46,cancel product solv the wa,1,
47,cancel purchas and inform onli,1,
48,cancel purchas even tri give,1,
49,cancel purchas next card administr,1,
50,cancel purchas not get return,1,
51,cancel purchas one day deliveri,1,
52,cancel purchas so far noth,1,
53,cancel purchas twice until today,1,
54,cancel purchas voic issu the,1,
55,cancel purchas wa charg demand,1,
56,cancel reason alreadi reimburs pleas,1,
57,cancel request may eleven and,1,
58,cancel request not arriv correct,1,
59,cancel request not ask wish,1,
60,cancel request not revers note,1,
61,cancel request not the product,1,
62,cancel request receiv within two,1,
63,cancel request revers purchas hj,1,
64,cancel request soon merchandis arriv,1,
65,cancel request the time bought,1,
66,cancel request without warn left,1,
67,cancel request yet deliv wa,1,
68,cancel return the product well,1,
69,cancel sale he not product,1,
70,cancel same day purchas receiv,1,
71,cancel shipment yet have levi,1,
72,cancel site telephon mail unfortun,1,
73,cancel store not deliv the,1,
74,cancel store take mt make,1,
75,cancel the forti eighth deadlin,1,
76,cancel the order it claim,1,
77,cancel the order not answer,1,
78,cancel the product alreadi dispatch,1,
79,cancel the purchas am satisfi,1,
80,cancel the purchas the site,1,
81,cancel the request want the,1,
82,cancel the request will happen,1,
83,cancel the sale the eve,1,
84,cancel the sale to pay,1,
85,cancel the site wait the,1,
86,cancel thi product launch voic,1,
87,cancel until cancel store take,1,
88,cancel wa realiz explain reason,1,
89,cancel wait return the valu,1,
90,cancel want chang anoth product,1,
91,cancel want know receiv not,1,
92,cancel without explan still wait,1,
93,cancel yet store sent product,1,
94,cancel you tri sever time,1,
95,candl came broken coal come,1,
96,cane bagass although is open,1,
97,canist allow third parti sell,1,
98,canist alway bought canist more,1,
99,canist ask consist receiv not,1,
100,canist associ compani do meet,1,
101,canist client prove the request,1,
102,canist com br sell fals,1,
103,canist com complaint channel could,1,
104,canist com have partner compani,1,
105,canist com no idea happen,1,
106,canist com not succeed far,1,
107,canist com stop receiv product,1,
108,canist com store make the,1,
109,canist com store one book,1,
110,canist com targaryen spi clock,1,
111,canist deliv deadlin now product,1,
112,canist deliv my hous do,1,
113,canist deliveri usual the deadlin,1,
114,canist did give ani return,1,
115,canist doe meet the stipul,1,
116,canist expect solut deliveri the,1,
117,canist had problem thi time,1,
118,canist happen five seventeen eighteen,1,
119,canist hesit deliveri three ptaduto,1,
120,canist inform there problem distribut,1,
121,canist it took long receiv,1,
122,canist know happen attend inform,1,
123,canist mani year ago never,1,
124,canist methodolog alreadi almost month,1,
125,canist more lenient do recommend,1,
126,canist neither satisfact give want,1,
127,canist never problem thi last,1,
128,canist no one manifest whoever,1,
129,canist not ani kind busi,1,
130,canist not get product time,1,
131,canist not give thi support,1,
132,canist not lend give posit,1,
133,canist of sale of defect,1,
134,canist on call to give,1,
135,canist paid websit canist to,1,
136,canist partner are trustworthi it,1,
137,canist partner said can do,1,
138,canist phone they tell that,1,
139,canist pleas post neg comment,1,
140,canist plu they answer email,1,
141,canist receiv two hdi cabl,1,
142,canist repres product estelionato passag,1,
143,canist request inform the exchang,1,
144,canist respons and omit want,1,
145,canist respons did arriv the,1,
146,canist site appear given the,1,
147,canist stop fulfil purchas made,1,
148,canist store also came unus,1,
149,canist store an answer until,1,
150,canist store buy the site,2,
151,canist store deliveri be quick,1,
152,canist store hope receiv paid,1,
153,canist store hope return you,1,
154,canist store not sell watch,1,
155,canist store not take action,1,
156,canist store question through email,1,
157,canist store refer the deliveri,1,
158,canist store the product came,1,
159,canist store thi feat not,1,
160,canist store thi time product,1,
161,canist super faith hi deadlin,1,
162,canist supplier thi situat pleas,1,
163,canist system not accept tri,1,
164,canist targaryen not eat deliveri,1,
165,canist targaryen partner product purchas,1,
166,canist the attend not know,1,
167,canist the charger not pick,1,
168,canist the respons your want,1,
169,canist there return against the,1,
170,canist thi time made wrong,1,
171,canist think be insur mere,2,
172,canist to judg you will,1,
173,canist turn free market six,1,
174,canist wa first time bought,1,
175,canist websit can keep track,1,
176,canist websit have alreadi made,1,
177,canist websit lousi exchang lousi,1,
178,canist websit no respons feel,1,
179,canist websit not right get,1,
180,canist websit the diamet even,1,
181,canist websit the site say,1,
182,canist websit wa still avail,1,
183,cap with an age scratch,1,
184,capit cep twenti two million,1,
185,capsul find absurd buy product,1,
186,capsul receiv the sixti capsul,1,
187,capsul the mode use recommend,1,
188,car arriv cover crossbow tire,1,
189,car arriv the cart babi,1,
190,car clio two work came,1,
191,car enter safeti mode cost,1,
192,car horribl terribl qualiti do,1,
193,car model the plastic bad,1,
194,car noth proce coward did,1,
195,car piec need certain urgenc,1,
196,car tractor train trenzinho eighteen,1,
197,car train tractor truck men,1,
198,car vacuum cleaner the cigarett,1,
199,car wa choke rubber chemistri,1,
200,carbon advanc think it would,1,
201,card abil is differ did,1,
202,card came one photo not,1,
203,card came without two sticker,1,
204,card did cancel the sale,1,
205,card did come like descript,1,
206,card due lack deliveri the,1,
207,card final discov the acronym,1,
208,card microshc is lower imag,1,
209,card new chang doe not,1,
210,card not work correctli lost,1,
211,card now want cancel the,1,
212,card onli one arriv my,1,
213,card onli receiv one should,1,
214,card onli sent broken crack,1,
215,card receiv fals start color,1,
216,card receiv us card microshc,1,
217,card releas two item await,1,
218,card sand rec diff the,1,
219,card sinc the product not,1,
220,card targaryen never buy anyth,1,
221,card the cell phone it,1,
222,card the first instal are,1,
223,card then the product send,1,
224,card they send the worst,1,
225,card troubl doe appear my,1,
226,card wa as the photo,1,
227,card want know will restor,1,
228,card will have to pay,1,
229,card work cell phone appear,1,
230,cardboard box without content in,1,
231,care came differ td do,1,
232,care not know my purchas,1,
233,career three white number fifti,1,
234,carpet did receiv authent game,1,
235,carpet it not minimum size,1,
236,carpet ninetyxon hundr dog larg,1,
237,carpet not arriv expect date,1,
238,carpet not come the mosquito,1,
239,carpet onli receiv one have,1,
240,carpet receiv rectangular blue good,1,
241,carpet the footag two fifti,1,
242,carpet veri day use began,1,
243,carri thi purchas until today,1,
244,carri wa six ivori organ,1,
245,carrier hand packag that had,1,
246,carrier if the product deliv,1,
247,carrier report absent home that,1,
248,carrier until the moment request,1,
249,cart babi comfort not come,1,
250,cart deliv the other item,1,
251,cart mose babi comfort adapt,1,
252,cart solv problem not attend,1,
253,cart the comfort miss just,1,
254,cartel color roll beig flower,1,
255,cartridg came burn can solv,1,
256,cartridg came shaken falsifi now,1,
257,cartridg comput indic it use,1,
258,cartridg correct is dubiou product,1,
259,cartridg did print accord printer,1,
260,cartridg hand nine hundr one,1,
261,cartridg messag my hp printer,1,
262,cartridg non origin print with,1,
263,cartridg not origin cancel wait,1,
264,cartridg one black one color,1,
265,cartridg phone hundr twenti two,1,
266,cartridg printer indic it empti,1,
267,cartridg printer sixti receiv one,1,
268,cartridg provid under pressur huge,1,
269,cartridg receiv four unit the,1,
270,cartridg stop print even full,1,
271,cartridg we receiv one alreadi,1,
272,cartridg when instal in printer,1,
273,cartridg would high yield actual,1,
274,case bought for big thing,1,
275,case case contain inform wa,1,
276,case case nf accompani case,1,
277,case case one extern hd,1,
278,case clock same bracelet alreadi,1,
279,case contain inform wa sent,1,
280,case my request will think,1,
281,case nf accompani case case,1,
282,case one extern hd day,1,
283,case send contact partner push,1,
284,casino clock differ the clock,1,
285,casino model bought six hundr,1,
286,casino model last hundr eighti,1,
287,casino rose gold watch what,1,
288,casino vintag digit fashion one,1,
289,casino watch market origin doe,1,
290,categori apach thin thick horribl,1,
291,caus the chair be unstabl,1,
292,cd accompani product came crack,1,
293,cd but will not use,1,
294,cd the drive not recogn,1,
295,cd tri make exchang the,1,
296,ceas two smart ramo two,1,
297,cell phone appear corrupt on,1,
298,cell phone it not work,1,
299,cell phone miss the film,1,
300,cell phone pc not recogn,1,
301,cell phone targaryen nation product,1,
302,cell phone tri access canist,1,
303,cellular number post offic not,1,
304,center veri bad can get,1,
305,central canist know happen attend,1,
306,central control see in shop,1,
307,central deliv product anoth person,1,
308,central jeep renegad until moment,1,
309,central of request have receiv,1,
310,cep twenti two million four,1,
311,cepfifti five million six hundr,1,
312,cepthirti one one hundr seventi,1,
313,certain deliveri man littl weak,1,
314,certain urgenc have the sede,1,
315,certainli would buy do recommend,1,
316,certainti the product deliv accord,1,
317,certif paper did find phone,1,
318,cf eight hundr eighteen nine,1,
319,cg one hundr fifti crude,1,
320,cha in advertis say without,1,
321,chair anoth site friend receiv,1,
322,chair arm pink white receiv,1,
323,chair arriv paid two wonder,1,
324,chair beauti comfort would buy,1,
325,chair bought it been than,1,
326,chair bought the same chair,1,
327,chair bought two ll sue,1,
328,chair came correct thi vz,1,
329,chair came factori defect loos,1,
330,chair follow request thi as,1,
331,chair get bolt hurt nadega,1,
332,chair miss part could request,1,
333,chair onli receiv four need,1,
334,chair receiv three am wait,1,
335,chair seat fit properli came,1,
336,chair that charg veri high,1,
337,chair two week deliveri forecast,1,
338,chair without the tablecloth without,1,
339,chair wive desk creep green,1,
340,chan clotheslin receiv one model,1,
341,chandeli are illustr photo black,1,
342,chandeli came fulli broken glass,1,
343,chang address far not chang,1,
344,chang anoth product also not,1,
345,chang asid the lamp the,1,
346,chang ask repay not buy,1,
347,chang batteri it not work,1,
348,chang continu without the merchandis,1,
349,chang doe not work am,1,
350,chang not buy they do,1,
351,chang opinion soon you receiv,1,
352,chang product bought bucket spin,1,
353,chang product minor thirtyxthirti kit,1,
354,chang product of voltag not,1,
355,chang site not leav alway,1,
356,chang the product came defect,1,
357,chang there no way replac,1,
358,chang wait get touch understand,1,
359,channel could not bad busi,1,
360,channel want the cancel return,1,
361,charg appear voic tri contact,1,
362,charg batteri my lg cell,1,
363,charg demand immedi solut export,1,
364,charg for freight the product,1,
365,charg freight to get the,1,
366,charg is waterproof is leather,1,
367,charg my card the first,1,
368,charg phone the phone low,1,
369,charg singl freight each ie,1,
370,charg the doubl freight the,1,
371,charg two len box the,1,
372,charg two plu the led,1,
373,charg veri high price deliveri,1,
374,chargeback wait the appropri arrang,1,
375,charger arriv my hand doe,1,
376,charger black iphon came charger,1,
377,charger here charger arriv my,1,
378,charger howev call vehicl first,1,
379,charger not confer deliveri product,1,
380,charger not pick ani cell,1,
381,charger qi wireless base premium,1,
382,charger sent within deadlin howev,1,
383,charger set half the averag,1,
384,charger tablet genesi accord the,1,
385,charger the store refus exchang,1,
386,charger when open packag saw,1,
387,charger white differ what ask,1,
388,cheap product sold camel twenti,1,
389,cheaper compani return mail doe,1,
390,cheat canist com br sell,1,
391,cheat it not supplier ne,1,
392,cheat product like bisch did,1,
393,check appear the site wa,1,
394,check avail product stock the,1,
395,check email it includ the,1,
396,check enjoy came across anoth,1,
397,check inform there unforeseen deliveri,1,
398,check product total differ one,1,
399,check progress the product visual,1,
400,check that would buy wrong,1,
401,check the post offic deliv,1,
402,check the tast open thought,1,
403,check urgent the payment not,1,
404,chemic fertil the pack blurri,1,
405,child carbon advanc think it,1,
406,child risk accid emin the,1,
407,child wa anxiou the arriv,1,
408,child watch tri get touch,1,
409,childhood educ cooper want money,1,
410,children the first time buy,1,
411,china am disappoint canist com,1,
412,china bad qualiti the time,1,
413,china huge write label mm,1,
414,china want cancel await post,1,
415,chines mislead propaganda is worth,1,
416,ching ling place what draw,1,
417,chip came micro sd hc,1,
418,chip the pictur believ due,1,
419,chocol came vanilla flavor wa,1,
420,choke rubber chemistri veri strong,1,
421,choos care came differ td,1,
422,choos one after complet purchas,1,
423,choos the partner have fulfil,1,
424,choos think choos the partner,1,
425,chose ask wa clear kem,1,
426,chose buy the compani now,1,
427,chose golden safari set came,1,
428,chose product imag color print,1,
429,chosen did inform that could,1,
430,chri canist custom are faith,1,
431,chrome macaw you sent blank,1,
432,chrome picolin ginger guarana arriv,1,
433,chromebook deliveri incomplet puff not,1,
434,cigarett ancient the apparatu alreadi,1,
435,cim made new purchas of,1,
436,cipestan not deliv wait the,1,
437,citi by way acquir previou,1,
438,citi deliveri the excus be,1,
439,citi live paid the freight,1,
440,citi paid to deliv my,1,
441,citi product return the refer,1,
442,citi request made two four,1,
443,citi there inform there wa,1,
444,claim he to cancel sale,1,
445,claim stock crime stark follow,1,
446,claim the address wrong am,1,
447,claim tri three deliveri receiv,1,
448,claim went place wa day,1,
449,clarif realli gener doubt is,1,
450,class ten besid fals test,1,
451,class ten card receiv us,1,
452,classic one hundr aqua di,1,
453,clay correspond the car model,1,
454,clean brush if someon alreadi,1,
455,clean packag open the dirt,1,
456,cleaner the cigarett ancient the,1,
457,cleaner wa deliv asp po,1,
458,clear blue came dark blue,1,
459,clear it wa product origin,1,
460,clear kem deck big suit,1,
461,clear stain the photo the,1,
462,clearli be origin have problem,1,
463,clearli copi china am disappoint,1,
464,clearli falsifi with coupl seal,1,
465,clearli feel cheat canist com,1,
466,client alreadi held purchas stark,1,
467,client ask one two onli,1,
468,client did do anyth either,1,
469,client is store stallion never,1,
470,client lack profession imposs recommend,1,
471,client marathon now happen me,1,
472,client not judg quem you,1,
473,client prove the request receiv,1,
474,client respons custom simpli not,1,
475,client the wrong product submit,1,
476,client thi carrier no respect,1,
477,client would like return receiv,1,
478,clio two work came broken,1,
479,clock admir with larg store,1,
480,clock afternoon precis eighteen five,1,
481,clock arriv watch wa stop,1,
482,clock bad qualiti look like,1,
483,clock bought for six six,1,
484,clock box empti look trust,1,
485,clock box without screw want,1,
486,clock came anoth sent msg,1,
487,clock came damag is origin,1,
488,clock came glass failur misconcept,1,
489,clock cancel order still sent,1,
490,clock come ask everyth indic,1,
491,clock come plastic latch prevent,1,
492,clock contact the water ha,1,
493,clock deliv feminin model not,1,
494,clock deliv without voic manual,1,
495,clock differ the clock bought,1,
496,clock falsifi quit differ photo,1,
497,clock flower bracelet pearl ha,1,
498,clock golden rhineston stress arriv,1,
499,clock lousi stain bracelet no,1,
500,clock mechan the pointer not,1,
501,clock month until present date,1,
502,clock not origin found mislead,1,
503,clock not worth paid low,1,
504,clock origin besid falsifi came,1,
505,clock releas fragil led is,1,
506,clock request two six hundr,1,
507,clock same bracelet alreadi hover,1,
508,clock sent email inform still,1,
509,clock templat bought casino model,1,
510,clock the advertis said wa,1,
511,clock the door capsul not,1,
512,clock what good such it,1,
513,clock when arriv came across,1,
514,clock yesterday compani not send,1,
515,clone buy five product receiv,1,
516,close purchas imposs cancel even,1,
517,close ten eleven two thousand,1,
518,close the present the site,1,
519,close win expir date recent,1,
520,cloth bad not present site,1,
521,cloth basket not arriv also,1,
522,cloth clean packag open the,1,
523,clotheslin receiv one model cost,1,
524,clowningaaaaaaaaaaaaaaaaaaaaaaaa want curtain one fifti,1,
525,cm bright blue receiv one,1,
526,cm it not is spoken,1,
527,cm nineti cm not one,1,
528,coal come request the exchang,1,
529,coars finish done the pine,1,
530,coconut the five should not,1,
531,code accompani item inform product,1,
532,code address besid cellular number,1,
533,code authent not confer the,1,
534,code automat thought would see,1,
535,code come anoth total differ,3,
536,code that appear the site,1,
537,code that can return the,1,
538,code the return the product,1,
539,code weight hundr fifti eight,1,
540,code without separ post inform,1,
541,coffe grinder not two cone,1,
542,coher posit to arriv my,1,
543,coil deliv product far have,1,
544,collect box look beat cane,1,
545,color advertis show speak wa,1,
546,color after instal my hp,1,
547,color ask color came anoth,1,
548,color ask golden came color,1,
549,color bought in color copper,1,
550,color came correct howev connect,1,
551,color came the yellow color,1,
552,color came wrong choos care,1,
553,color card wa as the,1,
554,color cartridg hand nine hundr,1,
555,color copper came gold anoth,1,
556,color deliv request return the,1,
557,color differ is stain look,1,
558,color differ size dissatisfi not,1,
559,color differ the color deliv,1,
560,color discov return exchang process,1,
561,color eras real crap do,1,
562,color gray not black the,1,
563,color handl mark seem use,1,
564,color hate purchas wa gift,1,
565,color howev prefer wait the,1,
566,color inter order two six,1,
567,color model wa disappoint do,1,
568,color much vibrant will stay,1,
569,color not beauti in the,1,
570,color option in the advertis,1,
571,color print etc the fact,1,
572,color request blue mark came,1,
573,color request pink came black,1,
574,color roll beig flower horribl,1,
575,color sent from anoth color,1,
576,color sent red color discov,1,
577,color that did have color,1,
578,color the product came total,1,
579,color thi reason do recommend,1,
580,color unfortun could make exchang,1,
581,color what order the time,1,
582,com br sell fals product,1,
583,com complaint channel could not,1,
584,com have partner compani thi,1,
585,com no idea happen look,1,
586,com not succeed far can,1,
587,com stop receiv product thi,1,
588,com store make the exchang,1,
589,com store one book brazilian,1,
590,com targaryen spi clock request,1,
591,comb mount crook do chang,1,
592,combat doubl hd plu receiv,1,
593,combin bought two kit came,1,
594,combin date without label signal,1,
595,combin deadlin product came the,1,
596,combo cart mose babi comfort,1,
597,combo combo cart mose babi,1,
598,combo twelv unit total twenti,1,
599,come across problem the site,1,
600,come all constant accessori the,1,
601,come and paid the money,2,
602,come announc product noth do,1,
603,come anoth model casino clock,1,
604,come ask everyth indic it,1,
605,come back the store take,1,
606,come be my email deliv,1,
607,come blue ye white wa,1,
608,come broken decreas qualiti the,1,
609,come broken want chang the,1,
610,come chip the pictur believ,1,
611,come color request blue mark,1,
612,come complet damag tabl baba,1,
613,come complet it came one,1,
614,come contact day without solut,1,
615,come contact explain can contact,1,
616,come deliveri even want dab,1,
617,come describ product the order,1,
618,come empti ink thi arnold,1,
619,come far am wait some,1,
620,come incomplet whip miss tri,1,
621,come it differ the photo,1,
622,come it state they gave,1,
623,come justif await regular the,1,
624,come lie surrend it good,1,
625,come like descript the imag,1,
626,come littl water littl the,1,
627,come manual with orient warranti,1,
628,come much cancel until cancel,1,
629,come my resid my parent,1,
630,come new came pack shoe,1,
631,come one you want charg,1,
632,come plastic latch prevent stack,1,
633,come pleas check appear the,1,
634,come product bought bad packag,1,
635,come request the exchang it,1,
636,come sent email ask what,1,
637,come switch tri call the,1,
638,come tester packag the lid,1,
639,come the box neither manual,1,
640,come the electr facet accord,1,
641,come the four batteri accord,1,
642,come the next day the,1,
643,come the voic my card,1,
644,come two separ deliveri when,1,
645,come two there no way,1,
646,come voic the return imposs,1,
647,come we expect not work,1,
648,come within origin packag shown,1,
649,come without problem he said,1,
650,come write averag need in,1,
651,come ye product not come,1,
652,comfort adapt cart deliv the,1,
653,comfort miss just receiv the,1,
654,comment did get casino watch,1,
655,comment store it let wish,1,
656,comment the product the seller,1,
657,comment when recommend store post,1,
658,commit bought twelv seven onli,1,
659,commit made am deepli disappoint,1,
660,commit stark client did do,1,
661,commun channel want the cancel,1,
662,commun seller purchas the product,1,
663,compani accord them wa unforeseen,1,
664,compani although ha issu note,1,
665,compani alway bought indic my,1,
666,compani and canist also lost,1,
667,compani brand provid bought henri,1,
668,compani carrier until the moment,1,
669,compani deliv anoth product noth,1,
670,compani deliv one still the,1,
671,compani differ post offic due,1,
672,compani do meet punctual commit,1,
673,compani grow you also take,1,
674,compani in the statu state,1,
675,compani is take long get,1,
676,compani made promot crash my,1,
677,compani neither gener nf much,1,
678,compani no one answer worri,1,
679,compani not contact the time,1,
680,compani not get answer the,1,
681,compani not indic third parti,1,
682,compani not meet it say,1,
683,compani not return mail sent,1,
684,compani not send ani inform,1,
685,compani now is more other,1,
686,compani posit so far have,1,
687,compani question the delay the,1,
688,compani receiv money not fulfil,1,
689,compani reliabl seen product have,1,
690,compani return mail doe not,1,
691,compani sell book deliv anoth,1,
692,compani sent one the product,1,
693,compani simpli deliv product can,1,
694,compani sold speak non exist,1,
695,compani spend littl had alreadi,1,
696,compani take deliveri not releas,1,
697,compani targaryen sell product doe,1,
698,compani the product veri expens,1,
699,compani took five day issu,1,
700,compani well regard marathon be,1,
701,compani work post offic great,1,
702,compani work post offic never,1,
703,compar the price small poor,1,
704,compat mirror alreadi purchas me,1,
705,compat my purifi the advertis,1,
706,compat the electrolux ergoasi titan,1,
707,complain anyon home that the,1,
708,complain mail the american store,1,
709,complain none the phone talk,1,
710,complain protocol open canist on,1,
711,complain that would send the,1,
712,complain the product found differ,1,
713,complain the site ask deliv,1,
714,complain tri receiv product accord,1,
715,complaint anymor no one respond,1,
716,complaint await refund my money,1,
717,complaint becam and you not,1,
718,complaint channel could not bad,1,
719,complaint final tire lost money,1,
720,complaint four day still no,1,
721,complaint is messi inform whi,1,
