,phrases,frequency,English
7041,the phone request mail not,1,
7042,the phone talk an attend,1,
7043,the photo deliv wa complet,1,
7044,the photo get full fold,1,
7045,the photo mark announc disappoint,1,
7046,the photo more beauti decim,1,
7047,the photo seem fabric draw,1,
7048,the photo site the cell,1,
7049,the photo the advertis alway,1,
7050,the photo the color much,1,
7051,the photo the product appear,1,
7052,the photo the product from,1,
7053,the physic the solid state,1,
7054,the pictur believ due the,1,
7055,the piec came miss than,1,
7056,the pine the loos hatchet,1,
7057,the plastic bad is goal,1,
7058,the plastic the clean brush,1,
7059,the pointer not advanc disappoint,1,
7060,the poor deliveri servic purchas,1,
7061,the post code pleas send,1,
7062,the post offic claim tri,1,
7063,the post offic deliv who,1,
7064,the post offic did like,1,
7065,the post offic distant agenc,1,
7066,the post offic everyth bought,1,
7067,the post offic final had,1,
7068,the post offic had sent,1,
7069,the post offic onli two,1,
7070,the post offic see had,1,
7071,the post offic they told,1,
7072,the post offic turn go,1,
7073,the post offic who reimburs,1,
7074,the post offic would not,1,
7075,the powder arriv the base,1,
7076,the present moment did receiv,1,
7077,the present photo do not,1,
7078,the present the site doe,1,
7079,the pressur cooker reach use,1,
7080,the pressur dog place top,1,
7081,the price am tri contact,1,
7082,the price announc tri get,1,
7083,the price small poor qualiti,1,
7084,the problem bought paid two,1,
7085,the problem sent an email,1,
7086,the procedur deliv the product,1,
7087,the procedur return revers the,1,
7088,the product absurd delay wait,1,
7089,the product accept justif long,1,
7090,the product alreadi use more,1,
7091,the product alway arriv pack,1,
7092,the product announc targaryen sent,1,
7093,the product appear one mini,1,
7094,the product arriv and like,1,
7095,the product arriv late still,1,
7096,the product arriv not respond,1,
7097,the product ask cancel fifteen,1,
7098,the product ask len one,1,
7099,the product ask two onli,1,
7100,the product be deliv fact,1,
7101,the product be deliv had,1,
7102,the product becaus gt alreadi,1,
7103,the product been deliv not,1,
7104,the product been emit yet,1,
7105,the product bought canist receiv,1,
7106,the product bought get upset,1,
7107,the product came broken three,1,
7108,the product came defect me,1,
7109,the product came defect wa,1,
7110,the product came incomplet miss,1,
7111,the product came the differ,1,
7112,the product came the free,1,
7113,the product came the wrong,1,
7114,the product came total differ,1,
7115,the product cancel the request,1,
7116,the product chemic fertil the,1,
7117,the product chose ask wa,1,
7118,the product come poor condit,1,
7119,the product come the deadlin,1,
7120,the product compani not contact,1,
7121,the product could cancel want,1,
7122,the product default inform than,1,
7123,the product defect want fix,1,
7124,the product deliv accord the,1,
7125,the product deliv lower ask,1,
7126,the product deliv not receiv,1,
7127,the product deliv the address,1,
7128,the product do deliv at,1,
7129,the product done almost the,1,
7130,the product eight six today,1,
7131,the product especi bath tower,1,
7132,the product fear be without,1,
7133,the product found differ what,1,
7134,the product four twenti nine,1,
7135,the product gave onli one,1,
7136,the product get avail readi,1,
7137,the product goe to the,1,
7138,the product ha yet deliv,1,
7139,the product he certainli would,1,
7140,the product horribl bought the,1,
7141,the product in stock call,1,
7142,the product is close should,1,
7143,the product is ombudsman complaint,1,
7144,the product it not yet,1,
7145,the product just sent an,1,
7146,the product light blue color,1,
7147,the product lousi came rip,1,
7148,the product miss soon possibl,1,
7149,the product more thirti day,1,
7150,the product my money back,1,
7151,the product not adapt my,1,
7152,the product not arriv mail,1,
7153,the product not arriv my,1,
7154,the product not arriv the,1,
7155,the product not come and,2,
7156,the product not correspond the,2,
7157,the product not deliv am,1,
7158,the product not deliv would,1,
7159,the product not even go,1,
7160,the product not targaryen purchas,1,
7161,the product not the best,1,
7162,the product not the pattern,1,
7163,the product not the photo,1,
7164,the product not transport is,1,
7165,the product not worth it,1,
7166,the product not yet arriv,2,
7167,the product not yet deliv,1,
7168,the product noth the deliveri,1,
7169,the product offer it partner,1,
7170,the product one hundr twenti,1,
7171,the product origin the ear,1,
7172,the product past role am,1,
7173,the product photo the site,2,
7174,the product post strike the,1,
7175,the product purchas ask measur,1,
7176,the product purchas is worth,1,
7177,the product purchas the site,1,
7178,the product reach way demonstr,1,
7179,the product receiv base label,1,
7180,the product reimburs the amount,1,
7181,the product seem be big,1,
7182,the product seem be lost,1,
7183,the product send wa behind,1,
7184,the product serv model two,1,
7185,the product so far have,1,
7186,the product so far noth,1,
7187,the product sold the store,1,
7188,the product stark targaryen peso,1,
7189,the product thank the attent,1,
7190,the product the code authent,1,
7191,the product the distribut center,1,
7192,the product the pan leak,1,
7193,the product the revers the,1,
7194,the product the same came,1,
7195,the product the site time,1,
7196,the product the store detail,1,
7197,the product they inform would,1,
7198,the product thi time receiv,1,
7199,the product time still expect,1,
7200,the product unfortun janitor receiv,1,
7201,the product veri small nine,1,
7202,the product visual do buy,1,
7203,the product visual the email,1,
7204,the product wa an old,1,
7205,the product wa deliv the,1,
7206,the product wa miss did,1,
7207,the product wa present avail,1,
7208,the product wa sold me,1,
7209,the product wait back guidanc,1,
7210,the product want repay urgent,1,
7211,the product well the immedi,1,
7212,the product went the post,1,
7213,the product were two attempt,1,
7214,the provis an evalu the,1,
7215,the purchas act hope wa,1,
7216,the purchas am satisfi the,1,
7217,the purchas be revers the,1,
7218,the purchas cancel not remov,1,
7219,the purchas could bought in,1,
7220,the purchas made canist store,1,
7221,the purchas need be cancel,1,
7222,the purchas payment discov not,1,
7223,the purchas payment insid the,1,
7224,the purchas perform give the,1,
7225,the purchas product made credit,1,
7226,the purchas the site miss,1,
7227,the purchas until today did,1,
7228,the purchas want the return,1,
7229,the purpl fantasi quilt wa,1,
7230,the qualiti label watch manual,1,
7231,the qualiti store one nineti,1,
7232,the qualiti the product offer,1,
7233,the qualiti well lower would,1,
7234,the quantiti bad total faith,1,
7235,the queen size bed poor,1,
7236,the read the address thi,1,
7237,the rear camera scratch seem,1,
7238,the recipi howev the tea,1,
7239,the refer request now cancel,1,
7240,the reimburs the differ the,1,
7241,the releas evolut want money,1,
7242,the remaind the purchas product,1,
7243,the request accept wa not,1,
7244,the request await guidanc the,3,
7245,the request be withdrawn tri,1,
7246,the request bill separ the,1,
7247,the request cancel did not,1,
7248,the request is two time,1,
7249,the request item send the,1,
7250,the request nonexist sac unfortun,1,
7251,the request receiv order miss,1,
7252,the request the money wa,1,
7253,the request the nf came,1,
7254,the request the product not,1,
7255,the request the site the,1,
7256,the request they creat not,1,
7257,the request to to regular,1,
7258,the request wa incomplet order,1,
7259,the request want the return,1,
7260,the request will happen need,1,
7261,the request year the se,1,
7262,the respons from canist store,1,
7263,the respons store ngm respond,1,
7264,the respons your want money,1,
7265,the rest the tire will,1,
7266,the return canist not give,1,
7267,the return credit voucher issuanc,1,
7268,the return imposs is disregard,1,
7269,the return it deliveri not,1,
7270,the return restitut my payment,1,
7271,the return send the correct,1,
7272,the return so far noth,1,
7273,the return still await respons,1,
7274,the return the money not,1,
7275,the return the product my,1,
7276,the return the product reimburs,1,
7277,the revers the card targaryen,1,
7278,the revers the high import,1,
7279,the right perfum my money,1,
7280,the right soon eras instruct,1,
7281,the rose region brush total,1,
7282,the sac phone answer machin,1,
7283,the sale the eve deliveri,1,
7284,the sale to pay without,1,
7285,the same came amend small,1,
7286,the same chair anoth site,1,
7287,the same crap want chang,1,
7288,the same receiv one bag,1,
7289,the same the purchas gt,1,
7290,the same time ask the,1,
7291,the same turn and sever,1,
7292,the samsung brand much neglect,1,
7293,the screen are wait stock,1,
7294,the screen gave work concert,1,
7295,the screen the product is,1,
7296,the screen wa alreadi deliv,1,
7297,the screen wa smaller the,1,
7298,the se the mail my,1,
7299,the seal glu the packag,1,
7300,the second day use simpli,1,
7301,the second feedback the seller,1,
7302,the second item len ol,1,
7303,the second of the error,1,
7304,the sede option prefer pay,1,
7305,the seller inform request the,1,
7306,the seller not give ani,1,
7307,the seller not take the,1,
7308,the seller so far had,1,
7309,the seller until hj give,1,
7310,the seller wait make the,1,
7311,the seller wait six day,1,
7312,the seller would like know,1,
7313,the seller you problem is,1,
7314,the sender canist com no,1,
7315,the separ the product compani,1,
7316,the servic have lot headach,1,
7317,the servic the deliveri the,1,
7318,the seven product bought receiv,1,
7319,the sheet alreadi paid noth,1,
7320,the ship box pack the,1,
7321,the ship code not get,1,
7322,the shirt induc think is,1,
7323,the shower deliv came without,1,
7324,the showtim second purchas realiz,1,
7325,the side the citi live,1,
7326,the side the citi paid,1,
7327,the singl blue marin mattress,1,
7328,the site addit not compat,1,
7329,the site ask deliv anoth,1,
7330,the site canist com not,1,
7331,the site canist think be,2,
7332,the site demand money back,1,
7333,the site differ the product,1,
7334,the site diverg product purchas,1,
7335,the site doe not fit,1,
7336,the site five the same,1,
7337,the site ha alreadi made,1,
7338,the site ha go the,1,
7339,the site imag one hundr,1,
7340,the site in the contact,1,
7341,the site inform the occurr,1,
7342,the site it alreadi happen,1,
7343,the site ll give back,1,
7344,the site lock the exact,1,
7345,the site miss the address,1,
7346,the site need help chang,1,
7347,the site nine eight still,1,
7348,the site not give the,1,
7349,the site say product deliv,1,
7350,the site the canist happen,1,
7351,the site the item exchang,1,
7352,the site the oper it,2,
7353,the site the product deliv,1,
7354,the site the store return,1,
7355,the site time the site,1,
7356,the site tri fill the,1,
7357,the site valu thi footag,1,
7358,the site wa deliv thi,1,
7359,the site wait the refer,1,
7360,the site well disappoint whenev,1,
7361,the situat understand the deliveri,1,
7362,the sixteenth the last time,1,
7363,the size the shirt induc,1,
7364,the size were sold paid,1,
7365,the skirt not straight equal,1,
7366,the skirt the cradl royalti,1,
7367,the small box prove receiv,1,
7368,the snake the time took,1,
7369,the solid state ivan oliv,1,
7370,the sound low and earli,1,
7371,the southern region live salvador,1,
7372,the stark not respons the,1,
7373,the stark websit not print,1,
7374,the stark websit not updat,1,
7375,the stark websit realli disappoint,1,
7376,the statu state deliv alway,1,
7377,the statu where wa if,1,
7378,the sticker card came without,1,
7379,the stipul deadlin did come,1,
7380,the stipul deadlin use money,1,
7381,the store as doorway commit,1,
7382,the store continu without product,1,
7383,the store detail still arriv,1,
7384,the store did put surnam,1,
7385,the store expect qualiti watch,1,
7386,the store fault someth be,1,
7387,the store given did answer,1,
7388,the store hope they solv,1,
7389,the store is neg precis,1,
7390,the store it the first,1,
7391,the store make the exchang,1,
7392,the store never problem hope,1,
7393,the store not say anyth,1,
7394,the store noth complain the,1,
7395,the store question receiv one,1,
7396,the store receiv return the,1,
7397,the store relat the avail,2,
7398,the store return me posit,1,
7399,the store take but go,1,
7400,the store the product came,1,
7401,the store to thi revenu,1,
7402,the store to use anoth,1,
7403,the store with the canist,1,
7404,the store with you want,1,
7405,the store you just want,1,
7406,the street not pass car,1,
7407,the strike delay occur unfortun,1,
7408,the strike truck driver it,1,
7409,the structur alreadi crack product,1,
7410,the sub nica never thi,1,
7411,the supplier respons what should,1,
7412,the supplier week no qualiti,1,
7413,the support the top bad,1,
7414,the system ineffici doe offer,1,
7415,the tablecloth without anoth four,1,
7416,the tast open thought could,1,
7417,the tea infus german design,1,
7418,the techno gadget mega tg,1,
7419,the test product not work,1,
7420,the third receiv two packag,1,
7421,the thirti two card they,1,
7422,the three product far one,1,
7423,the three purchas item were,1,
7424,the three sent one unit,1,
7425,the three smart televis have,1,
7426,the time bought yet have,1,
7427,the time not deliv cover,1,
7428,the time purchas bought gray,1,
7429,the time purchas clear it,1,
7430,the time purchas sixteen eight,1,
7431,the time purchas written it,1,
7432,the time the consign the,1,
7433,the time the product post,1,
7434,the time took of the,1,
7435,the tire will return money,1,
7436,the top bad slip had,1,
7437,the top seem good the,1,
7438,the total valu the furnitur,1,
7439,the tower realli want return,1,
7440,the track car tractor train,1,
7441,the track ha alreadi deliv,2,
7442,the track inform appear the,1,
7443,the track say ve chang,1,
7444,the transact made their site,1,
7445,the twenti five otherwis would,1,
7446,the twenti fourth the product,1,
7447,the twenti one the voic,1,
7448,the twenti three four today,1,
7449,the twenti two are alreadi,1,
7450,the twenti unit wait see,1,
7451,the two afraid not give,1,
7452,the two book purchas have,1,
7453,the two bought not work,1,
7454,the two button the right,1,
7455,the two day mention not,1,
7456,the two far did get,1,
7457,the two hundr twenti voltag,1,
7458,the two item disappoint almost,1,
7459,the two luminari simpli not,1,
7460,the two made the complaint,1,
7461,the two miss unit be,1,
7462,the two safe gave certain,1,
7463,the undef clock bought for,1,
7464,the undertak the compani the,1,
7465,the valid win in juli,1,
7466,the valu alreadi paid total,1,
7467,the valu had calcul came,1,
7468,the valu one spray unit,1,
7469,the valu proven two instal,1,
7470,the valu spent go the,1,
7471,the valu the cartridg not,1,
7472,the valu the product came,1,
7473,the valu the product deliv,1,
7474,the valu the product purchas,1,
7475,the vase do not recommend,1,
7476,the voic appear one vial,1,
7477,the voic are two unit,2,
7478,the voic arriv one the,1,
7479,the voic came differ the,2,
7480,the voic came the three,1,
7481,the voic found strang addit,1,
7482,the voic list the two,1,
7483,the voic my card unfortun,1,
7484,the voic onli issu the,1,
7485,the voic os two one,1,
7486,the voic relat the total,1,
7487,the voic say had two,1,
7488,the voic the amount two,1,
7489,the voic the note issu,1,
7490,the voic they are hope,1,
7491,the voltag one hundr twenti,1,
7492,the volum ha blanket by,1,
7493,the vote seal leas the,1,
7494,the wa deliv me ve,1,
7495,the watch bad qualiti replica,1,
7496,the water ha alreadi stop,1,
7497,the way the seller amateur,1,
7498,the way to put old,1,
7499,the websit the canist never,1,
7500,the weekend alway bought at,1,
7501,the white plastic cover the,1,
7502,the whole screen scratch undo,1,
7503,the whole wood structur would,1,
7504,the worst qualiti those march,1,
7505,the worst they had wa,1,
7506,the worst thing that did,1,
7507,the writer the voic relat,1,
7508,the wrong amount miss two,1,
7509,the wrong color ask color,1,
7510,the wrong color bought in,1,
7511,the wrong color howev prefer,1,
7512,the wrong place receiv the,1,
7513,the wrong place the first,1,
7514,the wrong product submit purpos,1,
7515,the wrong roman numer the,1,
7516,the zenfon five selfi came,1,
7517,theft the voic are two,1,
7518,their client thi carrier no,1,
7519,their problem marathon hung the,1,
7520,them deliv did complaint so,1,
7521,them it effect did not,1,
7522,them realli need the other,1,
7523,them six two thousand eighteen,1,
7524,them the payment the purchas,1,
7525,them wa unforeseen post offic,1,
7526,then have to run reimburs,1,
7527,then light again ve chang,1,
7528,then put correct time minut,1,
7529,then report they not in,1,
7530,then the product send wa,1,
7531,then warn that no stock,1,
7532,there alway diverg deliveri problem,1,
7533,there an unforeseen deliveri request,1,
7534,there anoth wa be micro,1,
7535,there anticip without warn site,1,
7536,there delay carrier if the,1,
7537,there fifteen day the last,1,
7538,there inform there wa onli,1,
7539,there is no updat it,1,
7540,there may laps the time,1,
7541,there no one give support,1,
7542,there no way can answer,1,
7543,there problem distribut now anoth,1,
7544,there return against the supplier,1,
7545,there unforeseen deliveri in post,1,
7546,there wa onli one order,1,
7547,thermal bottl towel kit ten,1,
7548,thermal bottl yet arriv is,1,
7549,thermal brace abdomin shape hb,1,
7550,thermal cup the decor plate,1,
7551,these burn so littl just,1,
7552,these sold product confirm discount,1,
7553,these thing either me wa,1,
7554,they answer email want exchang,1,
7555,they are hope posit urgent,1,
7556,they creat not come sent,1,
7557,they deliv alreadi week they,1,
7558,they deliv no satisfact the,1,
7559,they deliv one do get,1,
7560,they deliv product not more,1,
7561,they deliv product wa birthday,1,
7562,they deliv simpl wait the,1,
7563,they do not exchang mine,1,
7564,they do sell hygien kit,1,
7565,they gave anoth one not,1,
7566,they gave anoth tri contact,1,
7567,they gave as the full,1,
7568,they gave deliveri forecast the,1,
7569,they go do they return,1,
7570,they had wa one hundr,1,
7571,they inform would forti eight,1,
7572,they left send to make,1,
7573,they logist problem they would,1,
7574,they not deliv my hous,1,
7575,they not in stock on,1,
7576,they not maintain direct commun,1,
7577,they not warn want my,1,
7578,they or in stock time,1,
7579,they protein creat onli they,1,
7580,they put that receiv will,1,
7581,they recharg request return sent,1,
7582,they return money resent product,1,
7583,they said my address wrong,1,
7584,they said onli the envelop,1,
7585,they say product deliv at,1,
7586,they send the worst they,1,
7587,they sent in wrong color,1,
7588,they sent is well the,1,
7589,they sent product ching ling,1,
7590,they sent receiv name book,1,
7591,they sent that wa deliv,1,
7592,they sent the casino vintag,1,
7593,they sent the round model,1,
7594,they sent two parallel unit,1,
7595,they sent two separ filter,1,
7596,they show onli one post,1,
7597,they so paid who choos,1,
7598,they solv problem soon the,1,
7599,they tell that will send,1,
7600,they told that canist respons,1,
7601,they want do solv problem,1,
7602,they went and the other,1,
7603,they worthi peopl accord consum,1,
7604,they would cancel deliveri they,1,
7605,they would send it not,1,
7606,thi anxiou doll we back,1,
7607,thi besid everyth the color,1,
7608,thi carrier no respect anyon,1,
7609,thi come ye product not,1,
7610,thi compani not indic third,1,
7611,thi day five seventeen two,1,
7612,thi day frame not arriv,1,
7613,thi day product not deliv,1,
7614,thi dubiou product await urgent,1,
7615,thi feat not yet happen,1,
7616,thi footag that they sent,1,
7617,thi glass frame of poor,1,
7618,thi item remind of song,1,
7619,thi kind problem dissatisfi want,1,
7620,thi lack respect the consum,1,
7621,thi last purchas make asham,1,
7622,thi link came custom support,1,
7623,thi meet person need be,1,
7624,thi morn call central canist,1,
7625,thi not happen embarrass the,1,
7626,thi one month delay never,1,
7627,thi partner to design imag,1,
7628,thi possibl veri seriou transport,1,
7629,thi problem stark are go,1,
7630,thi problem trust the site,1,
7631,thi product is lower the,1,
7632,thi product launch voic gave,1,
7633,thi purchas bought onc had,1,
7634,thi purchas until today order,1,
7635,thi reason do recommend the,1,
7636,thi reason want money back,1,
7637,thi revenu the valu the,1,
7638,thi site thi time disappoint,1,
7639,thi situat pleas give some,1,
7640,thi store bought tabl eas,1,
7641,thi store canist pleas post,1,
7642,thi store charg for freight,1,
7643,thi store stark would remov,1,
7644,thi store tri make purchas,1,
7645,thi store zero qualif do,1,
7646,thi supplier ha post product,1,
7647,thi targaryen partner the purchas,1,
7648,thi time did get product,1,
7649,thi time did receiv neg,1,
7650,thi time did receiv shame,1,
7651,thi time disappoint need urgent,1,
7652,thi time made wrong choos,1,
7653,thi time product came miss,1,
7654,thi time product not yet,1,
7655,thi time receiv differ what,1,
7656,thi time receiv merchandis would,1,
7657,thi time unfortun did not,1,
7658,thi type product sinc deliv,1,
7659,thi would give headach all,1,
7660,thick horribl materi passim everi,1,
7661,thick realiti consum larg bag,1,
7662,thicker rough fabric alreadi request,1,
7663,thin fabric noth do fuzzi,1,
7664,thin narrow am veri dissatisfi,1,
7665,thin not wipe unfortun will,1,
7666,thin quilt ye are for,1,
7667,thin simpl dishwash can dead,1,
7668,thin thick horribl materi passim,1,
7669,thin veri simpl do know,1,
7670,thing either me wa not,1,
7671,thing it will not fit,1,
7672,thing receiv anoth alreadi sent,1,
7673,thing sent anoth still smaller,1,
7674,thing that did work came,1,
7675,thing the voic appear one,1,
7676,thing there anoth wa be,1,
7677,thing they gave anoth one,1,
7678,thing thi site well attend,1,
7679,think be insur mere mistak,2,
7680,think bed came mattress cover,1,
7681,think choos the partner have,1,
7682,think deliveri time too long,1,
7683,think is least necessari feedback,1,
7684,think is singl size the,1,
7685,think it worth buy internet,1,
7686,think it would arriv time,1,
7687,think paint kit origin it,1,
7688,think should explain better is,1,
7689,think should send product soon,1,
7690,think should send the custom,1,
7691,think to befor return buy,1,
7692,think would get three busi,1,
7693,think would like photo it,1,
7694,thinner fragil cuba sever wonder,1,
7695,third parti sell fals product,1,
7696,third receiv two packag the,1,
7697,third targaryen compani reliabl seen,1,
7698,third time complain noth done,1,
7699,thirteen eight state it not,1,
7700,thirteen thirti three forti two,1,
7701,thirteen thousand one hundr twenti,1,
7702,thirti box nine nineti onli,1,
7703,thirti day deliv small product,1,
7704,thirti day deliveri noth accord,1,
7705,thirti day noth the chair,1,
7706,thirti day tel seven billion,1,
7707,thirti day wait the product,1,
7708,thirti eight compani is take,1,
7709,thirti eight hundr four pond,1,
7710,thirti eight thousand seven hundr,1,
7711,thirti eight wide fourteen thick,1,
7712,thirti four far not receiv,1,
7713,thirti four skate receiv size,1,
7714,thirti four surrend hj alreadi,1,
7715,thirti four two thousand eighteen,1,
7716,thirti nine thousand three hundr,1,
7717,thirti now neither note issu,1,
7718,thirti one it came wrong,1,
7719,thirti one million nine hundr,1,
7720,thirti one thirti two should,1,
7721,thirti packag came damag crack,1,
7722,thirti ranger and receiv twenti,1,
7723,thirti seven nineti five request,1,
7724,thirti seven so far have,1,
7725,thirti sistema noth need cancel,1,
7726,thirti three forti two twenti,1,
7727,thirti three nineti today thirti,1,
7728,thirti three zero sight understood,1,
7729,thirti two card they send,1,
7730,thirti two deliv cabl iphon,1,
7731,thirti two height forti five,1,
7732,thirti two million two hundr,1,
7733,thirti two thousand eighteen sent,1,
7734,thirtyxthirti kit in the first,1,
7735,those march twenti five thirti,1,
7736,those receiv one broken came,1,
7737,thought deliveri would made same,1,
7738,thought mail lost order they,1,
7739,thought wa buy america far,1,
7740,thought wa first photo did,1,
7741,thought would deliv the deadlin,1,
7742,thought would get same home,1,
7743,thought would see two onli,1,
7744,thought wrong but mistak wa,1,
7745,thousand convert marathon and call,1,
7746,thousand eight hundr eight neckti,1,
7747,thousand eighteen be deliv five,1,
7748,thousand eighteen did receiv product,1,
7749,thousand eighteen far noth will,1,
7750,thousand eighteen have receiv product,1,
7751,thousand eighteen hope explain today,1,
7752,thousand eighteen in deliveri the,1,
7753,thousand eighteen made purchas two,1,
7754,thousand eighteen my tabl yet,1,
7755,thousand eighteen num happen all,1,
7756,thousand eighteen paid valu product,1,
7757,thousand eighteen receiv one case,1,
7758,thousand eighteen request compel amount,1,
7759,thousand eighteen sent sever email,1,
7760,thousand eighteen sixteen two sao,1,
7761,thousand eighteen so far have,1,
7762,thousand eighteen so far noth,3,
7763,thousand eighteen so far ten,1,
7764,thousand eighteen than month the,1,
7765,thousand eighteen the credit card,1,
7766,thousand eighteen the inicio amor,1,
7767,thousand eighteen today are eight,1,
7768,thousand eighteen today day six,1,
7769,thousand eighteen until present date,1,
7770,thousand eighteen want reimburs the,1,
