,phrases,frequency,English
4887,request the money wa return,1,
4888,request the nf came recipi,1,
4889,request the post offic onli,1,
4890,request the product not adapt,1,
4891,request the product not the,1,
4892,request the reimburs the differ,1,
4893,request the releas evolut want,1,
4894,request the return credit voucher,1,
4895,request the return it deliveri,1,
4896,request the return restitut my,1,
4897,request the return send the,1,
4898,request the return still await,1,
4899,request the return the product,1,
4900,request the same receiv one,1,
4901,request the site the item,1,
4902,request the time bought yet,1,
4903,request they creat not come,1,
4904,request three five hundr million,1,
4905,request three hundr revolut base,1,
4906,request three scale delay deliveri,1,
4907,request three unit it came,1,
4908,request two item onli one,1,
4909,request two luminari onli receiv,1,
4910,request two product deliv one,1,
4911,request two progress kit onli,1,
4912,request two purchas item came,1,
4913,request two six hundr seventi,1,
4914,request two two gig came,1,
4915,request vfd forward anoth control,1,
4916,request wa incomplet order two,1,
4917,request will happen need the,1,
4918,request will think to befor,1,
4919,request within deadlin alreadi request,1,
4920,request within seven day accord,1,
4921,request without warn left bad,1,
4922,request year the se the,1,
4923,request yet deliv wa charg,1,
4924,research singl bed one hundr,1,
4925,resent mi leagu eighti one,1,
4926,resent product not an answer,1,
4927,resid had go the cours,1,
4928,resid have voic you want,1,
4929,resid is alreadi few day,1,
4930,resid my parent readi no,1,
4931,resid postal complain anyon home,1,
4932,resid product at post offic,1,
4933,resid product deliv the post,1,
4934,resid twenti four hour person,1,
4935,resid will to trigger the,1,
4936,resid ye product had made,1,
4937,resolv will want money back,1,
4938,respect consider toward custom perceiv,1,
4939,respect consum final stay await,1,
4940,respect consum send color well,1,
4941,respect custom been than month,1,
4942,respect the client not judg,1,
4943,respect the consum buy want,1,
4944,respect the custom they so,1,
4945,respect the custom today product,1,
4946,respect total misinform the custom,1,
4947,respond email phone contact not,1,
4948,respond email they want do,1,
4949,respond forti eight hour bought,1,
4950,respond me casino watch market,1,
4951,respond my complaint do not,1,
4952,respond my contact horribl store,1,
4953,respond of truck driver strike,1,
4954,respond send wrong request doe,1,
4955,respond the email would given,1,
4956,respond the messag left the,1,
4957,respond urgent is the third,1,
4958,respons and omit want money,1,
4959,respons custom product origin qualiti,1,
4960,respons custom simpli not answer,1,
4961,respons did arriv the destin,1,
4962,respons my question not receiv,1,
4963,respons onli request came wrong,1,
4964,respons receiv good which were,1,
4965,respons say deliveri estim from,1,
4966,respons store ngm respond me,1,
4967,respons the canist store an,1,
4968,respons the deadlin the last,1,
4969,respons the product came the,1,
4970,respons the transact made their,1,
4971,respons wa satisfi thi product,1,
4972,respons your want money back,1,
4973,rest the request in hurri,1,
4974,rest the tire will return,1,
4975,result have six ident piec,1,
4976,result no impress wa cancel,1,
4977,result wa satisfactori both parti,1,
4978,result will open canist well,1,
4979,return aid the return the,1,
4980,return alia know what do,1,
4981,return alway inform have commun,1,
4982,return am alreadi open complaint,1,
4983,return ask white red rose,1,
4984,return but they not respond,1,
4985,return canist not give thi,1,
4986,return card troubl doe appear,1,
4987,return contact twenti one nine,1,
4988,return could onli two day,1,
4989,return could receiv feel fool,1,
4990,return did like product came,1,
4991,return exchang process know would,1,
4992,return exchang reimburs receiv rectronum,1,
4993,return exchang will make stay,1,
4994,return feel injur fals product,1,
4995,return imposs is disregard the,1,
4996,return incred it seem alreadi,1,
4997,return it been four day,1,
4998,return it deliveri not consist,1,
4999,return mail doe not answer,1,
5000,return mail sent not contact,1,
5001,return me next day say,1,
5002,return merchandis store reject request,1,
5003,return money had alreadi sent,1,
5004,return money resent product not,1,
5005,return my call is open,1,
5006,return my messag the return,1,
5007,return my money not receiv,1,
5008,return my purchas the product,1,
5009,return my request disappoint the,1,
5010,return new receipt addit increas,1,
5011,return not talk anyon either,1,
5012,return one time per deliveri,1,
5013,return product alreadi request return,1,
5014,return product canist websit not,1,
5015,return product even alreadi enter,1,
5016,return product receiv money back,1,
5017,return product receiv the amount,1,
5018,return product replac nobodi return,1,
5019,return product sent plastic that,1,
5020,return product sinc it dispatch,1,
5021,return product six seven two,1,
5022,return product so far have,1,
5023,return product the payment revers,1,
5024,return product want purchas revers,1,
5025,return protocol low qualiti product,1,
5026,return purchas seller the chair,1,
5027,return receipt the product the,1,
5028,return receiv deadlin get client,1,
5029,return receiv money back am,1,
5030,return receiv not know it,1,
5031,return receiv voucher purchas the,1,
5032,return recipi fifteen day still,1,
5033,return request bought film the,1,
5034,return request do buy store,1,
5035,return request reimburs the film,1,
5036,return request within seven day,1,
5037,return revers the valu the,1,
5038,return send the correct product,1,
5039,return sent seven sixteen noth,1,
5040,return sinc day receiv so,1,
5041,return sinc scholarship measur not,1,
5042,return site contact doe respond,1,
5043,return so far did get,1,
5044,return so far nda still,1,
5045,return sold friend lose money,1,
5046,return sometim take the product,1,
5047,return still await respons wa,1,
5048,return the amount paid even,1,
5049,return the amount paid my,1,
5050,return the amount paid ret,1,
5051,return the day until today,1,
5052,return the money can not,1,
5053,return the money not get,1,
5054,return the ombudsman phone number,1,
5055,return the product arriv and,1,
5056,return the product my money,1,
5057,return the product reimburs the,1,
5058,return the product the site,1,
5059,return the product they inform,1,
5060,return the product well the,1,
5061,return the product you noth,1,
5062,return the refer request now,1,
5063,return the seller until hj,1,
5064,return the sender canist com,1,
5065,return the site nine eight,1,
5066,return the store continu without,1,
5067,return the store in troubl,1,
5068,return the store make the,1,
5069,return the valu proven two,1,
5070,return the valu the cartridg,1,
5071,return the valu the product,1,
5072,return the valu the purchas,1,
5073,return upset should use the,1,
5074,return wait anoth time to,1,
5075,return will cancel request revers,1,
5076,return without want paid two,1,
5077,return you made cancel request,1,
5078,revenu the credit card await,1,
5079,revenu the valu the card,1,
5080,revers alreadi anoth product the,1,
5081,revers my card sinc the,1,
5082,revers note it three month,1,
5083,revers payment no one return,1,
5084,revers payment the credit card,1,
5085,revers product came burn doe,1,
5086,revers the card await urgent,1,
5087,revers the card targaryen never,1,
5088,revers the high import spent,1,
5089,revers the valu the account,1,
5090,revers valu hold each purchas,1,
5091,revers want money back soon,1,
5092,revolut base region powder paid,1,
5093,rhineston stress arriv defect anoth,1,
5094,ridicul site not deliv sell,1,
5095,ridicul small size regret purchas,1,
5096,ridicul work system thi store,1,
5097,right anoth purchas so far,1,
5098,right get error got touch,1,
5099,right product felt cheat it,1,
5100,right product sent guidanc owe,1,
5101,right repent return product receiv,1,
5102,right soon eras instruct english,1,
5103,right test product fulfil promis,1,
5104,right time did come within,1,
5105,right tri deliv the wrong,1,
5106,right want return terribl purchas,1,
5107,right want the right perfum,1,
5108,rio de janeiro capit cep,1,
5109,rip seat curli white part,1,
5110,risk accid emin the network,1,
5111,risk health thi dubiou product,1,
5112,risk product descript not match,1,
5113,rival correct law one hundr,1,
5114,rm forti seven control receiv,1,
5115,rod dismiss unrank the product,1,
5116,role am doubt not use,1,
5117,roll beig flower horribl ugli,1,
5118,roll receiv one naestou get,1,
5119,roll respect the custom today,1,
5120,roll sent onli one merchandis,1,
5121,roll wall paper announc receiv,1,
5122,roll you send it ll,1,
5123,roller go have babi next,1,
5124,roller not receiv appear if,1,
5125,roman numer the number four,1,
5126,room all cost two hundr,1,
5127,room report the sale badli,1,
5128,rose come it differ the,1,
5129,rose gold watch what arriv,1,
5130,rose region brush total differ,1,
5131,rough fabric alreadi request return,1,
5132,rough thin beauti mislead advertis,1,
5133,round brown carpet receiv rectangular,1,
5134,rout open the packag the,1,
5135,royalti wa not deliv far,1,
5136,rua rival correct law one,1,
5137,rubber leav extrem strong smell,1,
5138,rug my car arriv cover,1,
5139,rug onli receiv four miss,1,
5140,rug qualiti dirti to touch,1,
5141,rule brazil consum buy pay,1,
5142,ruler total scale ha use,1,
5143,run an uncommic store still,1,
5144,run reimburs do not recommend,1,
5145,run six fifteen two thousand,1,
5146,rush voic the quantiti bad,1,
5147,rusti compon it urgent need,1,
5148,sabatini the box without seal,1,
5149,sac phone answer machin not,1,
5150,sac you can talk anyon,1,
5151,sad ask clock cancel order,1,
5152,sad moment sent email make,1,
5153,sad need the lens saturday,1,
5154,sad tri get purchas return,1,
5155,safari set came white did,1,
5156,safe gave certain deliveri man,1,
5157,safeti mode cost one hundr,1,
5158,said can do anyth run,1,
5159,said canist super faith hi,1,
5160,said did have right product,1,
5161,said empti cardboard box without,1,
5162,said had merchandis stock three,1,
5163,said he deliv merchandis without,1,
5164,said he on way anoth,1,
5165,said my address wrong alreadi,1,
5166,said not want anoth model,1,
5167,said nutrit tabl is mislead,1,
5168,said onli the envelop arriv,1,
5169,said receiv two did accept,1,
5170,said serv nine thousand five,1,
5171,said solv forti eight hour,1,
5172,said the manual the devic,1,
5173,said they do sell hygien,1,
5174,said they went and the,1,
5175,said three bottl await compani,1,
5176,said two product would come,1,
5177,said wa origin the watch,1,
5178,said wa problem the mail,1,
5179,said wa their problem marathon,1,
5180,said were go call and,1,
5181,said would arriv four twenti,1,
5182,said would deliv eight day,1,
5183,sale box that is for,1,
5184,sale cancel at time seller,1,
5185,sale counterfeit use cartridg messag,1,
5186,sale divid two part not,1,
5187,sale have alreadi request purchas,1,
5188,sale he not product stock,1,
5189,sale is imposs know purchas,1,
5190,sale the eve deliveri wait,1,
5191,sale to pay without the,1,
5192,same bracelet alreadi hover then,1,
5193,same but thread differ one,2,
5194,same came amend small spider,1,
5195,same chair anoth site friend,1,
5196,same crap want chang could,1,
5197,same day purchas receiv email,1,
5198,same day use alreadi fill,1,
5199,same effect the expens reduct,1,
5200,same home receiv email send,1,
5201,same model advertis impress had,1,
5202,same my previou purchas hot,1,
5203,same product first time purchas,1,
5204,same product in stark competitor,1,
5205,same product not receiv ridicul,1,
5206,same product wa anoth problem,1,
5207,same receiv as investig reput,1,
5208,same receiv came defect lost,1,
5209,same receiv one bag one,1,
5210,same request ask revers payment,1,
5211,same shown phone not curricular,1,
5212,same supplier purchas four len,1,
5213,same the photo differ hate,1,
5214,same the purchas gt key,1,
5215,same time ask the cancel,1,
5216,same turn and sever time,1,
5217,sampl the product receiv base,1,
5218,samsung brand much neglect consum,1,
5219,samsung model product refer seven,1,
5220,samsung six came total wrong,1,
5221,samsung stand wireless arriv fine,1,
5222,samsung ten one receiv samsung,1,
5223,sand assist report the problem,1,
5224,sand rec diff the announc,1,
5225,sanitari water is harmoni color,1,
5226,sao paulo sp object deliv,1,
5227,satisfact alreadi sent sever email,1,
5228,satisfact compani in the statu,1,
5229,satisfact disappoint not want buy,1,
5230,satisfact give want money back,1,
5231,satisfact given hope return receipt,1,
5232,satisfact so not fulfil canist,1,
5233,satisfact the store given did,1,
5234,satisfact wa dissatisfi the purchas,1,
5235,satisfactori both parti do not,1,
5236,satisfi deliveri wait you still,1,
5237,satisfi qualiti the product the,1,
5238,satisfi request arriv deadlin when,1,
5239,satisfi the qualiti the product,1,
5240,satisfi the servic the deliveri,1,
5241,satisfi thi product is lower,1,
5242,satisfi watch the import of,1,
5243,saturday nine six onli receiv,1,
5244,save imag lost one hundr,1,
5245,saw car enter safeti mode,1,
5246,saw fool lid alreadi turn,1,
5247,saw it not the model,1,
5248,saw it similar product it,1,
5249,say anyth absurd paid it,1,
5250,say anyth end the subjectless,1,
5251,say are difficulti the infer,1,
5252,say can not faster bad,1,
5253,say clock what good such,1,
5254,say cooler compat my purifi,1,
5255,say deliv five tool receiv,1,
5256,say deliveri estim from the,1,
5257,say did have stock should,1,
5258,say ha alreadi deliv they,1,
5259,say had done dash even,1,
5260,say if do not respond,1,
5261,say is the board five,1,
5262,say it felpudo with than,1,
5263,say it would not be,1,
5264,say lot time stark buy,1,
5265,say mairi brand the photo,1,
5266,say one sixti cabl the,1,
5267,say product deliv at first,1,
5268,say product deliv cascad pr,1,
5269,say the merchandis not yet,1,
5270,say the part super thin,1,
5271,say the product goe to,1,
5272,say the screen are wait,1,
5273,say ve chang wait get,1,
5274,say wa deliv day twenti,1,
5275,say wa deliv the two,1,
5276,say wa deliv you see,1,
5277,say without preserv dye when,1,
5278,scale delay deliveri receiv one,1,
5279,scale ha use distanc fifti,1,
5280,scale it came spoil chang,1,
5281,scale onli receiv one sent,1,
5282,scale rush voic the quantiti,1,
5283,scandal maria kit the name,1,
5284,scanner not work need make,1,
5285,scatter the product chemic fertil,1,
5286,scent fixat the lid came,1,
5287,schedul be deliv date twenti,1,
5288,schedul thirti four far not,1,
5289,scholarship measur not the same,1,
5290,scratch necklac the loos metal,1,
5291,scratch seem the product alreadi,1,
5292,scratch undo lot download applic,1,
5293,scratch want return the product,1,
5294,screen are wait stock when,1,
5295,screen be fals cut the,1,
5296,screen bulg film not adher,1,
5297,screen scratch undo lot download,1,
5298,screen the microwav button goe,1,
5299,screen the product is close,1,
5300,screen wa smaller the two,1,
5301,screw fix the all rusti,1,
5302,screw miss support support backer,1,
5303,screw still fit the vase,1,
5304,sd card did come like,1,
5305,sd hc outdat version the,1,
5306,sd xc chip came micro,1,
5307,sd xc class ten card,1,
5308,sdclassetencom card sand rec diff,1,
5309,se the mail my citi,1,
5310,seal arriv came print the,1,
5311,seal box look ok perfum,1,
5312,seal box the clock box,1,
5313,seal box wa one one,1,
5314,seal came the amount product,1,
5315,seal coupl marketplac togeth sale,1,
5316,seal did like and have,1,
5317,seal glu the packag much,1,
5318,seal ha sticker auto adhes,1,
5319,seal leas the packag dirti,1,
5320,seal packag open observ perfum,1,
5321,seal packag tri make exchang,1,
5322,seal receiv three doll are,1,
5323,seal the lid do not,1,
5324,seam made without qualiti do,1,
5325,search the internet discov it,1,
5326,season ink it not almost,1,
5327,seat backer feet screw miss,1,
5328,seat curli white part so,1,
5329,seat fit properli came without,1,
5330,second day use simpli undermin,1,
5331,second feedback the seller it,1,
5332,second gener processor old outdat,1,
5333,second item len ol better,1,
5334,second ll get touch proton,1,
5335,second order doe arriv the,1,
5336,second problem problem other cancel,1,
5337,second purchas realiz the second,1,
5338,second the condit the first,1,
5339,second time bought same product,1,
5340,second time buy same product,1,
5341,second time did receiv product,1,
5342,second time had problem deliveri,1,
5343,second time make purchas first,1,
5344,second time write bought three,1,
5345,sede brought one and voic,1,
5346,sede option prefer pay twenti,1,
5347,sede ten someth like wait,1,
5348,see detail the deliveri address,1,
5349,see had happen so far,1,
5350,see in shop distribut to,1,
5351,see it arriv time wait,1,
5352,see it go be charg,1,
5353,see lack four magnet sensor,1,
5354,see replac the product get,1,
5355,see store chang the product,1,
5356,see targaryen canist partner said,1,
5357,see will return the money,1,
5358,seem alreadi request the releas,1,
5359,seem bad guy the store,1,
5360,seem be big when arriv,1,
5361,seem be greater not to,1,
5362,seem done home cushion came,1,
5363,seem fabric draw differ dead,1,
5364,seem good the bottom rubber,1,
5365,seem have alreadi use scratch,1,
5366,seem prod parallel report the,1,
5367,seem solut given site to,1,
5368,seem the product alreadi use,1,
5369,seem use product packag without,1,
5370,seen product have pay wait,1,
5371,seen the product he certainli,1,
5372,select purchas veri clear blue,1,
5373,sell book deliv anoth is,1,
5374,sell compromis consum confid the,1,
5375,sell hygien kit me get,1,
5376,sell onli one warn to,1,
5377,sell product doe have stock,1,
5378,sell product doe understand anyth,1,
5379,sell product without stock onli,1,
5380,sell two day tri contact,1,
5381,sell veri expens product the,1,
5382,sell want buy purchas know,1,
5383,sell when have problem in,1,
5384,seller cancel request without warn,1,
5385,seller inform request the product,1,
5386,seller not deliv product ask,1,
5387,seller not give ani satisfact,1,
5388,seller not return request return,1,
5389,seller not take the proper,1,
5390,seller noth comment the product,1,
5391,seller purchas the product were,1,
5392,seller so far had return,1,
5393,seller the chair came correct,1,
5394,seller the sixteenth the last,1,
5395,seller until hj give satisfact,1,
5396,seller wait make the exchang,1,
5397,seller wait six day later,1,
5398,seller would like know will,1,
5399,seller you problem is phone,1,
5400,semi automat price differ almost,1,
5401,send ani inform separ deliveri,1,
5402,send by email the contact,1,
5403,send contact partner push the,1,
5404,send evalu plu note everyth,1,
5405,send four twenti seven eighteen,1,
5406,send get the post offic,1,
5407,send incorrect gener problem return,1,
5408,send is doe same effect,1,
5409,send it not product stock,1,
5410,send item make the applianc,1,
5411,send mail make contact we,2,
5412,send miss one day win,1,
5413,send miss want quick immedi,1,
5414,send postal code that can,1,
5415,send product accord the advertis,1,
5416,send product compani differ post,1,
5417,send product configur of offer,1,
5418,send product der withdrawn the,1,
5419,send product ha yet arriv,1,
5420,send product sinc confirm payment,1,
5421,send product soon alway buy,1,
5422,send product took long time,1,
5423,send sede ten someth like,1,
5424,send the correct product so,1,
5425,send the custom turn to,1,
5426,send the direct link the,1,
5427,send the miss product the,1,
5428,send the other pf unit,1,
5429,send the product just sent,1,
5430,send the product thi time,1,
5431,send the remaind the purchas,1,
5432,send the rest the tire,1,
5433,send the voic the manual,1,
5434,send the worst they had,1,
5435,send voic product to deliv,1,
5436,send wa behind would not,1,
5437,send wrong request doe not,1,
5438,sender canist com no idea,1,
5439,sensor not work alreadi the,1,
5440,sensor wa four thousand one,1,
5441,sent an email say the,1,
5442,sent an voic stolen nobodi,1,
5443,sent anoth complet differ voic,1,
5444,sent anoth detalh had alreadi,1,
5445,sent anoth product behalf viniciu,1,
5446,sent anoth product ha noth,1,
5447,sent anoth product not contact,1,
5448,sent anoth product place bought,1,
5449,sent anoth product without even,1,
5450,sent anoth still smaller valu,1,
5451,sent anyway did revers valu,1,
5452,sent batgirl we alreadi my,1,
5453,sent blank made the exchang,1,
5454,sent broken crack made the,1,
5455,sent clock arriv watch wa,1,
5456,sent defect reason would have,1,
5457,sent doe serv my cell,1,
5458,sent email ask chang they,1,
5459,sent email ask forti eight,1,
5460,sent email ask what happen,1,
5461,sent email blame post offic,1,
5462,sent email inform still no,1,
5463,sent email inform that are,1,
5464,sent email make the exchang,1,
5465,sent email say did have,1,
5466,sent email so far one,1,
5467,sent email the compani no,1,
5468,sent fals damag you even,1,
5469,sent few day ago did,1,
5470,sent fulli divers merchandis the,1,
5471,sent gave color hate purchas,1,
5472,sent guarante the guarante came,1,
5473,sent in wrong color that,1,
5474,sent is well the amount,1,
5475,sent just one item the,1,
5476,sent mail complain that would,1,
5477,sent mail no one return,1,
5478,sent mail no one the,1,
5479,sent mail the compani accord,1,
5480,sent messag email websit canist,1,
5481,sent messag inform so far,1,
5482,sent messag not get answer,1,
5483,sent messag so far respons,1,
5484,sent messag store such situat,1,
5485,sent messag until today did,1,
5486,sent msg one answer one,1,
5487,sent my request back wait,1,
5488,sent not contact speak deliveri,1,
5489,sent not get respons the,1,
5490,sent not happen receiv by,1,
5491,sent one note came quantiti,1,
5492,sent one product did get,1,
5493,sent onli one merchandis paid,1,
5494,sent origin blumenau are ask,1,
5495,sent out origin packag insid,1,
5496,sent packag note do know,2,
5497,sent piston kit cg one,1,
5498,sent plastic that bought stainless,1,
5499,sent product anoth model total,1,
5500,sent product ching ling place,1,
5501,sent product close win expir,1,
5502,sent product return product want,1,
5503,sent receiv name book earli,1,
5504,sent red color discov return,1,
5505,sent refer mail delay product,1,
5506,sent sever email msg complaint,1,
5507,sent sever email no one,1,
5508,sent similar product inganosa propaganda,1,
5509,sent that advertis request return,1,
5510,sent that wa deliv the,1,
5511,sent the advertis templat noth,1,
5512,sent the casino vintag digit,1,
5513,sent the footag two zero,1,
5514,sent the of toast the,1,
5515,sent the packag want other,1,
5516,sent the product someon els,2,
5517,sent the product wa an,1,
5518,sent the southern region live,1,
5519,sent they sent in wrong,1,
5520,sent total differ product request,1,
5521,sent two curtain one one,1,
5522,sent two hundr twenti had,2,
5523,sent two hundr twenti nap,1,
5524,sent two parallel unit old,1,
5525,sent two separ filter one,1,
5526,sent two wrong tri get,1,
5527,sent voic the product not,1,
5528,sent within deadlin howev addit,1,
5529,sent without packag draw wa,1,
5530,sent wrong becaus ask chrome,1,
5531,sent wrong product now report,1,
5532,sent wrong product sent plate,1,
5533,separ deliveri the item deadlin,1,
5534,separ deliveri when open the,1,
5535,separ filter one the other,1,
5536,separ the product compani not,1,
5537,separ the store question receiv,1,
5538,separ would like know chang,1,
5539,seri two ye seri three,1,
5540,seriou problem deliveri the product,1,
5541,seriou transport without voic the,1,
5542,serv model two thousand nine,1,
5543,serv my cell phone immedi,1,
5544,serv nine thousand five hundr,1,
5545,serv noth me request the,1,
5546,serv vehicl parti two thousand,1,
5547,servant came poorli pack leak,1,
5548,servic canist com store make,1,
5549,servic deliveri even return my,1,
5550,servic far did solv problem,1,
5551,servic front respons the deadlin,1,
5552,servic never site the showtim,1,
5553,servic purchas the internet will,1,
5554,servic the canist the charger,1,
5555,servic the deliveri the product,1,
5556,set although appear the voic,1,
5557,set came white did like,1,
5558,set half the averag offer,1,
5559,set len ol king four,1,
5560,set sent the packag want,1,
5561,settl infus the compani deliv,1,
5562,setup chines not work correctli,1,
5563,seven are want cancel purchas,1,
5564,seven billion five hundr nineti,1,
5565,seven control receiv kdlforti one,1,
5566,seven day accord the consum,1,
5567,seven day one the and,1,
5568,seven day the combin date,1,
5569,seven deliveri forecast seven thirti,1,
5570,seven deliveri forecast the twenti,1,
5571,seven deliveri forecast twenti five,1,
5572,seven eight targaryen deliveri time,1,
5573,seven eighteen did receiv complet,1,
5574,seven four dual core android,1,
5575,seven four seven two thousand,1,
5576,seven ha yet arriv product,1,
5577,seven hundr and seventi one,1,
5578,seven hundr forti one appear,1,
5579,seven hundr sixti one receiv,1,
5580,seven is add have make,1,
5581,seven million eight hundr five,1,
5582,seven neither nf the product,1,
5583,seven nineti five request the,1,
5584,seven no posit the product,1,
5585,seven onli today wa warn,1,
5586,seven product bought receiv one,1,
5587,seven sent two hundr twenti,1,
5588,seven seven neither nf the,1,
5589,seven so far have receiv,1,
5590,seven the moment exchang had,1,
5591,seven thirti now neither note,1,
5592,seven thousand four hundr fifti,1,
5593,seven thousand nine hundr fifti,1,
5594,seven thousand six hundr twenti,1,
